{"run":342,"commit":"4c729a9","metric":6,"metrics":{},"status":"keep","description":"Baseline: _parse_entries fails on 6/10 common BibTeX patterns. Entry regex requires \\\\n\\\\s*\\\\} (closing brace on its own line), breaking all single-line entries. Field regex [^}]* breaks on nested braces. Field regex requires braces around values, ignoring unbraced fields like year=2024. Whitespace around entry keys also fails.","timestamp":1780626235765,"segment":179,"confidence":null,"asi":{"broken_patterns":["single-line entries (@article{k1, author={A}})","multi-entry files","entries with nested braces in field values","entries after comment lines","whitespace around entry keys","fields without braces (year = 2024)"],"failure_count":"6/10 common BibTeX patterns fail","fix_needed":"Replace \\n\\s*\\} anchor with (?:\\n\\s*|) to support both multiline and single-line closing braces. Fix field regex to handle nested braces and unbraced values.","hypothesis":"BibTeX _parse_entries has broken regex that fails on 6/10 common patterns","root_cause":"Entry regex requires \\n\\s*\\} (closing brace on its own line) — single-line entries fail silently. Field regex [^}]* breaks on nested braces. Field regex requires \\{...\\} — unbraced values like year=2024 ignored."}}
{"run":343,"commit":"1845445","metric":0,"metrics":{},"status":"keep","description":"Fix BibTeX _parse_entries: replaced naive regex with brace-depth-aware parser. Old parser failed on 6/10 patterns (single-line entries, multi-entry files, nested braces, comments, whitespace keys, unbraced values). New parser tracks brace depth for entry and field value matching. 12 regression tests added. 1207 tests pass.","timestamp":1780626539298,"segment":179,"confidence":null,"asi":{"baseline":"6/10 common BibTeX patterns failed to parse","fix":"Replaced naive regex with brace-depth-aware parser. Entry matching uses depth tracking instead of \\n\\s*\\} anchor. Field matching handles nested braces and unbraced values (year=2024, journal=\"Nature\").","hypothesis":"BibTeX _parse_entries has broken regex that fails on 6/10 common patterns","regression":"1207 passed, 0 failures (+12 new edge case tests)","remaining":"0/10 failures after fix"}}
{"run":344,"commit":"7d45d96","metric":0,"metrics":{},"status":"keep","description":"Fix same BibTeX parsing bug in bibtex_tidy.py and zotero_import.py. All 3 parsers now use brace-depth-aware parsing instead of naive \\\\n\\\\s*\\\\} regex. 0/15 failures across all parsers and patterns. 1207 tests pass.","timestamp":1780627181672,"segment":179,"confidence":null,"asi":{"baseline":"6/10 patterns failed in refs_metadata, same bug in bibtex_tidy and zotero_import","fix":"Replaced naive \\n\\s*\\} regex in all 3 BibTeX parsers with brace-depth-aware parser. All parsers now handle: single-line entries, multi-entry files, nested braces, unbraced values, whitespace-padded keys.","hypothesis":"BibTeX _parse_entries has broken regex that fails on 6/10 common patterns","regression":"1207 passed, 0 failures","scope":"3 parsers fixed: refs_metadata_validator.py, bibtex_tidy.py, zotero_import.py"}}
{"run":345,"commit":"30c7068","metric":0,"metrics":{},"status":"keep","description":"Fix citation_format.py parse_bib_keys: field regex [^}]* truncated on nested braces (e.g. {A {Bold} Title} → \"A {Bold}\"). Replaced with brace-depth tracking matching the other 3 parsers. Also handles unbraced values. 1207 tests pass.","timestamp":1780627379529,"segment":179,"confidence":null,"asi":{"bug":"citation_format.py parse_bib_keys used [^}]* for field values — truncated on first } inside nested braces like {A {Bold} Title}","fix":"Replaced field regex with brace-depth tracking matching the other 3 parsers","hypothesis":"citation_format.py has same nested braces bug in field parsing","regression":"1207 passed, 0 failures"}}
{"type":"config","name":"Fix citation_format.py parse_bib_keys edge cases","metricName":"parse_failures","metricUnit":"bugs","bestDirection":"lower"}
{"run":346,"commit":"5bcda8d","metric":3,"metrics":{},"status":"keep","description":"Baseline: parse_bib_keys fails on 3/7 edge cases. @string, @comment, @preamble get parsed as entries with garbage keys because the entry regex matches ALL @type{ patterns, not just real BibTeX entry types.","timestamp":1780627637139,"segment":180,"confidence":null,"asi":{"broken_patterns":["@string{ieee = {IEEE}} parsed as entry with key 'ieee = {IEEE}'","@comment{...} parsed as entry with garbage key","@preamble{...} parsed as entry with garbage key"],"hypothesis":"citation_format.py parse_bib_keys doesn't filter @string/@comment/@preamble","root_cause":"Entry regex r\"@\\w+\\{\" matches ALL @type{ patterns including @string, @comment, @preamble. Only article/book/inproceedings etc. are real entries."}}
{"run":347,"commit":"cb943af","metric":0,"metrics":{},"status":"keep","description":"Fix all 4 BibTeX parsers to skip @string/@comment/@preamble meta types. Old parsers treated these as entries with garbage keys. citation_format.py switched from lookahead regex to brace-depth parser. All 4 parsers now consistently filter meta types. 32 test cases pass. 1207 tests pass.","timestamp":1780628051198,"segment":180,"confidence":null,"asi":{"affected_files":["refs_metadata_validator.py","bibtex_tidy.py","zotero_import.py","citation_format.py"],"baseline":"3/7 edge cases failed (citation_format also consumed @string preventing @article from being found)","fix":"Added _META_TYPES frozenset filter to all 4 parsers. citation_format.py switched from lookahead regex to brace-depth parser matching the other 3.","hypothesis":"BibTeX parsers don't filter @string/@comment/@preamble meta types","regression":"1207 passed, 0 failures","scope":"4 parsers fixed, 32 test cases all pass"}}
{"type":"config","name":"Wire unwired validators through ToolWrappers","metricName":"unwired_validators","metricUnit":"count","bestDirection":"lower"}
{"type":"config","name":"Deep diff ARS vs paper-writer: map all structural gaps","metricName":"ars_gaps","metricUnit":"count","bestDirection":"lower"}
{"run":302,"commit":"d7d11b7","metric":7,"metrics":{},"status":"keep","description":"Baseline: ARS has 39 non-test/non-check scripts. Symbol cross-reference shows 7 with ZERO connectivity (arxiv_client, openalex_client, audit_snapshot, citation_verification_summary, parse_audit_verdict, policy_anchor_disclosure_referee, uncited_assertion_detector), 5 PARTIAL (contamination_signals 18%, crossref_client 25%, claim_audit_finalizer 25%, ars_write_scope_guard 33%, obsidian 17%), 14 FULL. False positives exist: FULL category includes modules where symbol names coincidentally match (e.g. temporal_integrity_audit shows 100% because class name 'AuditResult' matches our codebase, not because we have temporal verification).","timestamp":1780656710071,"segment":161,"confidence":null,"asi":{"hypothesis":"Symbol name cross-reference gives a rough baseline of ARS gaps","false_positives":"FULL category has false positives from common class names like AuditResult, validate, emit. temporal_integrity_audit shows 100% but has ZERO functional equivalence","next":"Deep-dive each of the 7 ZERO modules to understand capability gaps, then re-examine the 5 PARTIAL for functional equivalence vs name collision"}}
{"run":303,"commit":"f464f74","metric":15,"metrics":{},"status":"keep","description":"Corrected gap analysis with false-positive removal. Filtering generic symbol names (main, audit, validate, etc.) reveals 15 true gaps, not 7. Breakdown: 3 api_client (arxiv, openalex, crossref partial), 3 validator (audit_snapshot, parse_audit_verdict, uncited_assertion_detector), 2 pipeline (claim_audit_finalizer 25%, citation_verification_summary), 2 adapter (obsidian, folder_scan), 2 unknown (contamination_signals 18%, policy_anchor_disclosure_referee), 1 infrastructure (ars_write_scope_guard), 1 unknown (slr_lineage), 1 unknown (validate_compliance_fixtures). Key finding: crossref_client shows only 25% because our port restructured the API (CrossrefResult dataclass instead of bare returns). temporal_integrity_audit was a false positive (matched generic 'main' and 'audit').","timestamp":1780656872657,"segment":161,"confidence":null,"asi":{"hypothesis":"Filtering generic symbol names reveals true gap count","result":"7 -> 15 true gaps after removing false positives. Generic names like main/audit/validate inflated connectivity scores","false_positives_removed":"temporal_integrity_audit, verification_cache, verify_passport, bootstrap_timeline_yaml, ars_cache_invalidate, ars_mark_read — all matched generic symbol names but have zero functional equivalence","next":"For each of the 15 gaps, identify which exploration skill maps best. Use codebase-explorer for validator gaps, context7 for api_client gaps, librarian to cache ARS for ongoing reference","gap_categories":{"api_client":"arxiv + openalex = 2 new API sources to port. crossref is already ported but diverged","validator":"temporal_integrity was false positive but uncited_assertion and audit_snapshot are real","pipeline":"claim_audit has 6-step pipeline vs our 2-step (claims.py + claim_evidence.py)","infrastructure":"write_scope_guard is ARS-specific safety, not relevant to paper-writer","adapter":"obsidian + folder_scan = literature corpus ingestion paths we dont have"}}}
{"run":304,"commit":"2ec905f","metric":14,"metrics":{},"status":"keep","description":"Skill-to-gap mapping: 11 of 15 gaps are portable to paper-writer, 4 are ARS-specific (skip). Top exploration skills: context7 (3 gaps: arxiv/openalex clients + policy anchor disclosure), codebase-explorer (3 gaps: audit snapshot + obsidian + folder scan), cli-explorer (2 gaps: contamination signals + uncited assertions). Key architectural insight: the 4 missing claim-validation steps (pipeline orchestration, finalizer matrix, contamination, uncited assertions) form a coherent claim-faithfulness subsystem that maps to authority-flow-audit + code-path-cartographer skills.","timestamp":1780656961352,"segment":161,"confidence":null,"asi":{"hypothesis":"Skill-to-gap mapping reveals which exploration skills unlock the most ARS diff insight","result":"context7 and codebase-explorer each unlock 3 gaps. cli-explorer unlocks 2. 4 gaps are ARS-specific and can be skipped","portable_gaps":11,"skipped_gaps":"parse_audit_verdict (codex JSONL parser), ars_write_scope_guard (subagent safety), slr_lineage (ARS state tracker), validate_compliance_fixtures (ARS test infra)","top_skills":{"context7":"3 gaps — arxiv_client + openalex_client + policy_anchor_disclosure. Fetches API specs and journal AI policies","codebase-explorer":"3 gaps — audit_snapshot + obsidian + folder_scan. Explores our codebase for equivalent patterns","cli-explorer":"2 gaps — contamination_signals + uncited_assertion_detector. Quick rg for venue/citation-marker patterns"},"key_insight":"Our claim validation is 2 of ARS 6 steps (claims.py + claim_evidence.py). The 4 missing steps are: claim_audit_pipeline orchestration, finalizer matrix classification, contamination signals, and uncited assertion detection. These 4 form a coherent claim-faithfulness subsystem"}}
{"run":305,"commit":"41ba567","metric":4,"metrics":{},"status":"keep","description":"Deep trace of claim-faithfulness subsystem: paper-writer has 2 of ARS 6 steps. Our claims.py (validate + build_claims_report) and claim_evidence.py (compute_overlap + validate + check_claims) cover claim detection and evidence checking. Missing: (1) contamination_signals (445 loc, preprint/venue quality), (2) uncited_assertion_detector (255 loc, empirical claims without citations), (3) claim_audit_finalizer (442 loc, 8-row tier/annotation matrix + gate decision), (4) claim_audit_calibration (400 loc, FNR/FPR benchmarking). Total missing: 1542 loc across 4 modules. Key overlap: our prose rules (overclaim/weasel/vague) partially cover uncited assertion detection.","timestamp":1780657054234,"segment":161,"confidence":0.75,"asi":{"hypothesis":"The claim-faithfulness subsystem is the highest-value exploration target — a coherent 4-step gap vs ARS 6-step pipeline","result":"Our claims.py (2 fns) + claim_evidence.py (4 fns) = 6 functions. ARS has 6 modules with 23 fns + 17 classes. Our code covers 2 of 6 steps (claim detection + evidence checking). The 4 missing steps form a coherent subsystem: contamination detection, uncited assertions, finalizer matrix, and calibration","key_numbers":{"paper_writer_loc":"claims.py + claim_evidence.py = ~470 loc","ars_loc":"6 modules = 3084 loc (6.5x larger)","missing_steps":4,"covered_steps":2},"best_skills":{"contamination_signals":"cli-explorer — rg for venue/preprint patterns in our codebase","uncited_assertions":"cli-explorer — rg for citation markers in parsers/manuscript.py","finalizer_matrix":"authority-flow-audit — trace how our gates are decided vs their 8-row matrix","calibration":"codebase-explorer — find benchmark/gold-set infrastructure in ARS"},"next":"Use cli-explorer to check if our prose rules (overclaim/weasel/vague) partially cover the uncited assertion gap"}}
{"run":306,"commit":"33c39dc","metric":1,"metrics":{},"status":"keep","description":"Overlap analysis: prose rules vs uncited assertion detector. Our overclaim/weasel/vague rules detect the same WORDS (empirical verbs, quantifiers) but NEVER check citation presence. ARS has 3-condition rule: (1) quantifier/empirical verb, (2) no citation marker on sentence, (3) not definitional. Our rules only satisfy condition 1. The citation-presence check is the critical missing piece. parsers/manuscript.py extracts sentences but nothing checks per-sentence citation markers. Verdict: genuine gap, not covered by existing prose rules.","timestamp":1780657108029,"segment":161,"confidence":1,"asi":{"hypothesis":"Our prose rules (overclaim/weasel/vague) partially cover the uncited assertion detection gap","result":"FALSE — our prose rules flag WORDS as problematic but NEVER check citation presence. ARS uncited_assertion_detector has 3-condition rule: (1) quantifier/empirical verb present, (2) NO <!--ref:slug--> marker on sentence, (3) not definitional. Our rules satisfy condition 1 only. The citation-presence check (condition 2) is the key missing piece","overclaim_rules":"catches 'prove', 'confirm', 'establish', 'demonstrate' — overlaps ARS empirical verbs","weasel_rules":"catches 'most', 'several', 'many' — overlaps ARS quantifiers","critical_gap":"We have parsers/manuscript.py that extracts sentences but NO code checks for citation markers (<!--ref:slug-->) per sentence","next":"Explore contamination_signals with cli-explorer: check if our citation_verify.py or quality_appraisal.py does any venue-based quality assessment"}}
{"run":307,"commit":"0ac4ed4","metric":2,"metrics":{},"status":"keep","description":"Contamination signals gap analysis. Two genuine gaps found: (1) citation_verify.py checks DOI existence but NOT source quality/preprint venue type. Our quality_appraisal.py has venue tiers but focuses on ranking, not contamination detection. (2) Multi-resolver triangulation: ARS uses 4 resolvers (Crossref + S2 + arXiv + OpenAlex) vs our 2. Porting arXiv + OpenAlex clients would enable both contamination detection and better citation verification coverage.","timestamp":1780657154698,"segment":161,"confidence":1.5,"asi":{"best_skill":"cli-explorer (rg for venue/preprint patterns across validators, skills, and parsers)","hypothesis":"Our quality_appraisal.py partially covers contamination detection via venue tiers","result":"PARTIAL overlap. quality_appraisal.py has venue-based quality scoring (Tier 1-4 journals) but focuses on ranking quality, not detecting preprint/contamination. Two genuine gaps: (1) no preprint venue detection in citation_verify — it checks DOI existence but not source quality/type, (2) no multi-resolver triangulation — ARS uses 4 resolvers (Crossref + S2 + arXiv + OpenAlex) vs our 2 (Crossref + S2). The triangulation gap requires porting arXiv + OpenAlex clients first","dependency_chain":"contamination_signals → requires arxiv_client + openalex_client (both also gaps) → requires _text_similarity (already ported)","next":"Final exploration: use authority-flow-audit to trace our gate decision flow vs ARS finalizer 8-row matrix"}}
{"run":308,"commit":"a7e7211","metric":1,"metrics":{},"status":"keep","description":"Gate decision flow analysis: paper-writer uses boolean gates (pass/fail), ARS uses tiered gates with 4 severity levels (none/low_warn/med_warn/high_warn) + annotation strings + selective gate refusal. The 8-row finalizer matrix maps each finding to {annotation, tier, gate_refuse}, allowing warnings without blocking. Our GateResult is pass=True/False only — a minor prose style warning blocks the same as a fabricated reference. This is a structural gap affecting ALL validators, not just claims.","timestamp":1780657212389,"segment":161,"confidence":2,"asi":{"best_skill":"authority-flow-audit (trace gate decision flow)","hypothesis":"Our boolean gate system is sufficient for current validators","result":"STRUCTURAL GAP — our gates are boolean (pass/fail), ARS has tiered gates with 4 severity levels (none/low_warn/med_warn/high_warn) + annotation strings + selective gate refusal. The 8-row finalizer matrix maps each finding to {annotation, tier, gate_refuse}. This affects ALL validators, not just claims. Our GateResult is pass=True/False, ARS has graduated severity that allows warnings without blocking","our_flow":"validator → ValidatorResult → GateResult(pass=True/False) → state.yaml","ars_flow":"audit → classify_claim_audit_result → {annotation, tier, gate_refuse} → gate decision","impact":"Our verify command treats ALL gate failures equally. ARS distinguishes advisory warnings from blocking failures. This means our pipeline is more fragile — a minor prose style warning blocks the same as a fabricated reference","next":"Compile final gap report with skill recommendations"}}
{"run":309,"commit":"b3f3d29","metric":2,"metrics":{},"status":"keep","description":"Client structure comparison: ARS has 4 API clients (arXiv 200 loc, OpenAlex 175 loc, Crossref 204 loc, S2 273 loc). We have 2 (Crossref 227 loc, S2 192 loc). Porting estimate: OpenAlex LOW (same JSON pattern as crossref), arXiv MEDIUM (XML parsing with Atom namespace + 3s rate limit). Only 1 method shared (reset_outage_latch), 4 new methods needed. Discovery: our clients lack min_interval rate limiting that all 4 ARS clients have.","timestamp":1780657436588,"segment":161,"confidence":3,"asi":{"best_skill":"cli-explorer + codebase-explorer (compare client structures)","hypothesis":"ARS clients follow same pattern as our crossref.py — porting should be straightforward","result":"Mixed. OpenAlex is LOW complexity (same JSON pattern). arXiv is MEDIUM complexity (XML parsing via xml.etree.ElementTree + Atom namespace + 3s rate limit). Only 1 method shared across codebases (reset_outage_latch). 4 new methods needed: arxiv_id_lookup, doi_lookup_with_title_check, lookup, title_search. Key finding: our clients lack min_interval rate limiting that ALL 4 ARS clients have","shared_methods":1,"missing_methods":4,"porting_effort":{"openalex":"LOW — same JSON pattern, just different endpoint + response shape","arxiv":"MEDIUM — XML parsing with Atom namespace {http://www.w3.org/2005/Atom}, 3s min_interval, id_list vs search_query params"},"missing_in_our_clients":"min_interval rate limiting — ARS all 4 clients have it, our 2 don't","next":"Deep-dive arXiv XML parsing to understand exact Atom response shape"}}
{"run":310,"commit":"a05948f","metric":2,"metrics":{},"status":"keep","description":"Client porting deep-dive: our crossref.py pattern transfers directly to OpenAlex (same JSON pattern, ~120-150 loc new). arXiv is harder (XML parsing via ElementTree + Atom namespace, ~160-200 loc new). What transfers: HTTP client pattern, CrossrefResult dataclass pattern, _similarity threshold, _extract_title/_extract_year helpers. What's new: arXiv needs XML parsing + 3s rate limit + id_list params. Total porting estimate: ~10h for both clients.","timestamp":1780657522860,"segment":161,"confidence":6,"asi":{"best_skill":"codebase-explorer (compare client internals)","hypothesis":"Our crossref.py pattern transfers directly to OpenAlex and partially to arXiv","result":"CONFIRMED for OpenAlex (same JSON pattern). PARTIAL for arXiv (XML instead of JSON). Transferability matrix: HTTP client 100% reusable, title similarity 100% reusable (already ported _text_similarity.py). Key differences: arXiv uses ET.fromstring for XML with Atom namespace, OpenAlex uses JSON like Crossref. Our crossref.py has verify_doi + search_by_title — OpenAlex needs title_search equivalent. Porting estimates: OpenAlex ~120-150 loc new (4h), arXiv ~160-200 loc new (6h). Total ~10h","what_transfers":["CrossrefResult dataclass pattern → OpenAlexResult/ArxivResult","urlopen + error handling → 100% reusable","_similarity check → already ported from _text_similarity.py","_extract_title/_extract_year helpers → same pattern, different source"],"what_is_new":{"openalex":["api.openalex.org endpoint","results[] response shape","polite pool email in User-Agent"],"arxiv":["export.arxiv.org/api/query endpoint","ET.fromstring XML parsing + Atom namespace","id_list param for ID lookup","3s MIN_INTERVAL rate limiting","_extract_title from XML <title> element"]},"next":"Final exploration: trace how contamination_signals CONSUMES these clients to understand the integration contract"}}
