{"run":380,"commit":"0af46c7","metric":0,"metrics":{},"status":"keep","description":"Baseline: 0 of 2 deferred bugs resolved. R2-BH4=HIGH (no state snapshot/rollback on command failure — gates mutate without rollback), R2-BH5=MEDIUM (CSL/reference-doc validation exists as warnings in PandocRenderer._collect_optional_input_warnings but severity is warning not error).","timestamp":1780969694008,"segment":189,"confidence":4.8,"asi":{"R2-BH4":"HIGH — no state snapshot/rollback. Gates get mutated during execute() but if persist_state fails, they're not reverted. Partial state corruption.","R2-BH5":"MEDIUM — PandocRenderer already validates CSL/reference-doc as warnings in _collect_optional_input_warnings. Bug is severity level (warning vs error), not missing validation.","code_anchor":"orchestrator.py:183-191 (apply phase catches and returns fail), but persist_state happens later at line ~280 with no rollback","hypothesis":"Both deferred bugs are fixable with targeted changes"}}
{"run":381,"commit":"7743f19","metric":2,"metrics":{},"status":"keep","description":"Fix 2 deferred bug-hunt findings. R2-BH4 HIGH: state snapshot/rollback — deep copy ManuscriptState before verify phase, restore on failure. R2-BH5 MEDIUM: CSL/reference-doc validation upgraded from warning to error severity. 5 new tests. 1261 pass (excluding preexisting thesaurus import failures).","timestamp":1780970508691,"segment":189,"confidence":6,"asi":{"R2-BH4":"FIXED — deep copy snapshot before verify phase, rollback on StateManagerError/ValueError/DomainStateError. Defensive getattr for mock compatibility.","R2-BH5":"FIXED — PandocRenderer._collect_optional_input_warnings upgraded missing_csl_file and missing_reference_doc from severity=warning to severity=error","hypothesis":"Both deferred bugs fixed with targeted surgical changes","key_insight":"R2-BH4 needed copy.deepcopy + defensive getattr(mock, 'state', None) to avoid breaking existing mock-based tests. R2-BH5 was a one-word change (warning→error).","tests_added":5,"tests_total":"1261 pass (excluding preexisting thesaurus failures)","preexisting_failures":"74 CLI tests broken by ModuleNotFoundError: No module named 'thesaurus' — NOT caused by this change"}}
{"run":382,"commit":"d99df62","metric":2,"metrics":{},"status":"keep","description":"Judgment Day Round 1→2 fix: guard rollback when snapshot is None, move import copy to top-level. Re-judgment APPROVED: 0 CRITICAL, 0 confirmed WARNING. 1261 pass.","timestamp":1780971645431,"segment":189,"confidence":8,"asi":{"A-1":"FIXED — snapshot guard: if _pre_verify_snapshot is not None before rollback","A-2":"FIXED — import copy moved to module top-level","A-3":"SUSPECT — error severity in findings not directly read by gate, but consumed by ValidatorResult for diagnostics","A-4":"PREEXISTING — thesaurus.cli import in main() breaks all commands when module missing (74 test failures)","B-1":"INFO — 40-char hex heuristic is correct for S2 API context","B-2":"INFO — getattr(state_manager, 'state') fragile, future refactor to add snapshot() method","B-3":"INFO — argparse type=int handles enforcement","B-4":"INFO — tier validation raising is the FIX, old silent default was the bug","round1_confirmed":2,"round2_remaining":0,"verdict":"APPROVED"}}
{"type":"config","name":"SDD apply: academic-evidence-curation-mode PR1","metricName":"tasks_resolved","metricUnit":"tasks","bestDirection":"higher"}
{"run":383,"commit":"514d8a1","metric":0,"metrics":{},"status":"keep","description":"Baseline: 0/3 PR1 tasks resolved. 1434 pass, 0 fail. Academic mode not implemented.","timestamp":1781001583587,"segment":190,"confidence":null,"asi":{"hypothesis":"PR1 tasks: (1) review_config.yaml persistence + CLI --mode, (2) orchestrator transport, (3) adapters forwarding","baseline_tests":1434}}
