{"run":298,"commit":"8e7b627","metric":55,"metrics":{},"status":"keep","description":"Test bibliography.py validator: 55 new tests covering all 8 functions (normalize_entry_fields 7, detect_duplicate_keys 6, validate_entry_type 7, validate_required_fields 7, validate_doi_format 8, validate_year_range 9, validate_bibliography integration 11). Edge cases: None/int values, case-insensitive keys, boundary years, DOI format, empty inputs, multi-finding entries. 1065 passed, 0 regressions.","timestamp":1780569078247,"segment":157,"confidence":null,"asi":{"coverage":"8/8 public functions in bibliography.py now tested","edge_cases":["None values in fields","case-insensitive duplicate keys","boundary years 1900/2030","non-numeric years","DOI format validation (bare vs URL)","unknown entry types","multiple findings per entry","field normalization before DOI check"],"functions_tested":["normalize_entry_fields","detect_duplicate_keys","validate_entry_type","validate_required_fields","validate_doi_format","validate_year_range","validate_bibliography"],"hypothesis":"bibliography.py had 0 test coverage despite being a critical validator with 8 pure functions","regression":"1065 passed, 0 new failures, 7 skipped"}}
{"type":"config","name":"Preset validator + structure/refs/citations/reporting test coverage","metricName":"new_tests","metricUnit":"tests","bestDirection":"higher"}
{"run":299,"commit":"ebb53a4","metric":0,"metrics":{},"status":"keep","description":"Baseline: preset.py, structure.py, refs.py, citations.py, reporting.py have near-zero dedicated tests. These are small pure validator modules.","timestamp":1780569273710,"segment":158,"confidence":null}
{"run":300,"commit":"948ec93","metric":54,"metrics":{},"status":"keep","description":"Test preset.py (19 tests) + structure/refs/citations/reporting validators (35 tests). Covers: preset validation (required fields, format, max_words, sections type), section structure (missing/extra/case-insensitive), refs metadata (year, DOI/URL requirements), citation consistency (unresolved keys, sorting), reporting checklist (study design, sample size, limitations keywords, empty sections). 1119 passed, 0 regressions.","timestamp":1780569439763,"segment":158,"confidence":null,"asi":{"coverage":"5 modules now fully tested: preset.py, structure.py, refs.py, citations.py, reporting.py","hypothesis":"5 small pure validators had zero or near-zero test coverage","modules_tested":["validators/preset.py (19 tests)","validators/structure.py (7 tests)","validators/refs.py (9 tests)","validators/citations.py (8 tests)","validators/reporting.py (11 tests)"],"regression":"1119 passed, 0 new failures, 7 skipped"}}
{"type":"config","name":"Style validator test coverage","metricName":"new_tests","metricUnit":"tests","bestDirection":"higher"}
{"run":301,"commit":"be4ad40","metric":0,"metrics":{},"status":"keep","description":"Baseline: style.py has 0 dedicated tests. validate_style() is a pure function checking passive voice, long sentences, unbacked claims, forbidden phrases, and informal language.","timestamp":1780569535759,"segment":159,"confidence":null}
{"type":"config","name":"Wire study table and PRISMA into LLM production path","metricName":"production_connected","metricUnit":"features","bestDirection":"higher"}
{"run":302,"commit":"fb79983","metric":0,"metrics":{},"status":"keep","description":"Baseline: generate_study_table() and generate_prisma_mermaid() only run in fallback (no-LLM) path. LLM production path has early return at line ~218 that skips all enrichment. 0 features connected in production.","timestamp":1780569873337,"segment":160,"confidence":null}
{"run":303,"commit":"f651347","metric":4,"metrics":{},"status":"keep","description":"Extract enrichment into _enrich_section() called from both LLM and fallback paths. Fixes production disconnect: generate_study_table() and generate_prisma_mermaid() now run regardless of LLM availability. 1119 tests pass.","timestamp":1780570041083,"segment":160,"confidence":null,"asi":{"bug":"LLM production path (PAPER_LLM_CLI=claude/codex/gemini) had early return that skipped generate_study_table() and generate_prisma_mermaid(). These functions were only called in the no-LLM fallback path.","fix":"Extracted enrichment logic into _enrich_section() helper function. Both LLM and fallback paths now call _enrich_section(). LLM path appends enrichment after LLM content.","hypothesis":"study table and PRISMA mermaid were disconnected from production LLM path","regression":"1119 passed, 0 new failures, 7 skipped","verification":"4/4 features: LLM calls enrich=True, fallback calls enrich=True, table generated=True, mermaid generated=True"}}
{"type":"config","name":"Wire audit commands to set orchestrator gates","metricName":"gates_connected","metricUnit":"gates","bestDirection":"higher"}
{"run":304,"commit":"ba2400c","metric":4,"metrics":{},"status":"keep","description":"Baseline: 4/10 audit commands wired through orchestrator gates. 6 direct-bypass commands (audit_prose, audit_claims, audit_citations, audit_ethics, audit_writing_quality, audit_code_health) never set any gates. ethics_passed soft gate is NEVER set by any command but verify checks it.","timestamp":1780570459254,"segment":161,"confidence":null}
{"run":305,"commit":"462dd16","metric":5,"metrics":{},"status":"keep","description":"Wire audit_ethics through orchestrator: new EthicsAuditor ToolWrapper sets ethics_passed gate. Previously ethics_passed was a dead gate (never set, only checked by verify). Now audit_ethics routes through orchestrator, uses EthicsValidator, sets gate. 1119 tests pass.","timestamp":1780570997717,"segment":161,"confidence":null,"asi":{"architecture":"EthicsAuditor ToolWrapper (new file) → orchestrator_builder registration → orchestrator gate verification → CLI routing","before":"ethics_passed soft gate was NEVER set by any command. paper verify checked it but nothing populated it. audit ethics was a direct CLI handler bypassing the orchestrator.","files_created":["integrations/tools/ethics_auditor.py"],"files_modified":["integrations/tools/__init__.py","harness/services/orchestrator_builder.py","harness/services/orchestrator.py","cli/paper/main.py","tests/harness/test_orchestrator_builder.py"],"hypothesis":"ethics_passed gate was dead — never set, only checked by verify","pattern":"Same as ReportingAuditor: ToolWrapper with gate property, registered in builder, routed through CLI orchestrator","regression":"1119 passed, 0 new failures, 7 skipped","remaining_unwired":["audit_prose","audit_claims","audit_citations","audit_writing_quality","audit_code_health"]}}
{"type":"config","name":"Wire generate_protocol and convert_citations into production","metricName":"dead_functions_fixed","metricUnit":"functions","bestDirection":"higher"}
{"run":306,"commit":"72f6792","metric":0,"metrics":{},"status":"keep","description":"Baseline: 3 production-dead functions. generate_protocol() has CLI command but action runner has no handler. convert_citations() from GAP-005 has zero production callers. validate_preset() never called from init --preset.","timestamp":1780571190302,"segment":162,"confidence":null}
{"run":307,"commit":"42914e8","metric":3,"metrics":{},"status":"keep","description":"Wire 3 production-dead functions: generate_protocol() into paper protocol command (action runner handler), convert_citations() into draft_section LLM path (Author,Year→@key), validate_preset() into init --preset (validation before copy). 1119 tests pass.","timestamp":1780571469904,"segment":162,"confidence":null,"asi":{"convert_citations":"Added _convert_citations() helper in drafting.py. LLM path now converts (Author, Year) → @key after generation. Gracefully degrades if bib missing.","files_modified":["harness/adapters/filesystem_action_runner.py (protocol handler + preset validation)","skills/imported/academic_writer/drafting.py (_convert_citations helper)"],"generate_protocol":"Added 'protocol' handler to FilesystemActionRunner.run_action(). Calls generate_protocol() with proper keyword args. Writes to output path or defaults to protocol.md in run dir.","hypothesis":"3 production-dead functions: generate_protocol (CLI command exists but does nothing), convert_citations (GAP-005 claimed resolved but never called), validate_preset (init --preset copies but never validates)","regression":"1119 passed, 0 new failures, 7 skipped","validate_preset":"Added validation step in init --preset before copying preset.yaml. Logs warnings for invalid presets but still copies (advisory, not blocking)."}}
{"type":"config","name":"End-to-end production wiring validation","metricName":"validation_score","metricUnit":"checks","bestDirection":"higher"}
{"run":308,"commit":"e6310e5","metric":18,"metrics":{},"status":"keep","description":"End-to-end production wiring validation: 12/12 REQUIRED gates + 2/2 SOFT gates all have setter commands. 8 ToolWrappers registered. All 12 GAPs functionally connected. 1119 tests pass. 5 informational audit commands remain unwired (non-blocking).","timestamp":1780571827797,"segment":163,"confidence":null,"asi":{"gates_wired":"12/12 REQUIRED + 2/2 SOFT gates all have setter commands. ethics_passed was the last dead gate fixed.","dead_functions_fixed":"generate_protocol, convert_citations, validate_preset, generate_study_table, generate_prisma_mermaid, EthicsAuditor — all wired in experiments #303-#307","hypothesis":"Complete production wiring validation: all gates have setters, all GAP functions connected, test suite green","regression":"1119 passed, 0 new failures, 7 skipped","tool_wrappers":"8 registered (lint_bib, check_refs, check_refs_metadata, lint_style, audit_reporting, audit_ethics, render, import_bib)","unwired_but_nonblocking":"5 audit commands bypass orchestrator (prose, claims, citations, writing_quality, code_health) — informational only, no gates depend on them"}}
{"type":"config","name":"Wire remaining 5 audit commands through orchestrator","metricName":"audit_commands_wired","metricUnit":"commands","bestDirection":"higher"}
{"run":309,"commit":"2254986","metric":4,"metrics":{},"status":"keep","description":"Baseline: 4/9 audit commands wired through orchestrator. 5 unwired: prose, claims, code_health, citations, writing_quality. These bypass precondition checks, gate tracking, and command logging.","timestamp":1780571982989,"segment":164,"confidence":null,"asi":{"audit_ethics":"Already wired via EthicsAuditor ToolWrapper in experiment #305","audit_factuality":"Already wired — uses ClaimEvidenceValidator","audit_quality_appraisal":"Already wired — uses QualityAppraisalValidator","audit_tables":"Already wired — uses table/figure validator","hypothesis":"5 of 9 audit commands bypass orchestrator (prose, claims, code_health, citations, writing_quality)","next":"Wire the 5 unwired audit commands through orchestrator with ToolWrappers"}}
{"run":310,"commit":"bde9cfe","metric":9,"metrics":{},"status":"keep","description":"Wire 5 remaining audit commands through orchestrator: ProseAuditor, ClaimsAuditor, CitationsAuditor, WritingQualityAuditor, CodeHealthAuditor. All 9/9 audit commands now have precondition checks, gate verification, and command logging. 13 total ToolWrappers registered. 1119 tests pass.","timestamp":1780572552047,"segment":164,"confidence":null,"asi":{"audit_claims":"ClaimsAuditor — parses manuscript, runs ClaimsValidator.build_claims_report(), returns findings. Gate: style_passed.","audit_citations":"CitationsAuditor — parses manuscript, runs CitationVerifyValidator, returns findings. Gate: citations_resolved.","audit_code_health":"CodeHealthAuditor — runs analyze_code_health() + analyze_dependency_risk(), returns combined findings. Gate: style_passed.","audit_prose":"ProseAuditor — parses manuscript, runs ProseValidator, returns findings. Gate: style_passed.","audit_writing_quality":"WritingQualityAuditor — parses manuscript, runs WritingQualityValidator, returns findings. Gate: style_passed.","files_created":["integrations/tools/prose_auditor.py","integrations/tools/claims_auditor.py","integrations/tools/citations_auditor.py","integrations/tools/writing_quality_auditor.py","integrations/tools/code_health_auditor.py"],"hypothesis":"5 remaining audit commands can be wired through orchestrator with lightweight ToolWrappers following the EthicsAuditor pattern","min_stages":"audit_prose/claims/citations/writing_quality require 'drafting' stage (manuscript must exist). audit_code_health requires 'outline' stage.","regression":"1119 passed, 0 failures, 7 skipped. Updated test_wrappers_has_eight_keys → test_wrappers_has_all_expected_keys for 13 wrappers.","tool_wrapper_count":"8 → 13 (+5 new: ProseAuditor, ClaimsAuditor, CitationsAuditor, WritingQualityAuditor, CodeHealthAuditor)"}}
{"type":"config","name":"ToolWrapper integration tests for 6 untested wrappers","metricName":"wrapper_tests_added","metricUnit":"tests","bestDirection":"higher"}
{"run":311,"commit":"7a86729","metric":32,"metrics":{},"status":"keep","description":"Baseline: 32 wrapper tests exist for 6 wrappers. 8 wrappers untested: EthicsAuditor, ProseAuditor, ClaimsAuditor, CitationsAuditor, WritingQualityAuditor, CodeHealthAuditor, PandocRenderer, ZoteroImporter.","timestamp":1780572717355,"segment":165,"confidence":null,"asi":{"hypothesis":"8 of 13 ToolWrappers have zero integration tests: EthicsAuditor, ProseAuditor, ClaimsAuditor, CitationsAuditor, WritingQualityAuditor, CodeHealthAuditor, PandocRenderer, ZoteroImporter","next":"Write integration tests for the 6 pure-Python wrappers (skip PandocRenderer and ZoteroImporter which need external tools)","tested_wrappers":"BibliographyNormalizer, RefsValidator, RefsMetadataValidator, StyleLinter, ReportingAuditor","test_file":"tests/integrations/test_tool_wrappers.py has 32 tests across 6 classes"}}
{"run":312,"commit":"66b310e","metric":66,"metrics":{},"status":"keep","description":"34 new integration tests for 6 untested ToolWrappers: EthicsAuditor (6), ProseAuditor (7), ClaimsAuditor (5), CitationsAuditor (6), WritingQualityAuditor (5), CodeHealthAuditor (5). Total wrapper tests: 32→66. Full suite: 1153 passed, 0 regressions.","timestamp":1780572866108,"segment":165,"confidence":null,"asi":{"classes_added":["TestEthicsAuditor (6 tests)","TestProseAuditor (7 tests)","TestClaimsAuditor (5 tests)","TestCitationsAuditor (6 tests)","TestWritingQualityAuditor (5 tests)","TestCodeHealthAuditor (5 tests)"],"hypothesis":"6 ToolWrappers (EthicsAuditor, ProseAuditor, ClaimsAuditor, CitationsAuditor, WritingQualityAuditor, CodeHealthAuditor) have zero integration tests","new_tests":34,"pattern":"Each wrapper test covers: no-manuscript skip, missing-file skip, clean manuscript, issue manuscript, gate property, name property, is_available","regression":"1153 passed (+34), 0 failures, 7 skipped","skipped_wrappers":"PandocRenderer and ZoteroImporter skipped — require external tools (pandoc binary, Zotero API)"}}
{"type":"config","name":"Fix assembler to include all manifest sections","metricName":"sections_dropped","metricUnit":"sections","bestDirection":"lower"}
{"run":313,"commit":"fa726c0","metric":3,"metrics":{},"status":"keep","description":"Baseline: assembler drops 3/7 sections. CANONICAL_ORDER hardcoded to (introduction, methods, results, discussion). Abstract, literature_review, and conclusion are generated by draft_all but silently discarded during assembly.","timestamp":1780573055435,"segment":166,"confidence":null,"asi":{"assembler_path":"harness/services/assembler.py","dropped":["abstract (order 1)","literature_review (order 3)","conclusion (order 7)"],"hypothesis":"Assembler drops 3 of 7 manifest sections (abstract, literature_review, conclusion). draft_all generates all 7 but assemble_manuscript() only includes introduction, methods, results, discussion.","manifest_path":"skills/imported/academic_writer/sections_manifest.json","root_cause":"CANONICAL_ORDER hardcoded to 4 sections instead of reading from manifest"}}
{"run":314,"commit":"37aed4a","metric":0,"metrics":{},"status":"keep","description":"Fix assembler to include all 7 manifest sections: abstract, introduction, literature_review, methods, results, discussion, conclusion. Was hardcoded to only 4 (introduction, methods, results, discussion) — dropping abstract, literature_review, and conclusion. 1154 tests pass.","timestamp":1780573229202,"segment":166,"confidence":null,"asi":{"before":"CANONICAL_ORDER = (introduction, methods, results, discussion) — 4 sections, dropped abstract, literature_review, conclusion","hypothesis":"Assembler drops 3/7 manifest sections — CANONICAL_ORDER hardcoded to 4 sections instead of 7","impact":"draft_all generates all 7 sections but render only included 4. Abstract, literature review, and conclusion were silently discarded during manuscript assembly.","new_test":"test_assembles_all_seven_manifest_sections verifies all 7 present and in correct order","regression":"1154 passed (+1), 0 failures, 7 skipped. All existing assembler tests pass — they tested partial sections which still work."}}
{"type":"config","name":"Fix action runner draft_section validation to match manifest","metricName":"section_validation_mismatches","metricUnit":"mismatches","bestDirection":"lower"}
{"run":315,"commit":"70fa03d","metric":3,"metrics":{},"status":"keep","description":"Baseline: action runner draft_section validates against hardcoded 4-section list, rejecting 3 manifest sections (abstract, literature_review, conclusion). 'paper draft_section --name abstract' crashes with ValueError.","timestamp":1780573324093,"segment":167,"confidence":null,"asi":{"action_runner_line":303,"hypothesis":"Action runner draft_section validation hardcodes 4 sections, rejecting abstract, literature_review, conclusion. Running 'paper draft_section --name abstract' raises ValueError.","impact":"Individual section drafting broken for 3/7 sections via CLI","manifest_has":"7 sections: abstract, introduction, literature_review, methods, results, discussion, conclusion","validation_allows":"4 sections: introduction, methods, results, discussion"}}
{"run":316,"commit":"10d0153","metric":0,"metrics":{},"status":"keep","description":"Fix action runner draft_section to accept all 7 manifest sections (abstract, introduction, literature_review, methods, results, discussion, conclusion). Was rejecting abstract, literature_review, conclusion with ValueError. Also fixed section title generation for underscores. 1154 tests pass.","timestamp":1780573483353,"segment":167,"confidence":null,"asi":{"action_runner_fix":"valid_sections expanded from 4 to 7 hardcoded entries matching manifest. Also fixed section title generation: section_name.capitalize() → section_name.replace('_', ' ').title() for 'Literature Review' instead of 'Literature_review'.","hypothesis":"Action runner draft_section validation hardcodes 4 sections, rejecting abstract, literature_review, conclusion","impact":"'paper draft_section --name abstract' was crashing. Now all 7 manifest sections can be drafted individually via CLI.","regression":"1154 passed, 0 failures. Updated test to verify previously-rejected sections now pass.","test_update":"Changed invalid section test from 'conclusion' (now valid) to 'bibliography'. Added assertions for abstract, literature_review, conclusion acceptance."}}
{"run":317,"commit":"96624a3","metric":0,"metrics":{},"status":"keep","description":"Fix action runner draft_section to accept all 7 manifest sections + add recommended section warnings to structure validator. Core 4 (introduction, methods, results, discussion) are required errors; extended 3 (abstract, literature_review, conclusion) are recommended warnings. 1156 tests pass.","timestamp":1780573742293,"segment":167,"confidence":null,"asi":{"action_runner":"valid_sections expanded to 7 matching manifest. Section title generation fixed: capitalize() → replace('_', ' ').title() for 'Literature Review'.","hypothesis":"Action runner draft_section validation rejects 3/7 manifest sections as invalid","regression":"1156 passed (+2), 0 failures. Updated 2 test files for new structure validator behavior.","structure_validator":"REQUIRED_SECTIONS (4 core: intro/methods/results/discussion = errors) + RECOMMENDED_SECTIONS (3 extended: abstract/literature_review/conclusion = warnings). All 7 manifest sections now covered.","test_updates":"test_validators.py: 10 tests updated to filter errors vs warnings. test_small_validators.py: 6 tests updated. Added test_all_required_and_recommended_present and test_recommended_sections_are_warnings."}}
{"type":"config","name":"Assembler edge case validation","metricName":"assembler_edge_failures","metricUnit":"failures","bestDirection":"lower"}
{"run":318,"commit":"b659725","metric":0,"metrics":{},"status":"keep","description":"Assembler edge case validation: 0 failures across 4 scenarios. Core-4-only, abstract+conclusion only, literature_review ordering, and all-7 ordering all work correctly. Assembler robust to partial sections and manifest ordering.","timestamp":1780574098785,"segment":168,"confidence":null,"asi":{"hypothesis":"Assembler may fail on edge cases: partial sections, underscored names, ordering","result":"All 4 edge cases pass: core-4-only, abstract+conclusion only, literature_review ordering, all-7 ordering","test_1":"Core 4 (intro/methods/results/discussion) → assembles correctly, abstract/literature_review/conclusion skipped","test_2":"Only abstract+conclusion → manuscript written with both present","test_3":"literature_review before introduction → correct manifest order (intro at pos 2, lit at pos 26)","test_4":"All 7 sections → strict manifest ordering verified"}}
{"type":"config","name":"Fix render output path mismatch","metricName":"render_path_mismatches","metricUnit":"mismatches","bestDirection":"lower"}
