{"run":83,"commit":"ca60966","metric":3,"metrics":{"dead_hubs_refactored":0},"status":"keep","description":"Baseline: verification/run_real_validation.py has 1110 lines with 5 major functions duplicating Orchestrator logic. Orchestrator has 9 public methods. 0 dead hubs refactored.","timestamp":1780411658589,"segment":46,"confidence":null,"asi":{"dead_hub_file":"verification/run_real_validation.py","dead_hub_lines":1110,"duplicated_functions":["run_stage","load_manifest","prepare_workspace","run_validation","main"],"hypothesis":"Refactor run_real_validation.py to use Orchestrator public API instead of duplicating logic"}}
{"type":"config","name":"Audit SSOT violations across verification and harness layers","metricName":"ssot_violations","metricUnit":"violations","bestDirection":"lower"}
{"run":84,"commit":"d201bc3","metric":4,"metrics":{"dead_hubs_refactored":0},"status":"keep","description":"Dead Hubs investigation complete: verification/run_real_validation.py is NOT a duplicate Orchestrator — it's an intentional subprocess-level validation runner. Added docstring explaining architectural difference. Corrected audit document. 554 tests pass.","timestamp":1780411830556,"segment":46,"confidence":8,"asi":{"dead_hubs_verdict":"NOT duplication — intentional architectural layer","reason":"run_stage runs paper CLI via subprocess to test full binary path, not Orchestrator in-process","action":"Added documentation to run_stage docstring and corrected graph-audit-findings.md","remaining_risk":"1110 lines of PDF processing logic with limited edge-case coverage"}}
{"run":118,"commit":"7d9ebfa","metric":2,"metrics":{},"status":"keep","description":"Baseline: 2 SSOT violations found. (1) test_cli_exit_code_matrix.py:36 hardcodes 10 gates (missing render_passed + ready_for_delivery) — should use REQUIRED_GATES. (2) test_smoke_e2e.py:251 hardcodes 5 rendering precondition gates with no domain import — should use STAGE_PRECONDITIONS['rendering'].","timestamp":1780411844943,"segment":68,"confidence":null,"asi":{"finding_1":"tests/cli/test_cli_exit_code_matrix.py:36 — 10 gate names hardcoded in a list. Imports ManuscriptState but doesn't use REQUIRED_GATES","finding_2":"tests/e2e/test_smoke_e2e.py:251 — 5 gate names hardcoded. NO ManuscriptState import. This is the rendering preconditions list","hypothesis":"Replace hardcoded gate lists in tests with ManuscriptState.REQUIRED_GATES and STAGE_PRECONDITIONS references"}}
{"run":85,"commit":"d3f3792","metric":4,"metrics":{"dead_hubs_refactored":0},"status":"keep","description":"Baseline: get_asset_path returns Path even if it doesn't exist. 40 transitive dependents, only paper doctor checks .exists(). 0 asset errors added.","timestamp":1780411894549,"segment":46,"confidence":4,"asi":{"get_asset_path_callers":40,"callers_checking_exists":"paper doctor only","callers_not_checking":"validators, orchestrator, CLI all assume path is valid","hypothesis":"Adding AssetResolutionError with helpful message prevents silent failures"}}
{"run":119,"commit":"1a57bd9","metric":0,"metrics":{},"status":"keep","description":"SSOT violations eliminated: 2 hardcoded gate lists replaced with domain model references. (1) test_cli_exit_code_matrix.py: transitive precondition computation via STAGE_ORDER+STAGE_PRECONDITIONS. (2) test_smoke_e2e.py: STAGE_PRECONDITIONS['rendering'] + domain import. 0 violations remaining, 554/554 tests pass.","timestamp":1780412179646,"segment":68,"confidence":null,"asi":{"fix_1":"tests/cli/test_cli_exit_code_matrix.py — replaced 10-item hardcoded gate list with transitive precondition computation from ManuscriptState.STAGE_ORDER + STAGE_PRECONDITIONS","fix_2":"tests/e2e/test_smoke_e2e.py — replaced 5-item hardcoded validation_gates with ManuscriptState.STAGE_PRECONDITIONS['rendering'], added domain import","hypothesis":"Eliminate remaining SSOT violations: hardcoded gate/stage lists in tests","result":"0 violations remaining, 554 tests pass"}}
{"type":"config","name":"Find untested error paths in orchestrator and domain layer","metricName":"untested_error_paths","metricUnit":"paths","bestDirection":"higher"}
{"run":86,"commit":"363dd7d","metric":5,"metrics":{"dead_hubs_refactored":0},"status":"keep","description":"Added AssetResolutionError for Spine protection. get_rules_dir, get_templates_dir, get_styles_dir, get_schemas_dir now raise clear error with reinstall instructions when dirs are missing. get_asset_path stays unchecked (low-level). 554 tests, make verify clean.","timestamp":1780412255497,"segment":46,"confidence":10,"asi":{"asset_error_class":"AssetResolutionError(FileNotFoundError)","functions_guarded":["get_templates_dir","get_styles_dir","get_rules_dir","get_schemas_dir"],"functions_unguarded":["get_asset_path","get_preset_dir","get_vale_styles_dir","get_csl_styles_dir","get_project_asset"],"reason_unguarded":"get_asset_path is low-level, callers may construct paths for files that don't exist yet","tests":"554 pass, 0 fail, make verify clean"}}
{"run":120,"commit":"b251688","metric":4,"metrics":{},"status":"keep","description":"Baseline: 4 untested error paths found. All in harness/ports/assets.py — AssetResolutionError raised at lines 69, 83, 121, 135 but never caught in any test. Domain/orchestrator errors are well-covered.","timestamp":1780412278760,"segment":69,"confidence":null,"asi":{"all_tested_exceptions":"DomainStateError, FileNotFoundError, StateManagerError, StateRepositoryError, SystemExit, ToolNotAvailableError, TypeError, ValueError","findings":"4 untested AssetResolutionError raises in harness/ports/assets.py (lines 69, 83, 121, 135)","hypothesis":"AssetResolutionError is never tested — if asset resolution fails, no test covers the error path","production_coverage":"Good for domain/orchestrator errors. Gap in asset resolution."}}
{"run":121,"commit":"d637f9a","metric":0,"metrics":{},"status":"keep","description":"All error paths now tested. Added 4 tests for AssetResolutionError raises in harness/ports/assets.py (get_templates_dir, get_styles_dir, get_rules_dir, get_schemas_dir). Each test mocks _get_package_root to an empty tmp_path and asserts the correct error message. 558/558 tests pass, 0 untested error paths remaining.","timestamp":1780412464416,"segment":69,"confidence":null,"asi":{"approach":"Mock _get_package_root to point to empty tmp_path, then call each dir-getter and assert AssetResolutionError","hypothesis":"Cover 4 untested AssetResolutionError raises in harness/ports/assets.py","tests_added":4,"tests_total":558,"regressions":0}}
{"type":"config","name":"Mutation testing: can tests catch wrong gate logic?","metricName":"mutation_coverage_gaps","metricUnit":"gaps","bestDirection":"lower"}
{"run":122,"commit":"c09e1e5","metric":2,"metrics":{},"status":"keep","description":"Baseline mutation testing: 2/5 mutations escaped (60% kill rate). M1: backward transition allowed (<=→<) — no test catches it. M3: precondition check disabled in transition_to — no test catches it. M2, M4, M5 caught correctly.","timestamp":1780412634503,"segment":70,"confidence":null,"asi":{"M1_escaped":"Allow backward transition (<= becomes <) — no test catches same-stage re-entry being treated as forward instead of no-op","M3_escaped":"Skip precondition check in transition_to — preconditions are never checked in transition_to, tests rely on validate() or orchestrator preconditions instead","caught":"M2 (skip stages), M4 (unknown gate), M5 (unknown gate keys in validate)","hypothesis":"Tests don't exercise transition_to directly with backward moves or unsatisfied preconditions","kill_rate":"3/5 (60%)"}}
{"run":123,"commit":"b88f6ab","metric":0,"metrics":{},"status":"keep","description":"Mutation coverage improved: 8 new transition_to tests kill M3 (precondition enforcement). M1 confirmed as equivalent mutation (same-stage early return is the real guard, which IS caught). 0 real coverage gaps. 566/566 tests pass.","timestamp":1780412970594,"segment":70,"confidence":null,"asi":{"M1_equivalent":"M1 (<= to <) is equivalent mutation — same-stage exits early via 'if stage_name == self.stage: return' before reaching the comparison. Not a real gap.","M3_caught":"Precondition enforcement gap FIXED by 8 new transition_to tests","kill_rate_real":"5/5 (100%) for meaningful mutations. M1 was a false alarm.","tests_added":8,"tests_total":566}}
{"type":"config","name":"Mutation testing: can tests catch wrong validator logic?","metricName":"validator_mutation_gaps","metricUnit":"gaps","bestDirection":"lower"}
{"run":124,"commit":"57edabd","metric":1,"metrics":{},"status":"keep","description":"Baseline mutation testing on validators/gates: 1/4 escaped (75% kill rate). V4: __post_init__ gate auto-fill not caught — tests always provide complete gate dicts so the auto-fill logic is never exercised. V1, V2, V3 all caught.","timestamp":1780413281365,"segment":71,"confidence":null,"asi":{"V4_escaped":"__post_init__ skipping gate filling not caught — tests may always construct states with complete gate dicts","caught":"V1 (search_completed always passes), V2 (sections_completed always passes), V3 (reset_downstream_gates no-op)","hypothesis":"Mutation test validators and domain logic. V4 escaped: __post_init__ gate auto-fill not tested."}}
{"run":125,"commit":"ea6557a","metric":0,"metrics":{},"status":"keep","description":"Validator mutation coverage: V4 killed. Added 3 tests for __post_init__ gate auto-fill (empty dict fills all, partial dict preserves existing, complete dict unchanged). 4/4 mutations now caught. 569/569 tests pass.","timestamp":1780413536137,"segment":71,"confidence":null,"asi":{"V4_now_caught":"3 new __post_init__ tests kill V4 mutation","hypothesis":"Cover __post_init__ gate auto-fill with explicit tests","kill_rate":"4/4 (100%)","tests_added":3,"tests_total":569}}
{"type":"config","name":"CLI integration: which subcommands have actual subprocess tests?","metricName":"cli_integration_coverage","metricUnit":"commands","bestDirection":"higher"}
{"type":"config","name":"What does paper doctor miss? Real environment check gaps","metricName":"doctor_gap_score","metricUnit":"gaps","bestDirection":"higher"}
{"run":126,"commit":"3e4c89c","metric":2,"metrics":{},"status":"keep","description":"Baseline: 2 tools used in production but not checked by paper doctor. (1) pdftotext — poppler tool for PDF text extraction, used in run_real_validation.py with pandoc fallback. (2) pdfinfo — poppler tool for page counting, used with silent 0-page fallback. Doctor checks 4 tools, misses these 2.","timestamp":1780413914353,"segment":73,"confidence":null,"asi":{"doctor_checks":"pandoc, pdflatex, vale, bibtex-tidy","gap_pdftotext":"Used in verification/run_real_validation.py for PDF text extraction. Fallback to pandoc exists but no doctor check.","gap_pdfinfo":"Used in verification/run_real_validation.py for page counting. No fallback, silently returns 0 pages.","hypothesis":"Add pdftotext and pdfinfo to doctor checks"}}
{"run":127,"commit":"1c19f60","metric":0,"metrics":{},"status":"keep","description":"Doctor gap closed: added pdftotext and pdfinfo (poppler) to check_all_tools. Both are used in verification/run_real_validation.py for PDF text extraction and page counting. Updated test assertion from 4 to 6 tools. 569/569 tests pass, 0 doctor gaps.","timestamp":1780414326521,"segment":73,"confidence":null,"asi":{"doctor_tools_added":"pdftotext (-v) and pdfinfo (-v) from poppler","hypothesis":"Close doctor coverage gap for poppler tools","test_fix":"Updated test_all_missing from 4 to 6 expected tools","result":"0 gaps, 569 tests pass"}}
{"type":"config","name":"Type safety: find runtime type errors that mypy misses","metricName":"type_safety_gaps","metricUnit":"gaps","bestDirection":"lower"}
{"type":"config","name":"Doc accuracy: do README and docs reflect current state?","metricName":"doc_accuracy","metricUnit":"claims","bestDirection":"higher"}
{"run":128,"commit":"081b45a","metric":0,"metrics":{},"status":"keep","description":"Doc accuracy audit: 0 genuinely stale claims. Initial regex found 7 matches but all were false positives — code snippets showing historical bugs, per-file test counts, or '0 gates passed' prose. README, TESTING_STRATEGY, and HARNESS docs all reflect current state.","timestamp":1780414624796,"segment":75,"confidence":null,"asi":{"false_positives":"11 gates in code snippet, 56 tests = per-file count, 0 gates = 'no gates passed' prose","hypothesis":"Check docs for stale claims about gate/stage/test counts","result":"0 genuinely stale claims. Docs are accurate."}}
{"type":"config","name":"YAML round-trip: does state survive save/load cycle?","metricName":"yaml_round_trip_failures","metricUnit":"failures","bestDirection":"lower"}
{"run":129,"commit":"ff261a8","metric":0,"metrics":{},"status":"keep","description":"YAML round-trip test: 0 failures. Tested all 8 stages with correct preconditions through yaml.safe_dump/load cycle + YamlFileStateRepository save/load. State is faithfully preserved through serialization.","timestamp":1780414707557,"segment":76,"confidence":null,"asi":{"hypothesis":"Test YAML round-trip for all 8 stages + file repository","result":"0 failures. YAML serialization is faithful."}}
{"type":"config","name":"Convergence check: has this codebase reached a clean plateau?","metricName":"convergence_score","metricUnit":"\"","bestDirection":"lower"}
{"run":130,"commit":"3ab3160","metric":0,"metrics":{},"status":"keep","description":"Convergence confirmed: 0 gaps across 11 surfaces (failing tests, SSOT, error paths, mutation coverage x2, doctor tools, doc accuracy, YAML round-trip, mypy, silent catches, domain edge cases). Session added 15 tests (554→569), fixed 1 regression, closed 3 real gaps. Further iterations would be forced work.","timestamp":1780414764816,"segment":77,"confidence":null,"asi":{"surfaces_checked":11,"total_gaps":0,"session_summary":"Fixed 1 regression (ISSUE-007), added 15 tests, closed 3 gaps (SSOT, mutation, doctor). Probed 11 surfaces in last 3 iterations with 0 findings — system is converged."}}
{"type":"config","name":"Mutation testing on adapters: infrastructure layer","metricName":"adapter_mutation_gaps","metricUnit":"gaps","bestDirection":"lower"}
{"run":131,"commit":"e13a635","metric":1,"metrics":{},"status":"keep","description":"Baseline adapter mutation testing: 1/4 escaped (75% kill). A1: yaml save() writing nothing to disk not caught — no test verifies file content after save. A2, A3, A4 all caught. A5/A6 patterns wrong (uses is_file/is_dir not exists).","timestamp":1780415045912,"segment":78,"confidence":null,"asi":{"A1_escaped":"yaml save atomic write is a no-op — no test verifies the file was actually written to disk after save()","A2_caught":"Load skips validation","A3_caught":"Load accepts non-dict YAML","A4_caught":"Save skips validate-before-save","A5_A6":"Checker uses is_file/is_dir not exists — patterns wrong, not real gaps","kill_rate":"3/4 meaningful mutations (75%)"}}
{"run":132,"commit":"3be9135","metric":0,"metrics":{},"status":"keep","description":"Adapter mutation coverage: 4/4 caught (100%). A1 was a bad no-op mutation — the real mutation (replacing entire write block with pass) IS caught by test_save_atomic_success. A2 (load skips validation), A3 (non-dict YAML), A4 (save skips validate) all caught. Adapter layer is well-tested.","timestamp":1780415156087,"segment":78,"confidence":null,"asi":{"A1_original":"Was a no-op mutation (if False: pass before with open — with still ran)","A1_v2":"Real mutation (entire write block replaced with pass) IS CAUGHT","conclusion":"4/4 meaningful mutations caught. Adapter layer is well-tested.","kill_rate":"100%"}}
{"type":"config","name":"Validator edge cases: do they crash on adversarial input?","metricName":"validator_edge_failures","metricUnit":"failures","bestDirection":"lower"}
{"run":133,"commit":"b7cea89","metric":1,"metrics":{},"status":"keep","description":"Baseline: 1 real validator crash found. validate_bibliography crashes with AttributeError when bib entries have None field values (e.g. {\"title\": None, \"author\": None}). The .strip() call on None raises instead of reporting a finding. 30/31 other failures were test harness issues (wrong API).","timestamp":1780415436618,"segment":79,"confidence":null,"asi":{"harness_issues":"30/31 failures were wrong API calls (FakeManuscript missing 'sentences' attr, method_gate needs study_type arg)","real_bug":"bibliography/entry with None values: AttributeError: 'NoneType' object has no attribute 'strip' — validate_bibliography crashes when bib entry fields are None instead of reporting a finding","location":"validators/bibliography.py — likely in validate_entry_type or validate_required_fields where field values are accessed with .strip() without null guard"}}
{"run":134,"commit":"0b518aa","metric":0,"metrics":{},"status":"keep","description":"Fixed real bug: validate_bibliography crashed with AttributeError when bib entries had None field values. normalize_entry_fields called .strip() on None. Fix: isinstance(value, str) guard, None→empty string. Added test. 570/570 tests pass, 0 validator crashes on adversarial input.","timestamp":1780415833612,"segment":79,"confidence":null,"asi":{"bug":"normalize_entry_fields crashed on None values with AttributeError: 'NoneType' object has no attribute 'strip'","fix":"Added isinstance(value, str) guard in normalize_entry_fields — None values converted to empty string","test_added":"test_entry_with_none_values_no_crash in test_validators.py","tests_total":570,"regressions":0}}
{"type":"config","name":"Adversarial input on prose and claims validators with correct API","metricName":"validator_crashes","metricUnit":"crashes","bestDirection":"lower"}
{"run":135,"commit":"27e4999","metric":0,"metrics":{},"status":"keep","description":"Validator adversarial testing with correct API: 0 real crashes. Claims (10/10), Prose (10/10), Method Gate (10/10) all survive. Method gate returns dict not list — different API, not a bug. Bibliography was already fixed in previous iteration.","timestamp":1780416168807,"segment":80,"confidence":null,"asi":{"claims_validator":"10/10 adversarial inputs survived","method_gate_return_type":"Returns dict (not list) — different API from claims/prose, not a bug","prose_validator":"10/10 adversarial inputs survived","result":"0 real validator crashes. All survive adversarial input with correct API."}}
{"type":"config","name":"Adversarial input on parsers: manuscript and source_map","metricName":"parser_crashes","metricUnit":"crashes","bestDirection":"lower"}
{"run":136,"commit":"1a3ccd3","metric":0,"metrics":{},"status":"keep","description":"Parser adversarial testing: 0 crashes across 26 test cases (13 inputs x 2 parsers). ManuscriptParser.parse_text and SourceMap both handle empty, whitespace, null bytes, long lines, unicode, carriage returns, mixed line endings, and other edge cases without crashing. Parsers are robust.","timestamp":1780416471239,"segment":81,"confidence":null,"asi":{"hypothesis":"Adversarial input on parsers (content-processing code, same risk profile as bibliography validator)","inputs_tested":"13 adversarial patterns (empty, whitespace, null bytes, long line, many lines, unicode, single char, no newlines, markdown headers, single newline, carriage returns, mixed endings, repeated sections)","result":"0 crashes. ManuscriptParser and SourceMap both handle all inputs.","surfaces_now_total":16}}
{"type":"config","name":"CLI boundary: do invalid args produce clean errors or ugly tracebacks?","metricName":"cli_crash_count","metricUnit":"crashes","bestDirection":"lower"}
{"run":137,"commit":"f59b212","metric":0,"metrics":{},"status":"keep","description":"CLI boundary testing: 0 real crashes across 18 invalid/edge-case arguments. render and verify without init initially appeared to crash but actually produce clean error messages on stdout (not stderr). All invalid args produce either argparse error messages or pipeline blocked messages — no unhandled tracebacks.","timestamp":1780416652281,"segment":82,"confidence":null,"asi":{"false_positive":"render/verify without init appeared to crash because output goes to stdout not stderr — my harness only checked stderr for error messages","result":"0 real CLI crashes. All 18 invalid arg cases produce clean output.","surfaces_total":17}}
{"type":"config","name":"Tool wrapper output parsing: crashes on malformed external tool output?","metricName":"wrapper_parse_crashes","metricUnit":"crashes","bestDirection":"lower"}
{"run":138,"commit":"de57ed6","metric":0,"metrics":{},"status":"keep","description":"Tool wrapper testing: 0 real crashes. 8 apparent failures were PandocWrapper correctly rejecting calls without required manuscript artifacts (ValueError, not unhandled exception). All wrappers validate inputs, handle missing tools via FileNotFoundError, and return proper ValidatorResults.","timestamp":1780416801271,"segment":83,"confidence":null,"asi":{"all_8_crashes":"ValueError: Missing 'manuscript' in artifacts — PandocWrapper correctly validates required inputs before calling external tool. Not a real crash.","hypothesis":"Test tool wrappers with adversarial output parsing","result":"0 real crashes. All wrappers validate inputs and handle missing tools gracefully."}}
{"type":"config","name":"State file corruption: does load() crash on garbage/truncated YAML?","metricName":"state_corruption_crashes","metricUnit":"crashes","bestDirection":"lower"}
