{"run":337,"commit":"f4f3634","metric":10,"metrics":{},"status":"keep","description":"Fix arXiv resolver: extract arXiv IDs from raw citation text instead of passing DOIs. ARXIV_ID_PATTERN regex matches arXiv:NNNN.NNNNN, https://arxiv.org/abs/NNNN.NNNNN patterns. _query_arxiv now: (1) extract arXiv ID from raw text → verify_arxiv_id, (2) fall back to title search. Old bug: passed DOIs to verify_arxiv_id which always failed (DOIs aren't arXiv IDs). 1302 tests pass.","timestamp":1780665999544,"segment":174,"confidence":null,"asi":{"arxiv_id_extraction":"ARXIV_ID_PATTERN regex extracts IDs from raw text: arXiv:2301.00001, arXiv:2301.00001v2, https://arxiv.org/abs/2301.00001. 10/10 test patterns pass. Does NOT false-match DOIs.","bug_fixed":"_query_arxiv was passing DOIs to verify_arxiv_id — DOIs are NOT arXiv IDs. Now extracts arXiv IDs from raw text first, falls back to title search only when explicit title field exists","changes":["validators/citation_verify.py: Added ARXIV_ID_PATTERN regex","validators/citation_verify.py: Rewrote _query_arxiv with 2-strategy approach (extract ID from raw text, then title search)","validators/citation_verify.py: Added _extract_arxiv_id() static method","tests/validators/test_citation_verify_preprint.py: Added _query_openalex and _query_arxiv lambdas to 2 tests"],"hypothesis":"Extracting arXiv IDs from citation text makes the 4th resolver effective","old_behavior":"verify_arxiv_id(doi='10.1234/test') → always not found (DOIs aren't arXiv IDs)","new_behavior":"extract_arxiv_id(raw_text) → '2301.00001' → verify_arxiv_id('2301.00001') → found=True"}}
{"type":"config","name":"Extract arXiv IDs from arXiv DOIs (10.48550/arXiv.NNNN.NNNNN)","metricName":"arxiv_doi_extractions","metricUnit":"patterns","bestDirection":"higher"}
{"run":338,"commit":"2c0bffe","metric":0,"metrics":{},"status":"keep","description":"Baseline: ARXIV_ID_PATTERN correctly extracts arXiv IDs from DOI strings (10.48550/arXiv.2301.00001 → 2301.00001) but _query_arxiv only passes raw_text to _extract_arxiv_id, not the doi field. If a citation has doi=10.48550/arXiv.NNNN.NNNNN but no raw text, the arXiv ID is missed. Also _extract_title_from_raw is dead code (defined but never called).","timestamp":1780666263624,"segment":175,"confidence":null,"asi":{"coverage_gap":"_query_arxiv only extracts arXiv IDs from raw text, not from the doi field. If citation has doi=10.48550/arXiv.2301.00001 but raw text is empty, the arXiv ID is missed","dead_code":"_extract_title_from_raw is defined but never called (1 reference = definition only)","fix":"Pass both raw_text and doi to _extract_arxiv_id, remove dead _extract_title_from_raw","regex_works":"ARXIV_ID_PATTERN already correctly extracts 2301.00001 from 10.48550/arXiv.2301.00001 via group 2"}}
{"run":339,"commit":"f822577","metric":3,"metrics":{},"status":"keep","description":"Extend arXiv ID extraction to also check the doi field. _query_arxiv now passes both raw_text and doi to _extract_arxiv_id. arXiv DOIs (10.48550/arXiv.NNNN.NNNNN) are correctly extracted. Raw text has priority. Removed dead _extract_title_from_raw. 1302 tests pass.","timestamp":1780666394904,"segment":175,"confidence":null,"asi":{"changes":["validators/citation_verify.py: _query_arxiv now passes both raw_text AND doi to _extract_arxiv_id","validators/citation_verify.py: Removed dead _extract_title_from_raw (defined but never called)"],"coverage_gain":"arXiv DOIs (10.48550/arXiv.NNNN.NNNNN) in doi field are now extracted. Previously only raw text was checked.","dead_code_removed":"_extract_title_from_raw (20 lines) was dead code from #337 refactor","hypothesis":"Extracting arXiv IDs from arXiv DOI field improves resolver coverage for DOI-only citations","priority":"raw text checked first, then DOI field. Avoids unnecessary re-resolution when both contain arXiv IDs"}}
{"type":"config","name":"Fix _classify_citation score check for non-CR/S2 sources","metricName":"triangulation_accuracy","metricUnit":"scenarios","bestDirection":"higher"}
{"run":340,"commit":"7aff8a1","metric":0,"metrics":{},"status":"keep","description":"Baseline: _classify_citation has a bug where it checks cr_score and s2_score for title_mismatch even when those sources didn't find the citation. If OpenAlex+arXiv found it (sources_found=2), cr_score=0 < threshold → title_mismatch incorrectly. 3/3 non-CR/S2 combinations produce false title_mismatch. Only CR+S2 both found produces correct verified verdict.","timestamp":1780666511710,"segment":176,"confidence":null,"asi":{"bug":"_classify_citation checks cr_score and s2_score for title_mismatch but these are 0 when CR/S2 didn't find the citation. If OA+arXiv found it, sources_found=2 but cr_score=0 < threshold → title_mismatch incorrectly","fix":"Only check scores from sources that actually found the citation. Use max score across found sources","impact":"3/3 non-CR/S2 source combinations produce false title_mismatch"}}
{"run":341,"commit":"f8fc32d","metric":7,"metrics":{},"status":"keep","description":"Fix _classify_citation triangulation bug: only check scores from sources that found the citation. Old code checked cr_score and s2_score unconditionally — when those sources didn't find the citation, score=0 < threshold produced false title_mismatch. Now collects scores only from found sources and checks max score. 7/7 source combination scenarios correct. 1302 tests pass.","timestamp":1780666606283,"segment":176,"confidence":null,"asi":{"bug_fixed":"_classify_citation now collects scores only from sources that found the citation, uses max score for threshold check","fix_approach":"Collect found_scores list from sources where .found is True, check max(found_scores) against TITLE_SIMILARITY_THRESHOLD instead of checking cr_score and s2_score unconditionally","impact":"3 source combinations now correctly verified: OA+arXiv, CR+OA, S2+arXiv. Also correctly handles low-score title_mismatch case","old_behavior":"Checked cr_score and s2_score even when Crossref/S2 didn't find the citation → always 0 < threshold → title_mismatch"}}
{"type":"config","name":"Add source identification to partial and not_found findings","metricName":"evidence_completeness","metricUnit":"fields","bestDirection":"higher"}
{"run":342,"commit":"2de2abb","metric":0,"metrics":{},"status":"keep","description":"Baseline: partial finding has 4 _found booleans but no resolved_by field to identify which source found the citation. title_mismatch shows only crossref_title and s2_title but not openalex_title or arxiv_title. With 4 resolvers and the triangulation fix, findings should identify the resolving source.","timestamp":1780666805775,"segment":177,"confidence":null,"asi":{"evidence_gaps":["partial finding has 4 _found booleans but no resolved_by field","title_mismatch shows only cr_title and s2_title, missing oa_title and arxiv_title"],"hypothesis":"Adding resolved_by and all resolver titles to findings improves debuggability and resolver quality tracking","impact":"When a partial finding is produced, the user can immediately see which resolver found it without checking 4 booleans"}}
{"run":343,"commit":"5893ba6","metric":3,"metrics":{},"status":"keep","description":"Add source identification to citation findings. partial finding now has resolved_by list (e.g. ['arxiv']) identifying which resolver found the citation. title_mismatch finding now shows all 4 resolver titles (openalex_title, arxiv_title added). 1305 tests pass.","timestamp":1780666924655,"segment":177,"confidence":null,"asi":{"changes":["partial finding: added resolved_by list (e.g. ['arxiv']) identifying which resolver found the citation","title_mismatch finding: added openalex_title and arxiv_title to evidence (previously only crossref_title and s2_title)"],"hypothesis":"Adding resolved_by and all resolver titles to findings improves debuggability","test_count":"1305 passed (+3 new tests)"}}
{"type":"config","name":"Clean title extraction from raw reference text","metricName":"title_quality_score","metricUnit":"score","bestDirection":"higher"}
{"run":344,"commit":"7dc64fb","metric":8,"metrics":{},"status":"keep","description":"Baseline: _extract_citations sets title=full_raw_text when no DOI is present. 8/8 references contain the expected title but with 50-100% noise (reference number, authors, venue, year). search_by_title on Crossref/S2/OpenAlex receives noisy input, reducing match quality. Need clean title extraction heuristics.","timestamp":1780667284862,"segment":178,"confidence":null,"asi":{"hypothesis":"Extracting clean titles from raw reference text improves search_by_title accuracy for Crossref/S2/OpenAlex","note":"Type errors in CitationVerifyValidator are pre-existing, not from recent changes","noise":"8/8 contain expected title but with 50-100% noise (reference number, authors, venue, year all included)","problem":"_extract_citations sets title=full_raw_text when no DOI. search_by_title on Crossref/S2/OpenAlex gets noisy input like '1. Smith J, et al. Nature. 2023;456:123-130. A Great Paper Title.' instead of 'A Great Paper Title'"}}
{"run":345,"commit":"ceff2a1","metric":6,"metrics":{},"status":"keep","description":"Add _extract_title and _clean_title_segment static methods to extract clean paper titles from raw reference text. Heuristics: strip reference number, split on sentence boundaries, detect author-like first segment, extract second segment as title, strip trailing venue/year noise. 5/8 exact, 6/8 contain expected title. 1305 tests pass.","timestamp":1780667629508,"segment":178,"confidence":null,"asi":{"edge_cases":"#5 Smith et al Nature 2023 → extracts 'Nature' (short ref, author detection matches et al but second segment is venue). #7 arXiv:2301.00001 Test Paper → extracts '2024' (arXiv ID matches \\d{4} in author detection)","hypothesis":"Clean title extraction from raw reference text improves search_by_title accuracy","improvement":"5/8 exact titles extracted vs 0/8 with raw text. 6/8 contain expected title","note":"Type errors in CitationVerifyValidator are pre-existing, not from recent changes","static_method_fix":"_extract_title and _clean_title_segment are both @staticmethod — must use ClassName._clean_title_segment() not self._clean_title_segment()"}}
{"run":346,"commit":"617bb3a","metric":7,"metrics":{},"status":"keep","description":"Improve _extract_title: strip arXiv IDs and URLs before splitting, filter empty segments. Fixes arXiv ID edge case (arXiv:2301.00001 Test Paper → 'Test Paper About Something'). 6/8 exact titles, 7/8 contain expected. 1305 tests pass.","timestamp":1780667809935,"segment":178,"confidence":null,"asi":{"edge_case":"#5 Smith et al. Nature 2023. extracts 'Nature 2023.' instead of title — short reference with no real title. Acceptable: this reference has no extractable title","hypothesis":"Stripping arXiv IDs and filtering empty segments improves title extraction","improvement":"6/8 exact (was 5/8), 7/8 contain (was 6/8). arXiv ID edge case fixed","note":"Type errors in CitationVerifyValidator are pre-existing, not from recent changes. 7 transient test failures were pre-existing ordering issue"}}
{"type":"config","name":"Use _extract_title as fallback in resolvers when DOI verification fails","metricName":"title_fallback_hits","metricUnit":"scenarios","bestDirection":"higher"}
{"run":347,"commit":"89f81b7","metric":0,"metrics":{},"status":"keep","description":"Baseline: all 3 resolvers (Crossref, S2, OpenAlex) check citation.get('title') as fallback after DOI verification fails. For DOI-based citations, title=None so fallback never fires. Should use _extract_title(raw) to extract clean title for search_by_title fallback. Example: DOI='10.1234/deprecated' fails → title=None → gives up, but raw text contains 'Attention Is All You Need' that _extract_title can extract.","timestamp":1780667901278,"segment":179,"confidence":null,"asi":{"gap":"All 3 resolvers (Crossref, S2, OpenAlex) check citation.get('title') as fallback after DOI verification fails. For DOI-based citations, title=None so fallback never fires. Should use _extract_title(raw) to extract clean title for search_by_title fallback","hypothesis":"Using _extract_title(raw) as fallback in resolvers when DOI verification fails improves citation resolution rate","note":"Type errors in CitationVerifyValidator are pre-existing"}}
{"run":348,"commit":"1790d00","metric":3,"metrics":{},"status":"keep","description":"Add _resolve_title helper and title-from-raw fallback in all 3 resolvers. When DOI verification fails, resolvers now extract a clean title from raw reference text via _extract_title instead of giving up when title=None. _resolve_title priority: explicit title field > extracted title from raw > None. 3/3 scenarios pass (deprecated DOI, working DOI, no data). 1305 tests pass.","timestamp":1780668028591,"segment":179,"confidence":null,"asi":{"behavior_change":"Resolvers now try DOI first. If DOI fails OR DOI is absent, they call _resolve_title(citation) which checks title field then falls back to _extract_title(raw). Previously: DOI failure + title=None → immediate give-up","changes":["Added _resolve_title() helper: title field > _extract_title(raw) > None","All 3 resolvers (_query_crossref, _query_s2, _query_openalex): DOI fail → title fallback via _resolve_title instead of elif"],"hypothesis":"Using _extract_title(raw) as fallback when DOI verification fails improves citation resolution rate","note":"Type errors in CitationVerifyValidator are pre-existing"}}
{"run":349,"commit":"0dd126c","metric":4,"metrics":{},"status":"keep","description":"Unify all 4 resolvers to use _resolve_title for title search fallback. _query_arxiv now also uses _resolve_title instead of citation.get('title'). All 4 resolvers (Crossref, S2, OpenAlex, arXiv) now consistently extract titles from raw text when DOI fails and title is None. 1305 tests pass.","timestamp":1780668153816,"segment":179,"confidence":null,"asi":{"changes":["_query_arxiv now uses _resolve_title(citation) instead of citation.get('title') for Strategy 2 title search fallback"],"consistency":"All 4 resolvers now use _resolve_title for title resolution","hypothesis":"Using _resolve_title in arXiv resolver enables title-from-raw fallback for arXiv search too"}}
{"type":"config","name":"Support [N] reference format in _extract_citations","metricName":"ref_format_hits","metricUnit":"formats","bestDirection":"higher"}
{"run":350,"commit":"d58d6f9","metric":8,"metrics":{},"status":"keep","description":"Baseline: _extract_citations ref_start_re only matches N. and N) formats (8/8 correct for current behavior). Missing [N] (IEEE, Vancouver), (N) (some journals), and N<space> (minimalist) formats. These are common citation styles in CS and medical papers.","timestamp":1780668277430,"segment":180,"confidence":null,"asi":{"gap":"ref_start_re only matches N. and N) formats. Missing [N], (N), and N<space> formats used by IEEE, Vancouver, and other common citation styles","hypothesis":"Supporting [N] and other common reference number formats in _extract_citations improves coverage for IEEE/Vancouver style papers","note":"Type errors in CitationVerifyValidator are pre-existing","regex_current":"r'^\\s*\\d+[\\.\\)]\\s'"}}
{"run":351,"commit":"bb69e69","metric":10,"metrics":{},"status":"keep","description":"Extend ref_start_re to support [N] (IEEE, Vancouver) and (N) reference formats. New regex: r'^\\s*(?:\\d+[\\.\\)]\\s|\\[\\d+\\]\\s|\\(\\d+\\)\\s)'. Covers 10/10 test patterns including edge cases (triple-digit numbers, no-space rejection). 1305 tests pass.","timestamp":1780668397923,"segment":180,"confidence":null,"asi":{"formats_added":["[N] — IEEE, Vancouver, common in CS and medical papers","(N) — some journal styles"],"formats_existing":["N. — APA, Chicago, Nature","N) — numbered paren"],"hypothesis":"Supporting [N] and (N) reference formats in _extract_citations improves coverage for IEEE/Vancouver style papers","regex_new":"r'^\\s*(?:\\d+[\\.\\)]\\s|\\[\\d+\\]\\s|\\(\\d+\\)\\s)'","title_strip":"Existing title_strip regex already handles [N] and (N) prefixes correctly — no change needed there"}}
{"type":"config","name":"Deduplicate citations by DOI within same reference","metricName":"dedup_quality","metricUnit":"scenarios","bestDirection":"higher"}
{"run":352,"commit":"882a1c2","metric":0,"metrics":{},"status":"keep","description":"Baseline: _extract_citations creates one citation per DOI found in a reference. When 2 DOIs exist (arXiv DOI + publisher DOI, or DOI in URL + plain DOI), creates 2 citations for the same reference line. Both are verified separately with identical raw text, wasting API calls and potentially producing duplicate findings.","timestamp":1780668634496,"segment":181,"confidence":null,"asi":{"gap":"_extract_citations creates one citation per DOI found in a reference. When 2 DOIs exist (arXiv + publisher, or DOI in URL + plain DOI), creates 2 citations for the same reference line. Both verified separately with same raw text","hypothesis":"Deduplicating DOIs per reference reduces wasted API calls and duplicate findings","note":"Type errors in CitationVerifyValidator are pre-existing"}}
{"run":353,"commit":"aa091c0","metric":4,"metrics":{},"status":"keep","description":"Deduplicate DOIs per reference in _extract_citations. Use first DOI only — multiple DOIs in one reference typically point to the same paper (arXiv + publisher DOI). Reduces API calls and prevents duplicate findings. 4/4 dedup scenarios correct. 1315 tests pass.","timestamp":1780668838360,"segment":181,"confidence":null,"asi":{"behavior_change":"_extract_citations now uses first DOI only per reference. Previously: for doi in dois created N citations for N DOIs. Now: dois[0] creates 1 citation.","hypothesis":"Deduplicating DOIs per reference reduces wasted API calls and duplicate findings","note":"Type errors in CitationVerifyValidator are pre-existing. 1 test failure in test_essay_crafter_skill.py is pre-existing (unrelated missing file)","test_count":"1315 passed (excluding pre-existing essay_crafter failure)"}}
{"type":"config","name":"Fix _extract_title for APA author initials (Brown, T. B.)","metricName":"title_extract_accuracy","metricUnit":"correct","bestDirection":"higher"}
{"run":354,"commit":"d0a4d76","metric":3,"metrics":{},"status":"keep","description":"Baseline: _extract_title gets only 3/8 correct on Pandoc APA format. APA references with author initials (Brown, T. B.) split poorly on '. ' boundary — each initial becomes a separate segment, author detection matches single-letter segments, and takes the next single-letter as 'title'. Results: 'B' instead of 'Language models are few-shot learners'. Need to merge author initials before splitting.","timestamp":1780669085000,"segment":182,"confidence":null,"asi":{"bug":"APA references with author initials (Brown, T. B.) split poorly on '. ' boundary. Each initial becomes a separate segment, and author detection matches single-letter segments as authors, taking the NEXT single-letter segment as 'title'","hypothesis":"Pre-merging author initials before split fixes APA title extraction","note":"Type errors in CitationVerifyValidator are pre-existing","score":"3/8 correct. APA with initials all fail (Brown, Vaswani, Smith, Devlin)"}}
{"run":355,"commit":"c020642","metric":7,"metrics":{},"status":"keep","description":"Fix _extract_title for Pandoc APA format with author initials. Two-strategy approach: (1) APA regex extracts title after \"(YEAR). \" — handles Brown, T. B. (2020). Title correctly. (2) Collapse initials + segment split for numbered/IEEE formats. 7/8 correct (was 3/8). Also fixed ARXIV_ID_PATTERN regression and restored parallel-process file corruption. 1315 tests pass.","timestamp":1780669774262,"segment":182,"confidence":null,"asi":{"approach":"Two-strategy _extract_title: (1) APA regex r'\\(\\d{4}\\)\\.\\s+(.+?)' extracts title after year-in-parens — handles Pandoc APA perfectly. (2) Collapse initials + segment split fallback for numbered/IEEE formats","edge_case":"Smith et al. Nature 2023. extracts 'Nature 2023.' (trailing period) vs expected 'Nature 2023' — cosmetic, short ref with no real title","fixes":["APA with initials: Brown, T. B. (2020). Title → Title (was: 'B')","APA multi-author: Vaswani, A., Shazeer, N., & ... (2017). Title → Title (was: 'Attention' partial)","IEEE no-comma: [1] Brown T. Title → Title (was: 'Brown T')"],"note":"Restored ARXIV_ID_PATTERN to committed version (non-capturing prefix + single group) and simplified _extract_arxiv_id. Restored quality_appraisal.py from parallel process corruption"}}
{"type":"config","name":"paper verify mandatory artifacts","metricName":"verify_artifacts_count","metricUnit":"artifacts","bestDirection":"higher"}
{"run":355,"commit":"0ddd136","metric":0,"metrics":{},"status":"keep","description":"Baseline: 0/4 mandatory verify artifacts exist (evidence_matrix.csv, search_manifest.yaml, included_excluded_ledger.yaml, claim_citation_audit.yaml). The verify command only produces manifest.yaml with gate snapshot. No structured audit outputs for the 4 required publication readiness artifacts.","timestamp":1780759176997,"segment":184,"confidence":null,"asi":{"hypothesis":"paper verify produces 0 of 4 mandatory artifacts","next":"implement verify_artifacts_generator"}}
