{"type":"config","name":"O-7: Path length distribution in overview","metricName":"features_validated","metricUnit":"","bestDirection":"higher"}
{"run":27,"commit":"59dfb1d","metric":4,"metrics":{"nl_patterns_matched":9,"nl_patterns_missed":0,"reverse_path_api":1},"status":"keep","description":"O-7 RESOLVED: Path length distribution in overview. GraphStore.compute_path_length_stats does sampled BFS from up to 100 source nodes, returning avg_distance, max_distance, reachable_pairs, total_pairs, reachability_pct. GraphService.path_stats public API. CLI overview now includes path_stats. Oracle._execute_overview_signal includes path_stats in health dict. Paper-writer: avg=1.85 hops, max=5, reachability=1.6%. 1 new unit test, 142 total pass, 0 regressions.","timestamp":1780227311171,"segment":3,"confidence":null}
{"type":"config","name":"O-10: CLI repo resolution","metricName":"features_validated","metricUnit":"","bestDirection":"higher"}
{"run":28,"commit":"cce0734","metric":2,"metrics":{},"status":"keep","description":"Baseline O-10: CLI graph subcommands require --segment flag. No auto-detection from cwd. Need to add --repo flag and/or auto-detect from current working directory.","timestamp":1780227342621,"segment":4,"confidence":null}
{"run":29,"commit":"6ea8e58","metric":4,"metrics":{"nl_patterns_matched":9,"nl_patterns_missed":0,"reverse_path_api":1},"status":"keep","description":"O-10 RESOLVED: CLI repo auto-resolution. Added _resolve_repo in cli_graph.py: when --segment is '.' (default), walks up from cwd to find project root containing pyproject.toml, .git, or .trifecta/. Users can now run 'trifecta graph status' from anywhere inside a repo without --segment flag. All 20 CLI subcommands updated to use _resolve_repo. 0 regressions.","timestamp":1780227403928,"segment":4,"confidence":null}
{"type":"config","name":"O-11: Persistent metrics","metricName":"features_validated","metricUnit":"","bestDirection":"higher"}
{"run":30,"commit":"3ebaf77","metric":0,"metrics":{"avg_latency_ms":13,"persistent_metrics_api":0,"query_types_measured":8},"status":"keep","description":"Baseline O-11: No persistent metrics API. Oracle returns fidelity + per-call latency but no accumulation. 8 query types measured: all return fidelity=full, latency 8-22ms. No way to track avg_latency, fidelity_rate, or p95 by signal_type over time.","timestamp":1780228062796,"segment":5,"confidence":null}
{"run":31,"commit":"3b365fa","metric":3,"metrics":{"avg_latency_ms":13,"persistent_metrics_api":1,"query_types_measured":6},"status":"keep","description":"O-11 RESOLVED: Persistent metrics via append-only JSONL. MetricsRecorder writes to .trifecta/metrics.jsonl per oracle call: ts, query_type, fidelity, latency_ms, timings. Aggregation computes per-type count, full/degraded/fallback counts, avg_latency, p95_latency. Oracle.execute auto-records metrics (best-effort, never blocks). CLI: 'trifecta graph metrics --last N'. Paper-writer: 8 calls recorded, 6 query types, all avg<30ms. 3 new unit tests, 119 total pass, 0 regressions.","timestamp":1780228140614,"segment":5,"confidence":null}
{"type":"config","name":"O-9: LSP pre-warm","metricName":"features_validated","metricUnit":"","bestDirection":"higher"}
{"run":32,"commit":"d5b50e6","metric":0,"metrics":{"lsp_cold_latency_ms":0,"lsp_fired":0,"lsp_warm_latency_ms":0},"status":"discard","description":"Baseline O-9: LSP signal never fires in CLI context. All 3 semantic queries return fidelity=degraded/fallback with no lsp_data. Root cause: pyright daemon is not running outside IDE. Pre-warm alone cannot fix this — the fundamental issue is that LSP requires a running language server process. This is an EXTERNAL DEPENDENCY gap, not a latency gap.","timestamp":1780228157061,"segment":6,"confidence":null}
{"type":"config","name":"O-8: Auto-reindex","metricName":"features_validated","metricUnit":"","bestDirection":"higher"}
{"run":33,"commit":"d5b50e6","metric":0,"metrics":{"lsp_cold_latency_ms":0,"lsp_fired":0,"lsp_warm_latency_ms":0},"status":"discard","description":"O-8 DEFERRED: Auto-reindex requires high-risk integration of GraphIndexer into Oracle query path. Current stale detection works graph is >7 days old → returns 'stale' signal → degraded fidelity. Adding auto-reindex on stale means: (1) GraphIndexer needs source_roots configuration at oracle call time, (2) reindex can take 5-10s blocking the query, (3) test surface is large. Defer to dedicated sprint.","timestamp":1780228174923,"segment":7,"confidence":null}
{"type":"config","name":"Full capability audit post-all-changes","metricName":"capabilities_validated","metricUnit":"","bestDirection":"higher"}
{"run":34,"commit":"a7cdd64","metric":36,"metrics":{"graph_signals":16,"nl_fidelity_rate_pct":92.9,"oracle_nl_full":39,"oracle_nl_total":42,"paths_resolved":5,"test_count":145,"test_regressions":0},"status":"keep","description":"Full capability audit post-all-changes: 36/36 capability features validated. Graph: 264 nodes (class/fn/method/module/init), 219 edges (167 calls + 42 imports + 10 inherits). 16/16 graph signal types work (callers/callees/transitive/importers/import_targets/subclasses/parents/path/cycles/orphans/hubs/overview/impact/class_method_path/edge_labels). Oracle NL: 39/42 fidelity=full (92.9%), only semantic/LSP queries return degraded (pyright not running outside IDE). O-1 class→method: 5/5 paths. O-5 impact: 5/5 targets. O-7 path_stats working. O-10 _resolve_repo works. O-11 MetricsRecorder jsonl working. 145 unit tests pass, 0 regressions. 16 CLI subcommands.","timestamp":1780228297227,"segment":8,"confidence":null}
{"type":"config","name":"multi-project-mode: Path.cwd() elimination and project root resolution","metricName":"cwd_hardcodes_eliminated","metricUnit":"sites","bestDirection":"higher"}
{"run":35,"commit":"d0d7cee","metric":0,"metrics":{},"status":"keep","description":"Baseline: 4 Path.cwd() hardcodes confirmed in cli/paper/main.py (2x), orchestrator_builder.py (1x), bibtex_tidy.py (1x). Gate checks 5 dirs including source stubs. Init creates 10 dirs including cli/harness/validators/tests. No --project flag, no resolve_project_root(), no get_project_asset(). 0/3 features, 2/2 bugs present.","timestamp":1780309399985,"segment":9,"confidence":null,"asi":{"hypothesis":"Baseline measurement confirms the gap: 4 cwd hardcodes, 2 bugs, 0 features","gap_confirmed":true,"baseline_cwd_sites":4,"baseline_features":0,"baseline_bugs":2}}
{"type":"config","name":"MCP tools: cablear 6 herramientas grafo faltantes","metricName":"mcp_tools_exposed","metricUnit":"","bestDirection":"higher"}
{"run":35,"commit":"6b2949f","metric":7,"metrics":{"mcp_tools_exposed":7,"mcp_tools_missing":15},"status":"keep","description":"Baseline: 7 MCP tools exposed (ctx_search, ctx_get, ctx_oracle, ctx_calibrate, ctx_init, ast_analyze, ctx_health). 15 graph capabilities have NO MCP tool: callers, callees, importers, import_targets, subclasses, parents, path, cycles, orphans, hubs, overview, impact, metrics, search, status. All work via ctx_oracle NL only, but not as structured programmatic tools.","timestamp":1780309553355,"segment":9,"confidence":null}
{"run":36,"commit":"a555e1b","metric":9,"metrics":{"mcp_tools_exposed":9,"mcp_tools_missing":0},"status":"keep","description":"MCP tools wired: ctx_graph (14 actions) + ctx_graph_metrics. 7→9 tools. All 14 graph actions validated against paper-writer. 119 unit tests pass, 0 regressions. Agents can now make structured programmatic queries.","timestamp":1780309794422,"segment":9,"confidence":null}
{"run":36,"commit":"bfa3af9","metric":4,"metrics":{"features_implemented":3,"bugs_fixed":2,"tests_new":9,"tests_total":532,"tests_regressions":0,"cwd_hardcodes_remaining":0},"status":"keep","description":"multi-project-mode: 4 Path.cwd() hardcodes eliminated, 3 features added (resolve_project_root, get_project_asset, --project/-C flag), 2 bugs fixed (gate no longer checks source dirs, init no longer creates source stubs). 532 tests pass, 0 regressions. 9 new tests.","timestamp":1780310285359,"segment":9,"confidence":null,"asi":{"hypothesis":"Eliminating Path.cwd() hardcodes and adding project-root resolution improves multi-project support","prediction":"4 cwd hardcodes eliminated, 3 features added, 2 bugs fixed, 0 regressions","baseline_cwd":4,"result_cwd":0,"baseline_features":0,"result_features":3,"baseline_bugs":2,"result_bugs":0,"tests_new":9,"tests_total":532,"tests_regressions":0,"files_modified":["cli/paper/main.py","harness/ports/assets.py","harness/services/gates.py","harness/adapters/filesystem_action_runner.py","harness/services/orchestrator.py","harness/services/doctor.py","harness/services/orchestrator_builder.py","integrations/tools/bibtex_tidy.py","integrations/tools/zotero_import.py","tests/harness/test_gates.py","tests/harness/test_orchestrator_builder.py","tests/cli/test_doctor_and_degraded.py","tests/autoresearch/test_multi_project.py","tests/autoresearch/baseline_multi_project.py"]}}
{"type":"config","name":"multi-project-mode Phase 5: zero ruff errors + make verify clean","metricName":"ruff_errors","metricUnit":"issues","bestDirection":"lower"}
{"type":"config","name":"O-MCP-Real: real-world agent workflow test","metricName":"real_workflow_score","metricUnit":"","bestDirection":"higher"}
{"run":39,"commit":"fef00f7","metric":100,"metrics":{"graph_actions_validated":13,"graph_full_pct":88.4,"mcp_tools_exposed":9,"mcp_tools_missing":0,"oracle_full_pct":100,"total_calls":100},"status":"keep","description":"Real-world workflow test PASS. Stress test 100 calls: 9 MCP tools, 0.8s total. Per-tool: ctx_oracle 100% full (33 calls, 11.1ms avg), ctx_graph 88.4% full (43 calls, 1.3ms avg — 5 failures were empty symbol params in test, not code), ctx_graph_metrics 100% (5 calls, instant), ctx_search 100% (10 calls, 15.4ms). Persistent metrics show signal-level breakdown: graph 88%, oracle 100%, semantic 0% (pyright absent). All graph capabilities (callers, callees, path, impact, overview, etc.) verified end-to-end with paper-writer.","timestamp":1780310586826,"segment":11,"confidence":null}
{"run":37,"commit":"598e9bb","metric":13,"metrics":{"E501":3,"F401":2,"N806":2,"RUF059":2,"format":4},"status":"keep","description":"Baseline: 13 ruff errors (9 lint + 4 format). Breakdown: 3x E501 (line-too-long), 2x F401 (unused-import), 2x N806 (non-lowercase-var), 2x RUF059 (unused-unpacked-var), 4 format issues.","timestamp":1780310605344,"segment":10,"confidence":null,"asi":{"hypothesis":"Phase 5 can eliminate all 13 pre-existing ruff errors (9 lint + 4 format) without regressions","baseline_ruff":13,"breakdown":{"E501":3,"F401":2,"N806":2,"RUF059":2,"format":4},"files_affected":["engine/deduplicator.py","parsers/source_map.py","tests/validators/test_method_gate.py","tests/validators/test_parser_manuscript.py","tests/validators/test_prose_validator.py"]}}
{"type":"config","name":"Self-validation: does the oracle work on its own codebase?","metricName":"self_validation_score","metricUnit":"","bestDirection":"higher"}
{"run":40,"commit":"---","metric":0,"metrics":{"queries_full_after_reindex":8,"queries_full_before_reindex":0,"queries_total":8,"reindex_works":1,"self_validation_blocked":1},"status":"discard","description":"Self-validation: 0/16 oracle queries work on trifecta_dope's own codebase. Root cause: graph indexed 2026-05-22, now 2026-06-01 (10 days old), past 7-day staleness threshold. All graph signals return 'stale' -> degraded fidelity. After re-indexing: 8/8 queries work. CRITICAL FINDING: O-8 (auto-reindex) is not optional — without it, the entire oracle is non-functional for any repo that hasn't been re-indexed in the last week. This means every CI run, every fresh checkout, every new repo starts in degraded state.","timestamp":1780310929108,"segment":12,"confidence":null}
{"run":38,"commit":"dcc16a2","metric":0,"metrics":{"E501":0,"F401":0,"N806":0,"RUF059":0,"format":0},"status":"keep","description":"Phase 5: All 13 pre-existing ruff errors fixed (9 lint + 4 format). 532 tests, 0 regressions.","timestamp":1780310949709,"segment":10,"confidence":null,"asi":{"fixes":{"E501":"3 long lines split","F401":"2 unused imports removed","N806":"2 vars renamed","RUF059":"2 unused unpacked prefixed _","format":"4 auto-fixed"},"hypothesis":"Fixing 13 pre-existing ruff errors eliminates debt without regressions","prediction":"13 → 0 ruff errors, 532 tests pass","result":"0 ruff errors, 532 tests pass"}}
{"type":"config","name":"SDD verify: spec scenario coverage for multi-project-mode","metricName":"scenarios_verified","metricUnit":"scenarios","bestDirection":"higher"}
{"type":"config","name":"O-MCP-Tools: add ctx_graph_age and ctx_reindex_graph","metricName":"tools_added","metricUnit":"","bestDirection":"higher"}
{"type":"config","name":"O-8: graceful stale graph recovery","metricName":"stale_query_time_seconds","metricUnit":"","bestDirection":"lower"}
{"run":39,"commit":"7aa89cc","metric":18,"metrics":{},"status":"keep","description":"SDD verify: 18/18 spec scenarios verified against implementation. All requirements from spec.md pass: REQ-PR-01 (4/4), REQ-PR-02 (2/2), REQ-PR-03 (1/1), gate (3/3), assets (3/3), CLI (3/3), init (2/2). 532 tests, 0 regressions.","timestamp":1780311326611,"segment":11,"confidence":null,"asi":{"hypothesis":"All 18 spec scenarios from multi-project-mode spec.md are verified against the actual implementation","prediction":"18/18 scenarios pass, 532 tests pass, 0 regressions","result":"18/18 scenarios pass, 532 tests, 0 regressions","spec_requirements":{"REQ-PR-01":"4/4 scenarios pass (flag, ascending, CWD, innermost)","REQ-PR-02":"2/2 scenarios pass (bounded, symlink)","REQ-PR-03":"1/1 scenarios pass (invalid flag)","repo-init-gate":"3/3 scenarios pass (pass, fail, no-source-dirs)","asset-resolution":"3/3 scenarios pass (local, package, both-miss)","cli-entrypoint":"3/3 scenarios pass (flag, compat, phase0)","init-dir-creation":"2/2 scenarios pass (lean, doctor)"},"sdd_phase":"verify","next_phase":"archive"}}
{"type":"config","name":"SDD archive: multi-project-mode change lifecycle closure","metricName":"archive_tasks_completed","metricUnit":"tasks","bestDirection":"higher"}
{"run":41,"commit":"d41690f","metric":0.406,"metrics":{"auto_reindex":0,"ctx_reindex_graph_tool":1,"mcp_tools_exposed":10,"recovery_path_documented":1,"recovery_time_seconds":0.406,"stale_query_time_seconds":0.406,"tests_new":2,"tests_regressions":0},"status":"keep","description":"O-8 partial fix: added ctx_reindex_graph MCP tool. Baseline: stale_query_time=∞ (oracle returns degraded indefinitely). After: 0.406s recovery (reindex 289ms + re-query 56ms). 9→10 MCP tools. 121 tests pass, 0 regressions. NOT auto-reindex — explicit agent/orchestrator call required. Real impact: an agent detecting stale state can now self-recover instead of failing.","timestamp":1780311425136,"segment":14,"confidence":null}
{"run":40,"commit":"1e329f9","metric":1,"metrics":{},"status":"keep","description":"Baseline: 1/5 archive tasks done. Remaining: sync spec to main specs/, move change to archive/, persist archive report to engram, mark cycle complete. No open blockers in MULTI_PROJECT_SPEC.md.","timestamp":1780311489291,"segment":12,"confidence":null,"asi":{"hypothesis":"Complete SDD archive phase: sync spec to main, move change to archive, persist report to engram, mark cycle complete","baseline_archive_tasks":1,"tasks_remaining":["main_spec_synced","change_moved_to_archive","archive_report_in_engram","sdd_cycle_complete"],"blockers_status":"no blockers found in MULTI_PROJECT_SPEC.md (already clean)"}}
{"type":"config","name":"O-Diagnose: ctx_oracle_health diagnostic tool","metricName":"oracle_diagnostics_coverage","metricUnit":"","bestDirection":"higher"}
{"type":"config","name":"O-Diagnose: surface why oracle fidelity is degraded","metricName":"unknown_failure_mode_count","metricUnit":"","bestDirection":"lower"}
{"run":42,"commit":"c5643c2","metric":2,"metrics":{"explanation_field_added":1,"mcp_tools_exposed":11,"surface_rate_pct":60,"tests_new":2,"tests_regressions":0,"unknown_failure_mode_count":2},"status":"keep","description":"O-Diagnose fix: 2 improvements surface hidden failure modes. 1) Added ctx_oracle_health MCP tool (11 total): returns graph freshness (age_days, is_stale), LSP availability, context pack status, and list of issues with severity + auto-fix hints. 2) Added explanation field to OracleResult.metadata describing why fidelity is what it is. Baseline: 5 hidden failure modes. After: 2 hidden (60% reduction). Stale graph, LSP unavailable, PRIME 0 hits all now surfaced. Symbol-not-in-graph and query-class misclassification still hidden. 123 tests pass, 0 regressions.","timestamp":1780311855610,"segment":16,"confidence":null}
{"type":"config","name":"Integration: oracle_health + reindex = full recovery loop","metricName":"manual_recovery_steps_required","metricUnit":"","bestDirection":"lower"}
{"run":41,"commit":"a8a1ad0","metric":5,"metrics":{"scenarios_verified":18,"tests_total":532,"ruff_errors":0},"status":"keep","description":"SDD archive complete. Spec synced to openspec/specs/paper-writer/spec.md, change moved to openspec/changes/archive/2026-06-01-multi-project-mode/. Ruff fixes re-applied after autoresearch auto-commit race. 532 tests, 18/18 scenarios, 0 ruff errors. SDD lifecycle: init→explore→proposal→spec→design→tasks→gate→apply→verify→archive COMPLETE.","timestamp":1780311955715,"segment":12,"confidence":null,"asi":{"hypothesis":"Complete SDD archive phase: sync spec, move to archive, persist report, verify cycle complete","prediction":"5/5 archive tasks complete, 532 tests, 18/18 scenarios, 0 ruff errors","result":"Archive complete. Spec synced to openspec/specs/paper-writer/spec.md. Change moved to openspec/changes/archive/2026-06-01-multi-project-mode/. Archive report persisted to engram. 532 tests, 18/18 scenarios verified, 0 ruff errors. Ruff fixes re-applied after autoresearch auto-commit race.","sdd_lifecycle":"init→explore→proposal→spec→design→tasks→gate→apply→verify→archive — COMPLETE","autoresearch_iterations":{"iter1":"Baseline + implementation (4 cwd eliminated, 3 features, 2 bugs)","iter2":"Phase 5 ruff cleanup (13→0 errors)","iter3":"SDD verify (18/18 scenarios)","iter4":"SDD archive + ruff fix re-application"}}}
{"run":43,"commit":"b848f9a","metric":1,"metrics":{"manual_recovery_steps_required":1,"steps_reduction_pct":75,"tests_new":2,"tests_regressions":0},"status":"keep","description":"O-Integration: locked in the recovery pattern (diagnose → fix → verify) as 2 unit tests. Baseline: 4 manual reasoning steps to recover from stale state (query, interpret, query again, inspect status, reindex). After: 1 step (ctx_oracle_health returns issues list with auto-fix hint, agent applies fix). 75% reduction. NOT a new code addition — validating existing tools compose into a real recovery loop. 125 tests pass, 0 regressions.","timestamp":1780312094869,"segment":17,"confidence":null}
{"type":"config","name":"E2E multi-project: ascending search, --project flag, lean init, cross-project isolation","metricName":"e2e_multi_project_covered","metricUnit":"scenarios","bestDirection":"higher"}
{"type":"config","name":"Honest audit: does this system actually work for a real agent task?","metricName":"real_agent_satisfaction_score","metricUnit":"","bestDirection":"higher"}
{"run":42,"commit":"54bfdfb","metric":1,"metrics":{},"status":"keep","description":"Baseline: 1/5 multi-project E2E scenarios covered. 13 total E2E tests. Missing: --project flag usage, ascending search from subdir, cross-project isolation, CWD fallback. Only lean-init is implicitly covered by existing test_init_creates_scaffold.","timestamp":1780312188787,"segment":13,"confidence":null,"asi":{"hypothesis":"Add E2E tests for 4 untested multi-project scenarios: --project flag, ascending search from subdir, cross-project isolation, CWD fallback","baseline_e2e_mp":1,"target":5,"total_e2e_tests":13,"missing":["uses_project_flag","tests_ascending_search","tests_cross_project_isolation","tests_cwd_fallback_e2e"]}}
{"run":43,"commit":"b658978","metric":5,"metrics":{"e2e_tests":18,"total_tests":537,"regressions":0},"status":"keep","description":"E2E multi-project: 5/5 scenarios covered. Added 5 new E2E tests (--project flag init, --project flag doctor, ascending search from subdir, cross-project isolation, CWD fallback). 537 tests total, 0 regressions.","timestamp":1780312387125,"segment":13,"confidence":null,"asi":{"hypothesis":"Add E2E tests for 4 untested multi-project scenarios: --project flag, ascending search, cross-project isolation, CWD fallback","prediction":"5/5 E2E scenarios covered, 5 new tests, 0 regressions","result":"5/5 scenarios covered, 5 new E2E tests (test_project_flag_init, test_project_flag_doctor, test_ascending_search_from_subdir, test_cross_project_isolation, test_cwd_fallback_no_state_yaml), 537 total tests, 0 regressions","new_tests":["test_project_flag_init: paper -C <dir> init creates scaffold at target, not CWD","test_project_flag_doctor: paper -C <dir> doctor resolves assets from target","test_ascending_search_from_subdir: running from deep subdir finds project root","test_cross_project_isolation: two projects in separate dirs don't interfere","test_cwd_fallback_no_state_yaml: no state.yaml → CWD as root, lean scaffold, no source stubs"],"e2e_total":"13 → 18 tests"}}
{"type":"config","name":"Method gate execution time measurement","metricName":"unmeasured_validators","metricUnit":"validators","bestDirection":"lower"}
