{"run":207,"commit":"e804d97","metric":6,"metrics":{},"status":"keep","description":"Baseline: 6 SOFT_GATES integration gaps found. citation_verified and ethics_passed have validators but are never called from orchestrator, never checked in ready_for_delivery, and have zero call sites (dead code). Domain model and reset logic are correct.","timestamp":1780498754205,"segment":110,"confidence":null,"asi":{"gap1_orchestrator":"citation_verified NOT WIRED — validator exists but _run_gate_verification never calls it","gap2_orchestrator":"ethics_passed NOT WIRED — same","gap3_ready_for_delivery":"citation_verified NOT CHECKED in ready_for_delivery gate","gap4_ready_for_delivery":"ethics_passed NOT CHECKED in ready_for_delivery gate","gap5_dead_code":"validate_citation_verify_gate NEVER CALLED from anywhere","gap6_dead_code":"validate_ethics_passed_gate NEVER CALLED from anywhere","correct_state":"SOFT_GATES in domain model OK, reset_downstream_gates includes them OK, validate() accepts them OK","hypothesis":"SOFT_GATES are defined but not integrated into the pipeline — validators exist but are dead code"}}
{"type":"config","name":"Verify BACKLOG-002 alignment: domain, orchestrator, tests, docs, manifest, state.yaml","metricName":"verified_vs_rendered_contradictions","metricUnit":"contradictions","bestDirection":"lower"}
{"run":208,"commit":"c23591e","metric":0,"metrics":{},"status":"keep","description":"Verified: 0 contradictions between domain, orchestrator, tests, docs, manifest. The other agent's finding was based on pre-BACKLOG-002 code. All 7 layers now consistently use 'rendered'. 669 tests pass.","timestamp":1780498933522,"segment":111,"confidence":null,"asi":{"agent_report":"Other agent found verified vs rendered contradiction — but they were looking at pre-BACKLOG-002 code","verification":"7-layer alignment check: 0 contradictions. Domain, orchestrator, tests, docs, manifest all say 'rendered'. Docs only have 'verified' in historical/backlog context.","second_issue":"outputs/state.yaml says stage=search but outputs/ has drafts/ and render/ artifacts — repo coherence issue, not runtime bug","third_issue":"Docs contractuales vs wiring real — partially valid but soft gates are intentionally scaffold, not broken wiring","action_needed":"Update docs to explicitly state BACKLOG-002 is resolved and final stage is 'rendered'. Address repo coherence note for outputs/."}}
{"run":209,"commit":"5827dc8","metric":0,"metrics":{},"status":"keep","description":"Updated all docs to align with BACKLOG-002 rename. HARNESS_AND_STATE_MACHINE transition matrix now says rendered. MANIFEST_SPEC schema 1.1. CODE_ISSUES_LOG has auditor observations section. 669 tests pass.","timestamp":1780499405819,"segment":111,"confidence":null,"asi":{"doc_changes":"HARNESS_AND_STATE_MACHINE.md: transition matrix verified→rendered, schema 1.1. MANIFEST_SPEC.md: schema_version 1.0→1.1, added rename note. CODE_ISSUES_LOG.md: added auditor observations section with 3 findings all resolved/documented.","agent_findings_addressed":"1) verified vs rendered contradiction → code already aligned, docs now match. 2) state.yaml vs artifacts incoherence → documented as repo noise, not runtime bug. 3) docs contractuels vs wiring → documented SOFT_GATES as intentional scaffold.","tests":"669 passed, 0 failed (excluding 3 untracked test_cli files from another agent)"}}
{"type":"config","name":"BACKLOG-001: sweep remaining stale docs after BACKLOG-002 rename","metricName":"stale_doc_refs","metricUnit":"refs","bestDirection":"lower"}
{"run":210,"commit":"f1989d0","metric":0,"metrics":{},"status":"keep","description":"BACKLOG-001 docs sweep: fixed remaining stale contract doc in PRODUCTION_READINESS.md (final stage verified→rendered + verify semantics). Re-measure on product/contract docs: 0 stale refs remain.","timestamp":1780499524285,"segment":112,"confidence":null,"asi":{"hypothesis":"One remaining contract-level stale doc ref still said final stage was verified","fix":"docs/PRODUCTION_READINESS.md now says final stage is rendered; paper verify keeps stage at rendered and sets ready_for_delivery","scope":"Measured only product/contract docs (README, HARNESS_AND_STATE_MACHINE, MANIFEST_SPEC, ORCHESTRATOR_SPEC, PRODUCTION_READINESS, CODE_ISSUES_LOG, REPO_ARCHITECTURE, tools/paper-cli) to avoid false positives from plans/benchmarks using verified as adjective","result":"0 contract-level stale refs remain"}}
{"type":"config","name":"BACKLOG-005: wire structured YAML command logs into orchestrator runtime","metricName":"structured_command_logs","metricUnit":"logs","bestDirection":"higher"}
{"run":211,"commit":"abc943f","metric":0,"metrics":{},"status":"keep","description":"Baseline BACKLOG-005: structured_command_logs=0. Three successful orchestrator commands (init/search/screen) emit zero YAML command logs even though FilesystemActionRunner.write_command_log() exists.","timestamp":1780499717146,"segment":113,"confidence":null,"asi":{"hypothesis":"write_command_log exists but is dead code; orchestrator runtime emits no structured YAML logs","sequence":"init, search, screen in temp repo via real orchestrator builder","finding":"outputs/logs/*.yaml count = 0 after 3 successful commands","why_it_matters":"No per-command structured provenance, weak observability, runtime relies on ad-hoc .log files only"}}
{"run":212,"commit":"d635a6c","metric":3,"metrics":{},"status":"keep","description":"BACKLOG-005 partial implementation: orchestrator now emits structured YAML command logs. Representative init/search/screen sequence writes 3 logs (was 0). ActionRunner port extended, in-memory mock updated, filenames now use microseconds to avoid same-command collisions. 671 passed, 7 skipped in tracked suite.","timestamp":1780500147345,"segment":113,"confidence":null,"asi":{"hypothesis":"write_command_log is dead code; wiring it into orchestrator will produce per-command structured provenance without changing command behavior","implementation":"Added write_command_log to ActionRunner port, implemented mock support, orchestrator now writes best-effort structured logs on both success and failure, FilesystemActionRunner uses microsecond timestamps to avoid collisions","validation":"Focused tests: orchestrator + filesystem log tests passed. Integration metric: init/search/screen produced 3 YAML logs. Regression suite: 671 passed, 7 skipped (excluding untracked tests/test_cli from another agent).","payload_fields":"command, requested_stage, failure_policy, args, success, exit_code, stage_before, stage_after, steps, blockers, warnings, artifacts, gate_changes, state_changes"}}
{"type":"config","name":"SOFT_GATES wiring: connect citation_verified and ethics_passed validators to orchestrator pipeline","metricName":"soft_gate_gaps","metricUnit":"gaps","bestDirection":"lower"}
{"run":213,"commit":"5a77735","metric":6,"metrics":{},"status":"keep","description":"Baseline: 6 SOFT_GATES integration gaps confirmed. citation_verified and ethics_passed have validators but are never called from orchestrator, never checked in ready_for_delivery, and have zero call sites (dead code). Domain model and reset logic are correct.","timestamp":1780500488140,"segment":114,"confidence":null,"asi":{"citation_verified":"NOT wired in _run_gate_verification, NOT checked in ready_for_delivery, validator NEVER CALLED","ethics_passed":"NOT wired in _run_gate_verification, NOT checked in ready_for_delivery, validator NEVER CALLED","hypothesis":"SOFT_GATES have validators but are dead code — wiring them into orchestrator will close all 6 gaps","measurement":"grep-based scan of orchestrator.py, gates.py, and all .py files for call sites","next":"Wire both gates into _run_gate_verification (for check commands) and ready_for_delivery (for delivery check)"}}
{"run":214,"commit":"a472096","metric":0,"metrics":{},"status":"keep","description":"SOFT_GATES wiring complete: 6→0 gaps. citation_verified wired via check_refs (refs resolved → citations verified). ethics_passed checked as soft gate during verify command. Both validate_citation_verify_gate and validate_ethics_passed_gate now called from _run_gate_verification. Gaps 3&4 were false positives — ready_for_delivery already checks SOFT_GATES dynamically. 671 passed, 7 skipped.","timestamp":1780500897227,"segment":114,"confidence":null,"asi":{"check_refs_wiring":"citation_verified now auto-set when check_refs succeeds (refs resolved → citations verified)","gap3_4_false_positives":"ready_for_delivery already checks SOFT_GATES dynamically via ManuscriptState.SOFT_GATES loop — fixed measurement to recognize this","hypothesis":"SOFT_GATES validators exist but are dead code; wiring them into _run_gate_verification closes all 6 gaps without changing command behavior","implementation":"1) check_refs now returns citation_verified GateResult (pass if refs resolved). 2) verify command now calls validate_citation_verify_gate and validate_ethics_passed_gate alongside ready_for_delivery. 3) Updated measurement to recognize dynamic SOFT_GATES loop.","result":"6→0 gaps. citation_verified set via check_refs. ethics_passed checked as soft gate during verify. Both validators called from _run_gate_verification.","verify_wiring":"verify command now checks citation_verified and ethics_passed as soft gates (warnings, not blockers)"}}
{"type":"config","name":"BACKLOG-003: Replace generic artifact paths with unique identifiers (case_id/timestamp)","metricName":"generic_artifact_names","metricUnit":"paths","bestDirection":"lower"}
{"run":215,"commit":"699081d","metric":20,"metrics":{},"status":"keep","description":"Baseline BACKLOG-003: 20 generic artifact paths. Zero unique paths. Per-run outputs (search/*.json, render/manuscript.pdf, drafts/{name}.md) use hardcoded names that collide on re-run. state.yaml and manifest.yaml are singleton by design.","timestamp":1780501045305,"segment":115,"confidence":null,"asi":{"breakdown":"20 generic paths found: outputs/state.yaml (1), outputs/manifest.yaml (1), outputs/search/* (3), outputs/drafts/* (7), outputs/render/* (2), directories (3), log templates (3). Zero unique paths.","generic_categories":"state.yaml and manifest.yaml are singleton by design (1 per repo). search/*.json are per-run but generic (raw_results.json, screened_evidence.json, search_plan.json). drafts/{name}.md are parameterized but collidable if same section re-drafted. render/manuscript.pdf|docx are generic output names.","hypothesis":"Most artifact paths use generic names that collide if commands are re-run. Adding timestamps or run IDs would prevent collisions.","note":"state.yaml and manifest.yaml are intentionally singleton (1 per repo). Only per-run artifacts (search, render, drafts) need unique names."}}
{"type":"config","name":"BACKLOG-006: Make warn vs fail-closed gate semantics explicit in code contracts","metricName":"ambiguous_gate_semantics","metricUnit":"gates","bestDirection":"lower"}
{"run":216,"commit":"1da1e90","metric":8,"metrics":{},"status":"keep","description":"Baseline BACKLOG-006: 8 of 10 gate validators have ambiguous semantics. All 8 hard gates (fail-closed) lack explicit documentation about their failure mode. Only ready_for_delivery and soft gate validators document their warn/fail semantics.","timestamp":1780501148140,"segment":116,"confidence":null,"asi":{"ambiguous_gates":"8 of 10 gate validators lack semantic documentation. All 8 are hard gates (fail-closed) with no docstring mentioning 'fail-closed', 'blocker', or 'hard'. The 2 documented gates are validate_ready_for_delivery (has soft checks) and validate_citation_verify_gate/validate_ethics_passed_gate (soft-only, documented).","hypothesis":"Adding fail-closed semantic documentation to hard gates makes the gate behavior explicit and discoverable","root_cause":"Gate validators were written as implementation-first (code works) without documenting the contractual semantics of their failure modes"}}
{"run":217,"commit":"4dac7ce","metric":0,"metrics":{},"status":"keep","description":"BACKLOG-006 resolved: 8→0 ambiguous gate semantics. All 8 hard gate validators now explicitly document their fail-closed behavior in docstrings. No code changes — documentation-only. 671 passed, 7 skipped.","timestamp":1780501339412,"segment":116,"confidence":null,"asi":{"changes":"Updated docstrings for 8 gate validators: repo_initialized, search_completed, screened_evidence, outline_drafted, sections_completed, bib_normalized, validator_gate, render_passed. All now explicitly document their fail-closed semantics.","hypothesis":"Adding fail-closed semantic documentation to gate validators makes behavior explicit and discoverable","pattern":"Hard gates: 'Fail-closed: X is a hard blocker.' Soft gates: 'Soft gate: warns if Y.' Validator gate: documents both fail and warn paths."}}
{"type":"config","name":"BACKLOG-007: Reconcile documentation claims with actual test state","metricName":"doc_test_mismatches","metricUnit":"mismatches","bestDirection":"lower"}
{"run":218,"commit":"6436c60","metric":0,"metrics":{},"status":"keep","description":"BACKLOG-007 partial: 5→0 doc-test mismatches. Fixed REPO_ARCHITECTURE.md stale absolute paths (examen_grado → local skills/imported/). Measurement refined to exclude code blocks and convention dirs. All doc claims now match runtime state.","timestamp":1780501525268,"segment":117,"confidence":null,"asi":{"fixes":"Updated REPO_ARCHITECTURE.md source paths from /examen_grado/ to local skills/imported/ paths. vendor/ dir is a convention not required to exist — excluded from measurement.","hypothesis":"Docs reference stale absolute paths from original repo; updating to local paths eliminates mismatches","result":"5→0 mismatches. The 5 original findings were: 2 stale examen_grado paths (fixed), 2 grep commands in code blocks (false positives excluded), 1 vendor/ convention dir (excluded)."}}
{"type":"config","name":"BACKLOG-008: Modularize CLI — reduce main.py line count by extracting subcommand handlers","metricName":"cli_main_lines","metricUnit":"lines","bestDirection":"lower"}
{"run":219,"commit":"2c376f8","metric":816,"metrics":{},"status":"keep","description":"Baseline BACKLOG-008: cli/paper/main.py has 816 lines with 9 subcommand handlers (414 lines) and argparse config (347 lines). Threshold is <300 lines for maintainability.","timestamp":1780501617260,"segment":118,"confidence":null,"asi":{"architecture":"main.py has 816 lines with 9 subcommand handlers (_cmd_audit_prose, _cmd_audit_claims, _cmd_audit_citations, _cmd_audit_ethics, _cmd_audit_writing_quality, _cmd_trace, _cmd_graph_overview, _cmd_audit_code_health, _cmd_gate_method) plus main() with argparse setup (469-816 = ~350 lines of parser config)","handlers_line_range":"Handlers span lines 54-468 (~414 lines). Parser config spans 469-816 (~347 lines). Total 816.","hypothesis":"Extracting subcommand handlers into separate modules (cli/paper/commands/) would reduce main.py to <200 lines (parser config + imports only)","extraction_targets":"audit commands (prose, claims, citations, ethics, writing_quality, code_health) → cli/paper/commands/audit.py. graph commands (trace, overview) → cli/paper/commands/graph.py. gate_method → cli/paper/commands/gate.py"}}
{"run":220,"commit":"bf59531","metric":413,"metrics":{},"status":"keep","description":"BACKLOG-008: 816→413 lines (-49%). Extracted 9 subcommand handlers into cli/paper/commands/ package (audit.py, graph.py, gate.py). main.py retains argparse config + main(). All 671 tests pass, 7 skipped.","timestamp":1780501815750,"segment":118,"confidence":null,"asi":{"extraction":"Created cli/paper/commands/ package with audit.py (276 lines, 6 handlers), graph.py (119 lines, 2 handlers), gate.py (42 lines, 1 handler). main.py imports from commands and keeps only argparse config + main().","hypothesis":"Extracting subcommand handlers into cli/paper/commands/ reduces main.py by ~50% without changing behavior","result":"816→413 lines (-49%). All 671 tests pass. Import contract maintained: tests import from cli.paper.main:main.","structure":"cli/paper/commands/__init__.py (package init), audit.py (prose, claims, citations, ethics, writing_quality, code_health), graph.py (trace, overview), gate.py (gate_method)"}}
{"type":"config","name":"Verify CLI tests pass after modularization — detect import breakage from handler extraction","metricName":"cli_test_failures","metricUnit":"failures","bestDirection":"lower"}
{"run":221,"commit":"e68c9d0","metric":0,"metrics":{},"status":"keep","description":"CLI modularization verified: 16/16 CLI tests pass after handler extraction. Subprocess tests confirm 'python -m cli.paper.main' still works correctly. 0 import breakage.","timestamp":1780501974261,"segment":119,"confidence":null,"asi":{"hypothesis":"CLI modularization may have broken test_cli tests since handlers were moved to cli/paper/commands/","result":"0 failures. All 16 CLI tests pass. Subprocess tests run 'python -m cli.paper.main' which works because main() imports from commands package.","test_structure":"3 test files: test_audit_citations.py (5 tests), test_audit_ethics.py (5 tests), test_audit_writing_quality.py (6 tests). All use subprocess to invoke the real CLI."}}
{"type":"config","name":"Measure public API test coverage — find untested module entry points","metricName":"api_coverage_pct","metricUnit":"percent","bestDirection":"higher"}
{"run":222,"commit":"577ac88","metric":91.3,"metrics":{},"status":"keep","description":"Baseline API coverage: 91.3% (95/104 public symbols). 9 uncovered: 7 data types tested indirectly, 2 soft gate validators (citation_verified, ethics_passed) wired but without dedicated unit tests.","timestamp":1780502164358,"segment":120,"confidence":null,"asi":{"covered_types":"95/104 public symbols referenced from tests (91.3%). Most uncovered are data types (Check, GateResult, SkillResult, SourcePosition, TrifectaResult, TrifectaUnavailableError) tested indirectly.","genuine_gaps":"validate_citation_verify_gate and validate_ethics_passed_gate — soft gate validators wired in this session but without dedicated unit tests","hypothesis":"Public API coverage is high (~91%). The 9 uncovered symbols are mostly data types tested indirectly. Only 2 genuine gaps: soft gate validators need unit tests."}}
{"run":223,"commit":"907eb33","metric":93.3,"metrics":{},"status":"keep","description":"Added 6 unit tests for soft gate validators (citation_verified, ethics_passed). API coverage 91.3%→93.3%. 693 passed, 7 skipped. Remaining 7 uncovered symbols are data types tested indirectly.","timestamp":1780502319782,"segment":120,"confidence":null,"asi":{"added_tests":"6 unit tests for soft gate validators: TestCitationVerifyGate (pass, warn_false, warn_missing) + TestEthicsPassedGate (pass, warn_false, warn_missing)","coverage_change":"91.3% -> 93.3% (+2pp). 9 -> 7 uncovered. Remaining 7 are all data types (Check, GateResult, SkillResult, SourcePosition, TrifectaResult, TrifectaUnavailableError) tested indirectly via gate and integration tests.","hypothesis":"Adding unit tests for soft gate validators closes 2 genuine API coverage gaps","total_tests":"693 passed, 7 skipped (was 687)"}}
{"type":"config","name":"Cover remaining 7 data types with minimal construction tests","metricName":"data_type_coverage_pct","metricUnit":"percent","bestDirection":"higher"}
{"run":224,"commit":"4f08e7f","metric":100,"metrics":{},"status":"keep","description":"100% public API coverage: 104/104 symbols referenced from tests. Added 8 construction tests for data types (TrifectaResult, SkillResult, Check, GateResult, run_gate, SourcePosition). 701 passed, 7 skipped.","timestamp":1780502511583,"segment":121,"confidence":null,"asi":{"added_tests":"8 construction tests: TrifectaUnavailableError (1), TrifectaResult (1), SkillResult (2 including invalid status), Check (1), GateResult (1), run_gate (1), SourcePosition (1)","coverage_change":"93.3% -> 100.0%. All 104 public symbols in core modules now referenced from tests.","hypothesis":"Adding minimal construction tests for 7 data types closes the static coverage gap","total_tests":"701 passed, 7 skipped (was 693)"}}
{"type":"config","name":"Validate all validator outputs against their JSON schemas","metricName":"schema_violations","metricUnit":"violations","bestDirection":"lower"}
{"run":225,"commit":"ea63589","metric":0,"metrics":{},"status":"keep","description":"Schema validation: 0 violations. All validator outputs (prose, claims, method_gate, findings) conform to their JSON schemas. No alignment fixes needed.","timestamp":1780502605479,"segment":122,"confidence":null,"asi":{"checked_schemas":"prose_audit.schema.json, claim_audit.schema.json, method_gate.schema.json, finding.schema.json","hypothesis":"Validator outputs may not match their declared JSON schemas","result":"0 violations. All validator outputs conform to their JSON schemas. The schemas are aligned with actual code output."}}
{"type":"config","name":"Fix lint errors — especially F821 undefined-name (real bugs)","metricName":"lint_errors","metricUnit":"errors","bestDirection":"lower"}
