{"run":352,"commit":"8b15e8a","metric":1,"metrics":{},"status":"keep","description":"Add contamination_signals.py: pure-logic contamination risk scoring. compute_contamination_signal(venue, year) returns ContaminationSignal with preprint detection, recency check, and contamination_score (0.0-1.0). Reuses PREPRINT_VENUES from citation_verify. 13 tests pass. Reduces missing components from 2 to 1 (only multi-resolver triangulation remains).","timestamp":1780659605081,"segment":182,"confidence":null,"asi":{"contamination_module":"validators/contamination_signals.py","function":"compute_contamination_signal(venue, year) -> ContaminationSignal","scoring":"preprint_venue +0.4, recent_preprint +0.3, clamped [0.0, 1.0]","remaining":"Multi-resolver triangulation needs OpenAlex + arXiv client porting (~300 loc)"}}
{"run":322,"commit":"0590700","metric":6,"metrics":{},"status":"keep","description":"Add definitional sentence exclusion to prose validator — ARS uncited_assertion_detector condition 3. DEFINITIONAL_SENTENCE_RE with 6 patterns: 'refers to', 'is defined as', 'we define', 'for the purposes of', 'can be understood/defined as', 'is a type/kind/form/class of', 'means that/the'. Connected in sentence scope: sentences with evidence_required: [citation] are excluded from uncited flags when EITHER citation is present OR sentence is definitional. 10/10 test cases, 1244 total tests pass, 0 regressions.","timestamp":1780659674501,"segment":166,"confidence":null,"asi":{"best_skill":"codebase-explorer (ARS pattern porting)","hypothesis":"Adding definitional sentence exclusion completes ARS uncited_assertion_detector condition 3","result":"CONFIRMED. Added DEFINITIONAL_SENTENCE_RE with 6 patterns: 'refers to', 'is defined as', 'we define', 'for the purposes of', 'can be understood/defined as', 'is a type/kind/form/class of', 'means that/the'. Connected in prose.py sentence scope — sentences matching both evidence_required: [citation] AND definitional pattern are excluded from uncited flags. 10/10 test cases pass. 1244 total tests, 0 regressions","ars_condition_3":"ARS uncited_assertion_detector condition 3: 'Not a definitional sentence (refers to/is defined as/we define/for the purposes of)'. Now fully implemented in our prose validator","implementation":"DEFINITIONAL_SENTENCE_RE is checked alongside CITATION_MARKER_RE. Sentences are excluded from uncited flags when EITHER citation is present OR sentence is definitional","tests":"10/10 definitional patterns verified. Empirical claims correctly NOT excluded. Definitional sentences correctly excluded"}}
{"type":"config","name":"API client count for citation verification","metricName":"api_clients_count","metricUnit":"count","bestDirection":"higher"}
{"type":"config","name":"Add citation verification summary reducer (ARS 3-class verdict)","metricName":"verdict_classes","metricUnit":"classes","bestDirection":"higher"}
{"run":353,"commit":"1df6c20","metric":4,"metrics":{},"status":"keep","description":"Baseline: 4 API clients (crossref, semantic_scholar, trifecta, llm_content). Citation verification uses 2 (crossref + S2). Multi-resolver triangulation needs 2 more: OpenAlex (JSON, same pattern as crossref) and arXiv (XML, harder).","timestamp":1780659798852,"segment":183,"confidence":null,"asi":{"clients":["crossref","semantic_scholar","trifecta","llm_content"],"citation_clients":["crossref","semantic_schorar"],"missing_for_triangulation":["openalex","arxiv"]}}
{"run":323,"commit":"72c916a","metric":3,"metrics":{},"status":"keep","description":"Add 3-class citation verification verdict reducer (ported from ARS citation_verification_summary). reduce_citation_verdict() produces: 'verified' (all citations resolved), 'unresolvable' (coverage gaps, no DOI to verify — not fabrication), 'fabricated' (DOI-keyed not found — strong fabrication evidence). Mirrors ARS C-V6(a) narrowed-false definition. Wired into validate() as summary finding. Fixed CitationVerifyAdapter to exclude summary from gate logic. 1256 tests pass, 0 regressions.","timestamp":1780660276513,"segment":167,"confidence":null,"asi":{"best_skill":"codebase-explorer (ARS reducer porting + adapter integration)","hypothesis":"Porting ARS citation_verification_summary 3-class reducer improves our pipeline's ability to distinguish real citation problems from coverage gaps","result":"CONFIRMED. Added reduce_citation_verdict() with 3 classes: verified, unresolvable, fabricated. Logic mirrors ARS C-V6(a): DOI-keyed failure = fabricated, title-only failure = unresolvable, all clear = verified. Wired into validate() as summary finding. Fixed 3 tests that expected no summary finding. Also fixed CitationVerifyAdapter gate logic to exclude summary from gate_changes. 1256 tests pass, 0 regressions","verdict_classes":{"verified":"All citations resolved, no real findings","unresolvable":"Title-only failures or coverage gaps — not fabrication","fabricated":"DOI-keyed failure — strong fabrication evidence"},"integration_points":["validators/citation_verify.py::reduce_citation_verdict() — pure reducer function","CitationVerifyValidator.validate() — appends summary finding","CitationVerifyAdapter.execute() — excludes summary from gate logic"],"tests_fixed":["test_offline_returns_skipped_findings — exclude summary from assertion","test_offline_produces_skipped_findings — exclude summary from rule_id check","test_execute_offline_returns_gate_change — adapter now excludes summary from gate count"]}}
{"run":354,"commit":"1c190a7","metric":5,"metrics":{"openalex_tests":12},"status":"keep","description":"Add OpenAlex API client for citation verification. Follows CrossrefClient pattern: verify_doi + search_by_title + _parse_work. JSON API, polite pool (mailto), outage latch, retry with backoff. 12 tests pass. API clients: 4 → 5. Multi-resolver triangulation now only needs arXiv client.","timestamp":1780660289803,"segment":183,"confidence":null,"asi":{"client":"clients/openalex.py","pattern":"Same JSON pattern as CrossrefClient — verify_doi + search_by_title + _parse_work + _get + outage latch + retry_with_backoff","openalex_features":"DOI verification, title search, citation count, open access status, venue extraction, polite pool (mailto)","tests":12,"remaining_for_triangulation":"arXiv client (XML parsing + Atom namespace)"}}
{"type":"config","name":"Add arXiv API client (XML, Atom namespace)","metricName":"api_clients","metricUnit":"clients","bestDirection":"higher"}
{"run":324,"commit":"6ad42b9","metric":5,"metrics":{},"status":"keep","description":"Baseline: 5 API clients (crossref, semantic_scholar, openalex, trifecta, llm_content). Citation verification uses 3 (crossref + S2 + openalex). Multi-resolver triangulation needs 1 more: arXiv (XML, harder than JSON clients).","timestamp":1780660405744,"segment":168,"confidence":null,"asi":{"api_clients":["crossref","llm_content","openalex","semantic_scholar","trifecta"],"hypothesis":"arXiv client is the last missing client for multi-resolver triangulation","missing":"arXiv client — XML parsing (ElementTree + Atom namespace), 3s rate limit, id_list + ti: search"}}
{"run":325,"commit":"da0eb47","metric":6,"metrics":{},"status":"keep","description":"Add arXiv API client for citation verification. XML parsing (ElementTree + Atom namespace), 3s rate limit per arXiv ToU, verify_arxiv_id + search_by_title, outage latch, retry_with_backoff. Follows CrossrefClient/OpenAlexClient pattern. 27 tests pass. API clients: 5 → 6. Multi-resolver triangulation complete.","timestamp":1780660847155,"segment":168,"confidence":null,"asi":{"ars_port":"Ported from ARS arxiv_client.py (Delta 1). Key adaptations: ArxivResult dataclass instead of bare dict, outage latch from our pattern, retry_with_backoff instead of manual retry loop, clock injection for testability","client_count":6,"hypothesis":"arXiv client completes multi-resolver triangulation — last missing API client","implementation_details":["XML parsing with ElementTree + Atom namespace {http://www.w3.org/2005/Atom}","3s rate limit per arXiv ToU (vs 1s for Crossref/OpenAlex)","verify_arxiv_id() for exact lookup via ?id_list={id}","search_by_title() via ?search_query=ti:\"{title}\" with similarity threshold","Outage latch (fail-fast on network error)","retry_with_backoff on 429","title_similarity + year tiebreaker scoring"],"test_coverage":"27 tests: 12 extractors, 2 offline, 3 verify, 3 search, 4 error handling, 3 rate limit"}}
{"type":"config","name":"Wire arXiv as 4th citation resolver","metricName":"resolver_count","metricUnit":"resolvers","bestDirection":"higher"}
{"run":326,"commit":"231d485","metric":3,"metrics":{},"status":"keep","description":"Baseline: citation_verify uses 3 resolvers (Crossref, S2, OpenAlex). arXiv client exists in clients/arxiv.py but is not wired into CitationVerifyValidator. Missing: _query_arxiv(), arxiv_client in constructor, arXiv result in _classify_citation.","timestamp":1780660945140,"segment":169,"confidence":null,"asi":{"hypothesis":"Wiring arXiv as 4th resolver improves citation verification coverage","missing":"_query_arxiv() + arxiv_client in constructor + arXiv in _classify_citation"}}
{"run":327,"commit":"ba553fc","metric":4,"metrics":{},"status":"keep","description":"Wire arXiv as 4th citation resolver in CitationVerifyValidator. Added _query_arxiv(), arXiv in constructor, 4-source voting in _classify_citation, arXiv in _detect_preprint for venue extraction, arxiv_found in evidence dicts. Fixed test_citation_verify_preprint.py performance: 84s → 0.02s (real ArxivClient was making HTTP calls). Full suite: 98s → 6s. 1278 tests pass.","timestamp":1780663123556,"segment":169,"confidence":null,"asi":{"arxiv_evidence_fields":"not_found + partial findings now include arxiv_found in evidence","classify_logic":"sources_found = sum([cr_found, s2_found, oa_found, ar_found]). >=2 verified, ==1 partial, ==0 not_found","detect_preprint":"arXiv results now included in venue extraction loop for preprint detection","hypothesis":"Wiring arXiv as 4th resolver improves citation verification coverage","implementation":["Added ArxivClient to __init__ constructor (4th client)","Added _query_arxiv() method (same pattern as _query_openalex)","Wired arXiv into verify_single: crossref + s2 + openalex + arXiv → _classify_citation + _detect_preprint","Updated _classify_citation to accept arXiv result, 4-source voting","Updated _detect_preprint to accept arXiv for venue extraction (uses getattr for venue/year)","Added arxiv_found to not_found + partial finding evidence dicts"],"performance_fix":"Tests without arXiv mock created real ArxivClient(offline=False) which made real HTTP calls. Fixed test_citation_verify_preprint.py: 84s → 0.02s. Total suite: 98s → 6s","resolver_count":4}}
{"type":"config","name":"Wire contamination signals into citation verification pipeline","metricName":"contamination_integration","metricUnit":"points","bestDirection":"higher"}
{"run":328,"commit":"fc353fa","metric":0,"metrics":{},"status":"keep","description":"Baseline: contamination_signals.py exists with compute_contamination_signal(venue, year) but is NOT imported or used by citation_verify. verify_single does not compute contamination scores. Need to wire contamination detection into the verification pipeline.","timestamp":1780663275275,"segment":170,"confidence":null,"asi":{"hypothesis":"Wiring contamination_signals into citation_verify augments findings with contamination risk scores","missing":"Import + call compute_contamination_signal in verify_single, add contamination_score to evidence"}}
{"run":329,"commit":"54daec2","metric":3,"metrics":{},"status":"keep","description":"Wire contamination signals into citation verification pipeline. compute_contamination_signal now augments ALL findings with contamination_score (0.0-1.0), is_preprint, is_recent_preprint, and flags. Added _extract_venue_year() helper. Fixed circular import by moving PREPRINT_VENUES to contamination_signals.py. 1278 tests pass.","timestamp":1780663718182,"segment":170,"confidence":null,"asi":{"changes":["verify_single: replaced _detect_preprint with compute_contamination_signal for all findings","All findings now include contamination data via ContaminationSignal.to_dict()","PREPRINT_VENUES moved to contamination_signals.py (canonical location), re-exported from citation_verify","Added _extract_venue_year() helper for clean venue+year extraction from 4 resolvers"],"evidence_shape":{"not_found":"includes contamination_score (0.0-1.0), is_preprint, flags","preprint_source":"includes contamination_score (0.4-0.7), is_preprint=True, is_recent_preprint, flags=['preprint_venue', 'recent_preprint']","title_mismatch":"includes contamination data from venue/year extraction","partial":"includes contamination data"},"hypothesis":"Wiring contamination_signals into citation_verify augments all findings with contamination risk scores","integration_points":3,"circular_import_fix":"Moved PREPRINT_VENUES from citation_verify to contamination_signals to break circular dependency. citation_verify re-exports for backward compatibility."}}
{"type":"config","name":"Add tiered gate verdict system (ARS claim_audit_finalizer)","metricName":"gate_tiers","metricUnit":"tiers","bestDirection":"higher"}
{"run":330,"commit":"3c38614","metric":2,"metrics":{},"status":"keep","description":"Baseline: 2 gate tiers (pass/fail boolean). method_gate has implicit 3-tier separation (blockers P0 / warnings P1-P2 / passed) but final verdict is binary gate_passed. No shared gate system — each validator has own gate logic. ARS has 4 tiers + annotations + selective gate refusal.","timestamp":1780663940642,"segment":171,"confidence":null,"asi":{"architecture":"No shared gate system — each validator has its own gate logic. method_gate uses gate_passed boolean, citation_verify uses citation_verified boolean in gate_changes, prose uses pass/fail per-rule","ars_finalizer":"8-row matrix with annotation literals + severity tiers (none/low_warn/med_warn/high_warn) + gate_refuse boolean. Very ARS-specific pipeline coupling","hypothesis":"A shared GateVerdict dataclass with tier + annotation + gate_refuse improves all validators' ability to distinguish critical from informational findings","method_gate":"Already has 3 tiers implicitly: blockers (P0), warnings (P1/P2), passed. But final verdict is binary gate_passed","plan":"Create shared GateVerdict dataclass. Wire into method_gate as proof of concept. Shows path to full tiered gates."}}
{"run":331,"commit":"427d4ce","metric":4,"metrics":{},"status":"keep","description":"Add tiered gate verdict system (GateVerdict dataclass). 4 tiers: none/low_warn/med_warn/high_warn with auto gate_refuse for high_warn. severity_to_tier maps P0-P3 to tiers. tier_from_findings computes aggregate verdict. Wired into method_gate.py as gate_verdict field alongside backward-compatible gate_passed. 24 new tests. 1302 total tests pass.","timestamp":1780664353231,"segment":171,"confidence":null,"asi":{"changes":["validators/gate_verdict.py: new module with GateVerdict dataclass, severity_to_tier(), tier_from_findings()","validators/method_gate.py: import + wire gate_verdict into both return paths","tests/test_validators/test_gate_verdict.py: 24 tests (4 test classes)"],"gate_verdict_dataclass":"tier (none/low_warn/med_warn/high_warn) + annotation + gate_refuse + message + evidence","hypothesis":"A shared GateVerdict dataclass with 4 tiers improves all validators' ability to distinguish critical from informational findings","implementation":"GateVerdict is frozen dataclass with auto gate_refuse for high_warn. severity_to_tier maps P0->high_warn, P1->med_warn, P2->low_warn, P3/info->none. tier_from_findings computes worst-tier aggregate. method_gate now returns gate_verdict dict alongside gate_passed boolean.","method_gate_integration":"Both return paths now include gate_verdict field. Backward compatible — gate_passed still present for existing consumers."}}
{"type":"config","name":"Wire GateVerdict into citation_verify and prose validators","metricName":"validators_with_tiered_gates","metricUnit":"validators","bestDirection":"higher"}
{"run":332,"commit":"52a308f","metric":1,"metrics":{},"status":"keep","description":"Baseline: only 1 validator (method_gate) has tiered GateVerdict. citation_verify uses boolean citation_verified in adapter. prose has no gate logic. Need to wire GateVerdict into both to complete tiered gates across all validators.","timestamp":1780664466312,"segment":172,"confidence":null,"asi":{"hypothesis":"Wiring GateVerdict into citation_verify and prose validators completes tiered gates across all validators","method_gate":"Has gate_verdict (tiered) + gate_passed (boolean, backward compat)","citation_verify":"Boolean gate_changes in adapter (citation_verified: True/False)","missing":"GateVerdict in citation_verify adapter + prose validator"}}
{"run":333,"commit":"f0eb693","metric":3,"metrics":{},"status":"keep","description":"Wire GateVerdict into all validators via validate_validator_gate and citation_verified orchestrator flow. GateResult now has gate_verdict field. severity_to_tier maps 'error'→high_warn, 'warning'→low_warn. ALL validators going through validate_validator_gate now produce tiered verdicts. 1302 tests pass.","timestamp":1780665081083,"segment":172,"confidence":null,"asi":{"changes":["harness/services/gates.py: GateResult gained gate_verdict field (dict | None)","harness/services/gates.py: validate_validator_gate now computes tier_from_findings and attaches gate_verdict","harness/services/orchestrator.py: citation_verified gate builds tiered verdict from blocker/warning findings","validators/gate_verdict.py: severity_to_tier now maps 'error' → high_warn, 'warning' → low_warn"],"coverage":"ALL validators that go through validate_validator_gate now produce gate_verdict. This includes: audit_prose, audit_claims, audit_citations, audit_writing_quality, audit_code_health, check_refs, lint_bib, lint_style, audit_reporting, audit_ethics","hypothesis":"Wiring GateVerdict into all validators completes tiered gates across the entire pipeline","validators_with_tiered_gates":3}}
{"type":"config","name":"Wire citation verification 3-class verdict into gate decisions","metricName":"verdict_driven_gates","metricUnit":"verdicts","bestDirection":"higher"}
{"run":334,"commit":"dad435e","metric":0,"metrics":{},"status":"keep","description":"Baseline: reduce_citation_verdict produces 3 classes (verified/unresolvable/fabricated) but the citation_verified gate uses simple pass/warn from wrapper status. The 3-class verdict is not surfaced in gate decisions. Wiring it enables fabricated=gate fail, unresolvable=gate warn, verified=gate pass.","timestamp":1780665195685,"segment":173,"confidence":null,"asi":{"hypothesis":"Wiring the 3-class citation verdict (verified/unresolvable/fabricated) into gate decisions enables differentiated gate behavior","missing":"orchestrator citation_verified gate should consume reduce_citation_verdict output instead of simple pass/warn from wrapper status"}}
{"run":335,"commit":"2a0290d","metric":3,"metrics":{},"status":"keep","description":"Wire citation verification 3-class verdict into gate decisions. _extract_citation_verdict() extracts the verdict from citation_verification_summary finding and maps it: verified→tier=none (gate passes), unresolvable→tier=low_warn (gate warns), fabricated→tier=high_warn (gate refuses, annotation=[FABRICATED-REFERENCE]). Falls back to generic tier_from_findings if no summary present. 1302 tests pass.","timestamp":1780665475018,"segment":173,"confidence":null,"asi":{"behavior":"fabricated → high_warn + gate_refuse=True + [FABRICATED-REFERENCE]. unresolvable → low_warn + gate passes + [CITATION-NOT-FOUND]. verified → none + gate passes clean. No summary finding → falls back to generic tier_from_findings","changes":["harness/services/gates.py: Added _extract_citation_verdict() helper","_extract_citation_verdict: Scans findings for citation_verification_summary (checks both rule_id and code), extracts verdict from evidence, maps to GateVerdict with correct tier","validate_validator_gate: If citation summary found, overrides generic verdict with citation-specific verdict"],"hypothesis":"Wiring the 3-class citation verdict into gate decisions enables differentiated gate behavior","integration":"validate_validator_gate computes generic tier_from_findings first, then checks for citation_verification_summary finding. If found, overrides with citation-specific GateVerdict (verified→none, unresolvable→low_warn, fabricated→high_warn)"}}
{"type":"config","name":"Extract arXiv IDs from citation text for effective arXiv resolution","metricName":"arxiv_id_hits","metricUnit":"patterns","bestDirection":"higher"}
{"run":336,"commit":"4171bf5","metric":0,"metrics":{},"status":"keep","description":"Baseline: _query_arxiv passes DOIs to verify_arxiv_id but arXiv expects IDs like 2301.00001, not DOIs like 10.1234/... The 4th resolver is ineffective for DOI-based citations. Raw reference text may contain arXiv IDs (arXiv:2301.00001, https://arxiv.org/abs/...) but nothing extracts them. Need arXiv ID regex extraction before title search fallback.","timestamp":1780665591632,"segment":174,"confidence":null,"asi":{"bug":"_query_arxiv passes DOIs to verify_arxiv_id but arXiv IDs look like 2301.00001 not 10.1234/...","hypothesis":"Extracting arXiv IDs from citation raw text enables effective arXiv resolution","missing":"arXiv ID regex extraction from raw reference text, before falling back to title search"}}
