{"run":356,"commit":"d6b6f10","metric":4,"metrics":{},"status":"keep","description":"Add verify artifacts generator: 4 mandatory publication-readiness artifacts. search_manifest.yaml (query, databases, filters, PRISMA flow), evidence_matrix.csv (one row per study with scoring), included_excluded_ledger.yaml (Tier-based inclusion/exclusion), claim_citation_audit.yaml (every [@key] cross-referenced with bib). Wired into action runner verify handler. 12 tests. 1366 total pass.","timestamp":1780759768159,"segment":184,"confidence":null,"asi":{"hypothesis":"Verify artifacts generator produces 4 mandatory publication artifacts from pipeline data","implementation":"harness/services/verify_artifacts.py with 4 generators: search_manifest, evidence_matrix, included_excluded_ledger, claim_citation_audit","delta":"+4 artifacts (0 to 4)","tests":12,"next":"Symlink artifacts to outputs/latest/verify for easy access"}}
{"type":"config","name":"Fix Judgment Day remaining warnings","metricName":"jd_warnings_fixed","metricUnit":"warnings","bestDirection":"higher"}
{"run":357,"commit":"3750079","metric":1,"metrics":{},"status":"keep","description":"Baseline: 1/3 JD warnings fixed (B-7 count only). A-3 BibTeX nested braces truncated, B-6 venue generator recreated per call, B-7 no outputs/latest/verify symlink.","timestamp":1780881830840,"segment":185,"confidence":null,"asi":{"hypothesis":"3 JD warnings remain unfixed: A-3 (BibTeX nested braces), B-6 (venue generator per call), B-7 (no latest/verify symlink)","next":"fix all 3"}}
{"run":358,"commit":"46ddaee","metric":3,"metrics":{},"status":"keep","description":"Fix 3 JD remaining warnings. A-3: BibTeX nested braces — replaced regex with brace-counting parser. B-6: Venue lowercase — pre-computed ClassVar frozensets (_top_tier_lower, _good_venues_lower). B-7: Already worked via outputs/latest symlink (false alarm). 1368 tests pass, +1 new test.","timestamp":1780882140960,"segment":185,"confidence":null,"asi":{"delta":"1→3 warnings fixed","fixes":"A-3: brace-counting parser for BibTeX titles, B-6: pre-computed ClassVar frozenset for venue lookup, B-7: already worked via outputs/latest symlink architecture (false alarm)","tests":"+1 nested braces test, 1368 total","next":"session complete"}}
{"type":"config","name":"Consensus search provider integration","metricName":"search_sources_count","metricUnit":"sources","bestDirection":"higher"}
{"run":359,"commit":"5fa8a62","metric":3,"metrics":{},"status":"keep","description":"Baseline: 3 search sources (openalex, pubmed, arxiv). No Consensus integration. Architecture: PaperSearchProvider ABC with FixturePaperSearchProvider + McpPaperSearchProvider implementations. Consensus will be added as third provider calling their REST API directly.","timestamp":1780886058221,"segment":186,"confidence":null,"asi":{"hypothesis":"Baseline: 3 search sources (openalex, pubmed, arxiv), no Consensus","next":"implement ConsensusSearchProvider as HTTP REST client"}}
{"run":360,"commit":"23d70d9","metric":4,"metrics":{},"status":"keep","description":"Add Consensus search provider: 200M+ peer-reviewed papers via REST API. ConsensusSearchProvider calls api.consensus.app/v1/quick_search with urllib (stdlib-only). Supports study_type, takeaway, journal_name in extra_fields. Authenticated via CONSENSUS_API_KEY env var, unauthenticated fallback (3 results). Added to _DEFAULT_SOURCES. Factory updated: PAPER_SEARCH_PROVIDER=consensus. 13 tests. 1381 total pass.","timestamp":1780886485665,"segment":186,"confidence":null,"asi":{"delta":"3→4 sources (+33%)","implementation":"ConsensusSearchProvider: HTTP REST client to api.consensus.app/v1/quick_search. stdlib-only (urllib). Graceful degradation: no API key = unauthenticated (3 results). API key via CONSENSUS_API_KEY env var. Study type + takeaway in extra_fields.","tests":13,"total":1381,"architecture":"Third PaperSearchProvider implementation alongside FixturePaperSearchProvider + McpPaperSearchProvider. Factory updated: PAPER_SEARCH_PROVIDER=consensus creates ConsensusSearchProvider."}}
{"type":"config","name":"JD R2B pending warning resolution","metricName":"warnings_resolved","metricUnit":"warnings","bestDirection":"higher"}
{"run":361,"commit":"ddea5c2","metric":0,"metrics":{},"status":"keep","description":"Baseline: 0 of 5 JD R2B warnings resolved. W1=HTTPError e.read() safety, W2=HTTP error tests missing, W3=malformed JSON test missing, W4=VALID_STUDY_TYPES not used, W5=extra_fields or None inconsistency.","timestamp":1780914577189,"segment":187,"confidence":null,"asi":{"hypothesis":"Baseline: 0 of 5 JD warnings resolved","pending":"W1=HTTPError e.read() safety, W2=HTTP error tests, W3=malformed JSON test, W4=VALID_STUDY_TYPES usage, W5=extra_fields consistency"}}
{"run":362,"commit":"abb8e69","metric":5,"metrics":{},"status":"keep","description":"Resolve all 5 JD R2B pending warnings. W1: HTTPError e.read() wrapped in try/except for closed connections. W2: 3 new HTTP error tests (500, 429 rate limit, no-body edge case). W3: malformed JSON response test. W4: VALID_STUDY_TYPES already used in _normalize for validation with warning. W5: extra_fields alignment with ABC pattern. 1389 tests pass.","timestamp":1780914864636,"segment":187,"confidence":null,"asi":{"delta":"0→5 warnings resolved","fixes":"W1=HTTPError e.read() wrapped in try/except OSError+ConnectionError, W2=3 HTTP error tests (500, 429, no-body), W3=malformed JSON test, W4=VALID_STUDY_TYPES already used in _normalize validation, W5=extra_fields 'or None' → 'if extra_fields else None' for consistency","tests":"16→21 (+5), total 1389","hypothesis":"All 5 JD R2B warnings can be resolved with targeted surgical fixes"}}
{"type":"config","name":"Consensus pipeline integration gaps","metricName":"consensus_pipeline_gaps","metricUnit":"gaps","bestDirection":"higher"}
{"run":363,"commit":"59d3bc9","metric":0,"metrics":{},"status":"keep","description":"Baseline: 0 of 3 Consensus pipeline integration gaps resolved. Authority flow audit shows pipeline is correctly wired (CLI→Orchestrator→ActionRunner→Adapter→ConsensusSearchProvider). Gaps: G1=no Consensus fixture, G2=test_paper_search_provider.py doesn't test consensus factory, G3=no smoke test.","timestamp":1780915402673,"segment":188,"confidence":null,"asi":{"authority_flow_result":"CLI→Orchestrator→ActionRunner→Adapter→ConsensusSearchProvider chain is wired correctly. 3 gaps found: no fixture, no factory test in provider suite, no smoke test.","gaps":"G1=no Consensus fixture (only MCP), G2=test_paper_search_provider.py does not test consensus factory mode, G3=no smoke test equivalent to test_mcp_search_smoke.py","hypothesis":"Pipeline is connected but undertested at integration level"}}
{"run":364,"commit":"ba1adbf","metric":3,"metrics":{},"status":"keep","description":"Resolve all 3 Consensus pipeline integration gaps. G1: Consensus fixture with 3 realistic papers (RAG survey, real-time RAG, retrieval-augmented text gen). G2: test_consensus_mode added to TestProviderSelection verifying factory creates ConsensusSearchProvider. G3: smoke test with 3 real API tests (unauthenticated search, factory path, normalization). 1390 tests pass, 14 skipped.","timestamp":1780915601348,"segment":188,"confidence":null,"asi":{"authority_flow":"CLI→Orchestrator→ActionRunner→Adapter→ConsensusSearchProvider verified connected","delta":"0→3 gaps resolved","fixes":"G1=created tests/fixtures/consensus/quick_search_response.v1.json (3 realistic papers), G2=added test_consensus_mode to TestProviderSelection, G3=created tests/smoke/test_consensus_search_smoke.py (3 tests: unauthenticated search, factory path, normalization)","tests":"1390 pass, 14 skipped (3 consensus smoke skipped correctly)","hypothesis":"Pipeline gaps can be resolved with fixture + test additions without code changes"}}
{"type":"config","name":"Consensus OpenAPI spec alignment","metricName":"openapi_compliance","metricUnit":"gaps resolved","bestDirection":"higher"}
{"run":365,"commit":"7d94ef0","metric":0,"metrics":{},"status":"keep","description":"Baseline: 0 of 3 OpenAPI compliance gaps resolved. G1=CRITICAL: limit sent to API but spec has no limit param (API ignores it, plan tier controls results). G2=pages+volume required fields not parsed. G3=0/6 filter params (year_min/max, study_types, human, sample_size_min, sjr_max). Auth and field names confirmed correct per official spec.","timestamp":1780916079406,"segment":189,"confidence":null,"asi":{"G1":"CRITICAL: limit param sent to API but OpenAPI spec has NO limit parameter. API ignores it. Results determined by plan tier only.","G2":"pages and volume are REQUIRED response fields but we don't parse them","G3":"0 of 6 filter params supported (year_min, year_max, study_types, human, sample_size_min, sjr_max)","openapi_source":"Official Consensus OpenAPI 3.1.0 spec from docs.consensus.app","auth_confirmed":"x-api-key header correct per spec","field_names_confirmed":"All our field names match: title, abstract, authors, doi, journal_name, publish_year, url, citation_count, study_type, takeaway"}}
{"run":366,"commit":"36072ed","metric":3,"metrics":{},"status":"keep","description":"Align ConsensusSearchProvider with official OpenAPI 3.1.0 spec. G1: removed limit from API params (spec has no limit — plan tier controls results). G2: pages+volume now parsed to extra_fields. G3: 8 filter params added (year_min/max, study_types, human, sample_size_min, sjr_max, exclude_preprints, medical_mode). 1390 tests pass.","timestamp":1780916229872,"segment":189,"confidence":null,"asi":{"G1":"FIXED: removed limit from API call params. OpenAPI spec has no limit param — result count is plan-tier controlled (3/10/20). limit only applied client-side via slicing.","G2":"FIXED: pages and volume (required per OpenAPI QueryResult schema) now extracted to extra_fields","G3":"FIXED: 6 filter params added to _call_api: year_min, year_max, study_types, human, sample_size_min, sjr_max. Plus exclude_preprints and medical_mode. Via **kwargs in _call_api.","openapi_source":"Official Consensus OpenAPI 3.1.0 spec","tests":"1390 pass, 14 skipped","field_validation":"All field names match spec: title, abstract, authors, doi, journal_name, publish_year, url, citation_count, study_type, takeaway, pages, volume"}}
{"run":367,"commit":"217bb43","metric":0,"metrics":{},"status":"keep","description":"Baseline: 0 of 5 remaining OpenAPI compliance gaps resolved. G4=4 missing filter params (duration_min, duration_max, publisher_name, clinical_guideline). G5=sjr_max lacks range validation (spec requires minimum=1, maximum=4). Currently 8/12 filter params implemented.","timestamp":1780916682777,"segment":189,"confidence":null,"asi":{"hypothesis":"4 missing filter params + 1 missing validation = 5 remaining OpenAPI compliance gaps","spec_source":"https://docs.consensus.app/reference/v1_quick_search","missing_filters":["duration_min","duration_max","publisher_name","clinical_guideline"],"missing_validation":"sjr_max range 1-4"}}
{"run":368,"commit":"a9d1ca5","metric":5,"metrics":{},"status":"keep","description":"Add 4 missing OpenAPI filter params (duration_min, duration_max, publisher_name, clinical_guideline) + sjr_max range validation (1-4). Fixed falsy-value bug: changed `if filters.get(\"sjr_max\")` to `is not None` to correctly validate sjr_max=0. 7 new tests. All 12/12 OpenAPI filter params now implemented. 1414 tests pass, 1 pre-existing failure.","timestamp":1780917056961,"segment":189,"confidence":null,"asi":{"delta":"0→5 gaps resolved","fixes":"G4=4 missing filter params (duration_min, duration_max, publisher_name, clinical_guideline), G5=sjr_max range validation (1-4) with is-not-None check","hypothesis":"Adding 4 missing filter params + sjr_max range validation completes full OpenAPI spec compliance","spec_total_params":12,"tests_added":7,"tests_total":1414}}
{"run":369,"commit":"61b9df8","metric":0,"metrics":{},"status":"keep","description":"Baseline: 0 of 12 filter params accessible through public search() method. All 12 filters exist in _call_api() but search() calls it as _call_api(query, limit) without forwarding any filters. Pipeline cannot use year_min/max, study_types, or any other filter. Filters are dead code from the consumer's perspective.","timestamp":1780917231774,"segment":189,"confidence":null,"asi":{"delta":"0 gaps — dead code identified","hypothesis":"12 filter params exist in _call_api but search() doesn't expose them — pipeline can't use filters","gap":"search(query, limit) calls _call_api(query, limit) with zero filters"}}
{"run":370,"commit":"3a03940","metric":12,"metrics":{},"status":"keep","description":"Wire 12 OpenAPI filter params through public search() method via **kwargs. Previously dead code: _call_api had 12 filters but search() called it without any. Now search(query, limit, year_min=2020, study_types=['rct'], ...) forwards all filters to the API. 1 new test. 1415 pass.","timestamp":1780917347713,"segment":189,"confidence":6,"asi":{"delta":"0→12 filter params accessible through search()","fix":"Added **filters: Any to search() signature, forwarded to _call_api(**filters). Filters are no longer dead code.","hypothesis":"Exposing filters through public search() enables pipeline consumers to use year_min/max, study_types, etc.","test":"test_search_passes_filters_to_api verifies year_min=2020, year_max=2025, exclude_preprints=True reach the API URL"}}
{"run":371,"commit":"727ba18","metric":0,"metrics":{},"status":"keep","description":"Baseline: adapter extracts 5 inputs (query, output_dir, raw_papers, weights_phase, limit) but 0 filter params. Provider call is provider.search(query=..., limit=...) with no **filters. Year_min/max, study_types etc. are unreachable from the adapter layer.","timestamp":1780917397489,"segment":189,"confidence":6,"asi":{"adapter_inputs":"query, output_dir, raw_papers, weights_phase, limit","gap":"provider.search(query=..., limit=...) — no filter kwargs extracted from inputs","hypothesis":"Adapter doesn't extract or forward any filter params from inputs to provider.search()"}}
{"run":372,"commit":"175ba8d","metric":12,"metrics":{},"status":"keep","description":"Wire filter params through LiteratureSearchAdapter to provider. _handle_search now extracts 12 filter keys (year_min/max, study_types, etc.) from inputs dict and forwards as **kwargs to provider.search(). End-to-end pipeline: inputs → adapter → provider.search(**filters) → _call_api(**filters) → API URL. 1 new test with SpyProvider. 1416 pass.","timestamp":1780917650384,"segment":189,"confidence":3.4285714285714284,"asi":{"delta":"0→12 filter params forwarded through adapter","fix":"Added _FILTER_KEYS extraction in _handle_search, passes as **filters to provider.search()","test":"SpyProvider captures kwargs — verifies year_min, year_max, study_types, exclude_preprints reach provider; limit/weights_phase do NOT","pipeline":"inputs → adapter._handle_search → provider.search(**filters) → _call_api(**filters) → API URL params"}}
{"run":373,"commit":"0934347","metric":0,"metrics":{},"status":"keep","description":"Baseline: CLI search command exposes 0/12 filter params. Only --query and --raw-papers available. Pipeline now supports filters end-to-end (adapter → provider → API) but users can't pass them from the command line. Missing: --year-min, --year-max, --study-types, --human, --sample-size-min, --sjr-max, --duration-min, --duration-max, --exclude-preprints, --publisher-name, --clinical-guideline, --medical-mode.","timestamp":1780917724932,"segment":189,"confidence":3.4285714285714284,"asi":{"gap":"CLI search parser only has --query and --raw-papers, no filter args","hypothesis":"Adding filter args to CLI search command completes end-to-end filter accessibility","pipeline_layers":"CLI → args → orch_args → adapter inputs → provider.search(**filters) → API URL"}}
{"run":374,"commit":"394bbf1","metric":12,"metrics":{},"status":"keep","description":"Add 12 Consensus filter params to CLI search command. --year-min/max, --study-types, --human, --sample-size-min, --sjr-max, --duration-min/max, --exclude-preprints, --publisher-name, --clinical-guideline, --medical-mode. All forwarded via orch_args to adapter inputs. Complete end-to-end pipeline: CLI args → orch_args → adapter → provider.search(**filters) → API. 1416 tests pass.","timestamp":1780917857683,"segment":189,"confidence":null,"asi":{"cli_filter_args":12,"delta":"0→12 filter params exposed in CLI","help_output":"All 12 filter params visible in 'paper search --help'","pipeline_complete":"CLI args → orch_args → adapter inputs → provider.search(**filters) → _call_api(**filters) → API URL params"}}
{"run":375,"commit":"9d99dbe","metric":1,"metrics":{},"status":"keep","description":"Fix CRITICAL bug: adapter filter passthrough crashed non-Consensus providers. FixturePaperSearchProvider and McpPaperSearchProvider.search() didn't accept **kwargs — TypeError when adapter forwarded year_min etc. Added **kwargs: Any to ABC and all 3 implementations. Filters now silently ignored by providers that don't support them. 1416 pass.","timestamp":1780918157934,"segment":189,"confidence":3.4285714285714284,"asi":{"bug":"Adapter forwards **filters to provider.search() but only ConsensusSearchProvider accepted **kwargs. FixturePaperSearchProvider and McpPaperSearchProvider would crash with TypeError on unexpected keyword arguments","fix":"Added **kwargs: Any to PaperSearchProvider ABC, FixturePaperSearchProvider, and McpPaperSearchProvider.search() signatures. Filters are silently ignored by non-Consensus providers.","hypothesis":"Filter kwargs must be safely ignored by providers that don't support them","reproduction":"PAPER_SEARCH_PROVIDER=fixture with --year-min 2020 → TypeError before fix"}}
{"run":376,"commit":"56ca468","metric":0,"metrics":{},"status":"keep","description":"Baseline: 0 of 4 bug-hunt findings resolved. BH-1=HIGH (filters silently ignored by fixture), BH-2=MEDIUM (no CLI range validation), BH-3=MEDIUM (empty query accepted), BH-4=LOW (raw-papers file error). Bug hunt with Ripper+Walker+Sniper agents found 4 real bugs via actual CLI commands.","timestamp":1780919119975,"segment":189,"confidence":3.4285714285714284,"asi":{"BH-1":"HIGH — 12 filter params silently ignored by non-Consensus providers, zero warnings","BH-2":"MEDIUM — no CLI-level range validation for sjr_max, year_min>max, duration_min>max","BH-3":"MEDIUM — empty query '' accepted without error","BH-4":"LOW — non-existent raw-papers file gives confusing error","confirmed_by":"Ripper + Sniper independently found BH-1","hypothesis":"Bug hunt reveals 4 real bugs in Consensus CLI integration"}}
{"run":377,"commit":"501ab50","metric":4,"metrics":{},"status":"keep","description":"Fix all 4 bug-hunt findings. BH-1: warn when filters ignored by non-Consensus provider. BH-2: range validation for year_min/max, duration_min/max, sjr_max (1-4). BH-3: reject empty/whitespace queries. BH-4: detect non-existent raw_papers file before parse. 7 new tests. 1424 pass, 0 fail.","timestamp":1780919402618,"segment":189,"confidence":3,"asi":{"BH-1":"FIXED — logger.warning when filters passed to non-Consensus provider","BH-2":"FIXED — range validation (year_min>max, duration_min>max, sjr_max 1-4) in adapter","BH-3":"FIXED — empty/whitespace query rejected with clear error","BH-4":"FIXED — non-existent .json raw_papers file detected before parse attempt","tests_added":7,"tests_total":1424}}
{"run":378,"commit":"82dce23","metric":0,"metrics":{},"status":"keep","description":"Baseline: 0 of 4 fixable R2 bugs resolved. R2-BH1=CRITICAL (chain URL encoding), R2-BH2=HIGH (InvalidTier), R2-BH3=HIGH (chain param bounds), R2-BH5=MEDIUM (CSL file check). Found by Ripper+Walker+Sniper bug hunt on chain/screen/draft/audit/render commands.","timestamp":1780967956712,"segment":189,"confidence":3,"asi":{"R2-BH1":"CRITICAL — paper titles with spaces crash S2 API (InvalidURL), no urllib.parse.quote","R2-BH2":"HIGH — InvalidTier accepted by screen without error","R2-BH3":"HIGH — no bounds validation for chain params (max_rounds<=0, max_papers<=0, threshold<=0)","R2-BH4":"HIGH — no state rollback on failure (deferred — architectural)","R2-BH5":"MEDIUM — --csl and --reference-doc silently ignore nonexistent files","hypothesis":"Bug hunt round 2 found 5 fixable bugs in chain/screen/render pipeline commands"}}
{"run":379,"commit":"0f2471b","metric":3,"metrics":{},"status":"keep","description":"Fix 3 R2 bug-hunt findings. R2-BH1 CRITICAL: _encode_paper_id() URL-encodes paper title fallbacks for S2 API (prevents InvalidURL crash on spaces). R2-BH2 HIGH: screen() validates tier names against known values. R2-BH3 HIGH: CLI validates chain param bounds (max_rounds≥1, max_papers≥1, 0<threshold≤1). 5 new tests. 1429 pass.","timestamp":1780969057909,"segment":189,"confidence":4.8,"asi":{"R2-BH1":"FIXED — _encode_paper_id() URL-encodes title fallbacks only (S2/DOI/ArXiv IDs unchanged)","R2-BH2":"FIXED — screen() raises ValueError for invalid tier names","R2-BH3":"FIXED — CLI validates max_rounds≥1, max_papers≥1, 0<threshold≤1","R2-BH4":"DEFERRED — state rollback is architectural, requires deeper changes","R2-BH5":"DEFERRED — CSL/reference-doc validation moved to adapter level (needs more work)","key_insight":"_encode_paper_id avoids breaking cache URLs for DOI: and ArXiv: IDs — only encodes bare titles","tests_added":5,"tests_total":1429}}
