{"run":226,"commit":"f96b4f8","metric":31,"metrics":{},"status":"keep","description":"Baseline lint: 31 errors. 9 F821 undefined-name (argparse missing from extracted CLI modules — real bug), 9 F811 redefined-while-unused (json), 6 F401 unused-import, 3 E402, 3 E501. CLI extraction introduced real import bugs.","timestamp":1780502714524,"segment":123,"confidence":null,"asi":{"breakdown":"31 errors: 9 F821 (undefined argparse — real bug from CLI extraction), 9 F811 (redefined-while-unused — json re-imported in handlers), 6 F401 (unused imports), 3 E402 (imports not at top), 3 E501 (line too long), 1 I001 (unsorted imports)","F821_root_cause":"CLI modularization extracted handlers that use argparse.Namespace type hints but didn't add 'import argparse' to the new files. The original main.py had it at module level.","hypothesis":"CLI extraction left undefined-name bugs in extracted command modules. Fixing imports will resolve 9 F821 + 9 F811 + 6 F401 = 24 of 31 errors."}}
{"run":227,"commit":"00a2238","metric":0,"metrics":{},"status":"keep","description":"Fixed all 31 lint errors. CLI extraction bugs: added missing argparse imports, removed 9 local json re-imports, removed unused imports. Format fixes: E501 long lines, E402 import placement. All ruff checks pass. 701 tests, 0 failures.","timestamp":1780503098495,"segment":123,"confidence":null,"asi":{"changes":"cli/paper/commands/audit.py: added argparse import, removed 6 local json re-imports. cli/paper/commands/gate.py: added argparse import, removed local json re-import. cli/paper/commands/graph.py: added argparse import, removed unused Path import, removed 2 local json re-imports. cli/paper/main.py: removed unused time import, moved command imports to top-level, fixed 2 E501 long lines. validators/writing_quality.py: shortened long comment line.","hypothesis":"CLI extraction left import bugs and lint errors. Fixing imports resolves F821+F811+F401, formatting resolves E402+E501+I001.","result":"31->0 lint errors. All ruff checks pass. 701 tests pass, 0 failures."}}
{"type":"config","name":"Fix mypy type errors in core modules","metricName":"type_errors","metricUnit":"errors","bestDirection":"lower"}
{"run":228,"commit":"8a6b1c3","metric":10,"metrics":{},"status":"keep","description":"Baseline mypy: 10 errors in 2 files. clients/crossref.py (7: dict type-args, Any returns), clients/semantic_scholar.py (3: dict type-args, Any return). All type annotation issues, no logic bugs.","timestamp":1780503169140,"segment":124,"confidence":null,"asi":{"breakdown":"10 errors in 2 files: clients/crossref.py (7 errors: 5 type-arg, 2 no-any-return) and clients/semantic_scholar.py (3 errors: 2 type-arg, 1 no-any-return). All are dict missing type args or Any return types.","hypothesis":"API clients have loose typing — adding proper type annotations will close all 10 mypy errors"}}
{"run":229,"commit":"bc7d0a5","metric":0,"metrics":{},"status":"keep","description":"Fixed all 10 mypy errors. Added type annotations to API clients: dict[str, Any] params, int cast for date parts, type: ignore for json.loads Any returns. 0 mypy errors across 58 source files. 701 tests pass.","timestamp":1780503476374,"segment":124,"confidence":null,"asi":{"changes":"clients/crossref.py: added typing.Any import, typed dict params as dict[str, Any], cast date_parts[0][0] to int, type: ignore on json.loads return. clients/semantic_scholar.py: added typing.Any import, typed dict params as dict[str, Any], type: ignore on json.loads return.","hypothesis":"API clients have loose dict typing — adding type annotations closes all mypy errors","result":"10->0 mypy errors. Success: no issues found in 58 source files. 701 tests pass."}}
{"type":"config","name":"Detect and fix import cycles in core modules","metricName":"import_cycles","metricUnit":"cycles","bestDirection":"lower"}
{"run":230,"commit":"ae98ed4","metric":0,"metrics":{},"status":"keep","description":"Import cycle analysis: 0 cycles found. AST-based Tarjan SCC on 6 packages (harness, validators, engine, parsers, clients, cli). Dependency graph is a clean DAG. No circular imports.","timestamp":1780503583453,"segment":125,"confidence":null,"asi":{"hypothesis":"Core modules may have import cycles causing subtle runtime failures","method":"Tarjan's SCC algorithm on AST-extracted import graph across harness/validators/engine/parsers/clients/cli packages","result":"0 import cycles. Dependency graph is a clean DAG. No circular imports detected across any core modules."}}
{"type":"config","name":"Verify all internal imports resolve — detect broken module references","metricName":"import_failures","metricUnit":"failures","bestDirection":"lower"}
{"run":231,"commit":"b17e884","metric":0,"metrics":{},"status":"keep","description":"Import verification: 0 failures. Every module in 6 core packages (harness, validators, engine, parsers, clients, cli) imports cleanly via importlib. No broken references from refactoring.","timestamp":1780503639643,"segment":126,"confidence":null,"asi":{"hypothesis":"CLI modularization or recent refactors may have broken internal imports","method":"importlib.import_module() on every .py file in core packages (harness, validators, engine, parsers, clients, cli)","result":"0 failures. Every module imports cleanly. No broken references from refactoring."}}
{"type":"config","name":"Find dead exports — public functions never imported outside their own module","metricName":"dead_exports","metricUnit":"functions","bestDirection":"lower"}
{"run":232,"commit":"0b7d2b2","metric":130,"metrics":{},"status":"keep","description":"Dead export analysis: 130 flagged (mostly false positives from tests/data types). After filtering: ~30 source-level exports with no external cross-module import. Most are public API surface used via CLI dispatch or dynamic loading. 2 genuinely unused: ClaimAlignmentValidator, validate_preset.","timestamp":1780503735254,"segment":127,"confidence":null,"asi":{"analysis":"130 'dead exports' found but most are false positives: (1) test classes/functions counted (tests.* modules), (2) data types used indirectly (Section, Sentence, Check, etc.), (3) internal helper functions called by re-exported wrappers (normalize_title called by title_similarity). After filtering tests, ~30 source-level dead exports remain, most of which are public API surface used via dynamic dispatch or CLI entry points.","genuinely_potentially_dead":"validators.claim_alignment::ClaimAlignmentValidator (no CLI command or test imports it), validators.preset::validate_preset","hypothesis":"Cross-module dead export analysis may reveal unused functions that can be removed or made private"}}
{"type":"config","name":"Add missing docstrings to public functions in core modules","metricName":"missing_docstrings","metricUnit":"count","bestDirection":"lower"}
{"run":233,"commit":"4f763f6","metric":6,"metrics":{},"status":"keep","description":"Baseline docstrings: 63 missing (57 tests, 6 source). Source gaps: format_json, build_orchestrator_dependencies, Sentence/Section/Manuscript classes, SourcePosition class.","timestamp":1780503801278,"segment":128,"confidence":null,"asi":{"breakdown":"63 total: 57 in test files (low priority), 6 in source code. Source gaps: engine.formatter::format_json, harness.services.orchestrator_builder::build_orchestrator_dependencies, parsers.manuscript::Sentence, parsers.manuscript::Section, parsers.manuscript::Manuscript, parsers.source_map::SourcePosition","hypothesis":"Some core public functions/classes are missing docstrings, hurting API discoverability"}}
{"run":234,"commit":"260d73f","metric":0,"metrics":{},"status":"keep","description":"All 6 missing source docstrings added. format_json, Sentence, Section, Manuscript, SourcePosition, build_orchestrator_dependencies now documented. 0 missing in core modules. 701 tests pass.","timestamp":1780503944172,"segment":128,"confidence":null,"asi":{"added":"6 docstrings: engine.formatter.format_json, parsers.manuscript.{Sentence,Section,Manuscript}, parsers.source_map.SourcePosition, harness.services.orchestrator_builder.build_orchestrator_dependencies","hypothesis":"Adding docstrings to all public source functions improves API discoverability","result":"6->0 missing docstrings in source modules. 701 tests pass."}}
{"type":"config","name":"Measure E2E CLI coverage — how many paper commands actually produce correct output","metricName":"e2e_commands_working","metricUnit":"commands","bestDirection":"higher"}
{"run":235,"commit":"9116e1c","metric":2,"metrics":{},"status":"keep","description":"Baseline E2E: 2/12 measured but measurement script had bugs. Arg order wrong (--project goes before subcommand). Audit commands exit 1 = correct fail-closed behavior with P0 findings. Real state: need remeasurement with correct arg order and exit code semantics.","timestamp":1780504096608,"segment":129,"confidence":null,"asi":{"audit_commands":"All 6 audit commands produce valid JSON output but exit 1 (P0 findings present). This is CORRECT fail-closed behavior, not a bug.","e2e_reality":"Script had measurement errors: (1) --project goes BEFORE subcommand, not after. (2) exit 1 from audit commands = correct fail-closed behavior when P0 findings exist, not a failure.","hypothesis":"E2E CLI coverage reveals broken commands","init_commands":"init/search/screen/draft require --project before subcommand, not after. Script had wrong arg order."}}
{"run":236,"commit":"70bbe52","metric":12,"metrics":{},"status":"keep","description":"E2E CLI validation: 12/12 commands working. Pipeline (init→search→screen→draft) creates state and artifacts. Audit commands (prose, claims, citations, ethics, writing-quality) produce structured JSON findings. Gate method fails closed correctly. Code-health uses Trifecta mock.","timestamp":1780504159299,"segment":129,"confidence":null,"asi":{"commands":"init (state created), search (plan generated), screen (evidence filtered), draft outline (outline created), audit prose (2 findings), audit claims (4 candidates), audit citations (4 skipped findings), audit ethics (clean), audit writing-quality (clean), gate method (5 items, fail-closed exit 1), audit code-health (mock Trifecta), --version","hypothesis":"Full E2E pipeline may have broken commands after refactoring","result":"12/12 commands working. All produce valid structured output. Pipeline commands create state/artifacts. Audit commands produce JSON findings. Gate method correctly fails closed on missing items."}}
{"type":"config","name":"BACKLOG-004: Classify documents as source-of-truth, design-intent, or historical","metricName":"ungoverned_docs","metricUnit":"docs","bestDirection":"lower"}
{"run":237,"commit":"ed1d110","metric":0,"metrics":{},"status":"keep","description":"BACKLOG-004 resolved: 33→0 ungoverned docs. Created docs/DOCUMENT_GOVERNANCE.md central registry classifying all 44 docs: 22 source-of-truth, 10 design-intent, 12 historical. Single registry replaces per-file headers.","timestamp":1780504387598,"segment":130,"confidence":null,"asi":{"approach":"Created docs/DOCUMENT_GOVERNANCE.md central registry classifying all 44 docs into source-of-truth (22), design-intent (10), historical (12). No per-file headers needed — single registry is the governance contract.","categories":"source-of-truth: must update with code changes (HARNESS_AND_STATE_MACHINE, ORCHESTRATOR_SPEC, etc). design-intent: aspirational/plans (MULTI_PROJECT_SPEC, plans/*, integration roadmaps). historical: frozen snapshots (CODE_ISSUES_LOG, benchmark results, research baselines).","hypothesis":"Most docs lack governance classification — creating a central registry establishes clear ownership"}}
{"type":"config","name":"Find pipeline coverage gaps — commands never exercised in test sequence","metricName":"pipeline_gaps","metricUnit":"gaps","bestDirection":"lower"}
{"run":238,"commit":"65c9b98","metric":3,"metrics":{},"status":"keep","description":"Pipeline coverage: 29 gaps measured (many sub-subcommand noise). Genuine gaps: 3 orchestrator commands never tested — audit_reporting, draft_section, import_bib. These go through _run_gate_verification but have no test_orchestrator coverage.","timestamp":1780504535602,"segment":131,"confidence":null,"asi":{"e2e_noise":"Many 'NO E2E TEST' gaps are sub-subcommands (bib, citations, etc.) not top-level commands. The measurement mixes levels. After filtering: audit, init, search, screen, draft, lint, check, render, verify ARE tested (test_orchestrator covers the orchestrator path, test_cli covers subprocess).","genuine_orchestrator_gaps":"3 commands in _run_gate_verification with NO orchestrator unit test: audit_reporting, draft_section, import_bib. These go through the orchestrator but never appear in test_orchestrator.py.","hypothesis":"Pipeline coverage analysis reveals untested orchestrator command paths"}}
{"run":239,"commit":"928092e","metric":0,"metrics":{},"status":"keep","description":"Closed last orchestrator test gap: added import_bib unit test + mock wrapper. All 12 orchestrator commands now tested (12/12). 702 passed, 7 skipped. Added import_bib to create_mock_wrappers().","timestamp":1780504856380,"segment":131,"confidence":null,"asi":{"added_test":"test_orchestrator_import_bib_normalizes_bibliography: verifies import_bib command triggers wrapper + bib_normalized gate","fix":"Added import_bib mock wrapper to create_mock_wrappers() — was missing, causing fail-closed 'No tool wrapper registered' error","gaps_before":"3 commands appeared untested: audit_reporting, draft_section, import_bib. But audit_reporting and draft_section were already in test_orchestrator_sequential_flow (regex missed keyword args). Only import_bib was genuinely untested.","hypothesis":"Pipeline coverage analysis reveals untested orchestrator command paths","result":"12/12 orchestrator commands now tested. 702 tests pass. import_bib mock wrapper added."}}
{"type":"config","name":"Measure real line coverage — find modules below 80% threshold","metricName":"line_coverage_gaps","metricUnit":"modules","bestDirection":"lower"}
{"run":240,"commit":"6c85ade","metric":7,"metrics":{},"status":"keep","description":"Baseline line coverage: 7 source modules below 80%. CLI commands (graph 6%, audit 8%, gate 25%) are subprocess-tested but not unit-tested. Real gaps: claim_alignment 66%, trifecta client 73%, citation_verify 73%, local_tool_resolver 74%. Overall 84%.","timestamp":1780505042824,"segment":132,"confidence":null,"asi":{"below_80":["cli/paper/commands/graph.py (6%)","cli/paper/commands/audit.py (8%)","cli/paper/commands/gate.py (25%)","validators/claim_alignment.py (66%)","clients/trifecta.py (73%)","validators/citation_verify.py (73%)","harness/adapters/local_tool_resolver.py (74%)"],"hypothesis":"Real line coverage reveals modules with insufficient test coverage despite 100% API coverage","note":"CLI commands have low coverage because tests use test_cli/ (subprocess) not direct function calls. Port protocols excluded (abstract by design).","overall":"84% total line coverage across 6 packages"}}
{"run":241,"commit":"ab8cd85","metric":6,"metrics":{},"status":"keep","description":"Added 11 targeted tests for claim_alignment validator: extraction patterns (author-year, et-al, bracket, none), classification (P0/P1/P2/None), finding constructors, supported claim flow. Coverage 66%→91%. 713 tests pass.","timestamp":1780505227729,"segment":132,"confidence":null,"asi":{"claim_alignment":"66% → 91% (+25%). Added 11 targeted tests: _extract_citation_from_claim (author-year, et-al, bracket, none), _classify_alignment (P0/P1/P2/None), _make_unsupported_finding, _make_alignment_finding, supported claim produces no finding. Remaining 4 lines are the real verify_single() integration path.","hypothesis":"Real line coverage reveals modules with insufficient test coverage despite 100% API coverage","remaining":"6 modules still below 80%: 3 CLI commands (subprocess-tested), trifecta client 73%, citation_verify 73%, local_tool_resolver 74%"}}
{"run":242,"commit":"c075ab8","metric":5,"metrics":{},"status":"keep","description":"Added 10 tests for local_tool_resolver error paths and version parsing. Coverage 74%→95%+. 723 tests pass. Remaining 5 gaps: 3 CLI commands (subprocess-tested), trifecta client 73%, citation_verify 73%.","timestamp":1780505470540,"segment":132,"confidence":2,"asi":{"hypothesis":"Real line coverage reveals modules with insufficient test coverage despite 100% API coverage","local_tool_resolver":"74% → 95%+. Added 10 tests: error paths (non-zero exit, timeout, OS error, unexpected exception), _parse_version (2-part, full semver, prefixed, no match), _verify_min_version (None res, no min).","remaining":"5 modules below 80%: 3 CLI commands (subprocess-tested, not unit-tested), clients/trifecta.py 73% (integration error paths), validators/citation_verify.py 73% (offline verification paths)","tests":"723 passed, 0 failed. +10 new tests."}}
{"run":243,"commit":"26c2b7a","metric":4,"metrics":{},"status":"keep","description":"Added 8 tests for citation_verify: verify_single verdicts (title_mismatch, partial, not_found, verified), multiline ref parsing, no-refs edge case, query client offline/exception/title-search paths. Coverage 73%→85%+. 735 tests pass.","timestamp":1780505667553,"segment":132,"confidence":3,"asi":{"citation_verify":"73% → 85%+. Added 8 tests: verify_single (title_mismatch P1, partial P2, not_found P0, verified returns None), multiline reference parsing, no references section, _query_crossref/s2 offline, exception handling, title search fallback.","hypothesis":"Real line coverage reveals modules with insufficient test coverage despite 100% API coverage","remaining":"4 modules: 3 CLI commands (subprocess-tested, not unit-tested — by design), clients/trifecta.py 73% (real API integration error paths).","tests":"735 passed, 0 failed. +12 new tests."}}
{"run":244,"commit":"b6b52cd","metric":3,"metrics":{},"status":"keep","description":"Added 12 tests for Trifecta client response normalization: orphans extraction, callers/callees nodes fallback, path success/failure, hubs non-dict, health failure, _run OSError. Coverage 73%→85%+. 747 tests pass. Remaining 3 gaps are CLI handlers tested via subprocess.","timestamp":1780505862133,"segment":132,"confidence":4,"asi":{"clients/trifecta":"73% → 85%+. Added 12 tests: response normalization (orphans key extraction, non-dict normalization, callers nodes fallback, callees extraction, path success/failure, hubs non-dict, health failure, _run OSError).","hypothesis":"Real line coverage reveals modules with insufficient test coverage despite 100% API coverage","remaining":"3 modules below 80%: ALL are CLI command handlers (graph 6%, audit 8%, gate 25%). These are already tested via subprocess E2E tests. Unit testing them would duplicate coverage.","tests":"747 passed, 0 failed. +12 new tests."}}
{"run":245,"commit":"1d2b02c","metric":2,"metrics":{},"status":"keep","description":"Added 23 CLI handler unit tests: gate (4), audit (9), graph (10). Gate 25%→80%+, audit 8%→77%, graph 6%→57%. 770 tests pass. Only 2 modules remain below 80% (text output paths).","timestamp":1780506138281,"segment":132,"confidence":3.3333333333333335,"asi":{"audit_handler":"8% → 77%. Added 9 tests: prose JSON output, claims output, citations JSON + P0 exit, ethics output, writing quality output, code health JSON + findings exit.","gate_handler":"25% → 80%+. Added 4 tests: file not found, gate passed, gate failed exit 1, JSON metadata.","graph_handler":"6% → 57%. Added 10 tests: callers JSON + failure, callees JSON, path JSON + missing --to + no path found, overview JSON + failure + not enabled.","hypothesis":"Real line coverage reveals modules with insufficient test coverage despite 100% API coverage","remaining":"2 modules: graph.py 57% (text output paths), audit.py 77% (remaining handler branches). Both are CLI formatting, not core logic.","tests":"770 passed, 0 failed. +23 new tests."}}
{"type":"config","name":"BACKLOG-003: Fix generic artifact paths that collide on re-run","metricName":"generic_artifact_paths","metricUnit":"paths","bestDirection":"lower"}
{"run":246,"commit":"5c28efa","metric":7,"metrics":{},"status":"keep","description":"Baseline BACKLOG-003: 20 generic artifact paths. Zero unique paths. Per-run outputs (search/*.json, render/manuscript.pdf, drafts/{name}.md) use hardcoded names that collide on re-run. state.yaml and manifest.yaml are singleton by design.","timestamp":1780506719604,"segment":133,"confidence":null,"asi":{"dirs_vs_files":"Directories (outputs/search, outputs/drafts, outputs/logs, outputs/render) are generic but CREATE-only — mkdir -p doesn't collide. The real problem is the FILES inside: search_plan.json, raw_results.json, screened_evidence.json, outline.md, {section}.md, manuscript.docx, manuscript.pdf. Templates (manuscript.qmd, references.bib) are singleton by design.","genuine_collision_paths":"search_plan.json, raw_results.json, screened_evidence.json, outline.md, {section_name}.md, manuscript.docx, manuscript.pdf — 7 files that overwrite on re-run","hypothesis":"Most artifact paths use generic names that collide if commands are re-run. Adding timestamps or run IDs would prevent collisions.","note":"state.yaml and manifest.yaml are singleton by design — current state, not per-run. templates/ are also singleton."}}
