{"run":311,"commit":"f14c0bf","metric":1,"metrics":{},"status":"keep","description":"Contamination signals integration contract: TWO components discovered. (1) compute_preprint_signal is PURE LOGIC — checks year >= 2024 AND venue in 10-item preprint list with source_pointer URL fallback. Zero API dependencies. Portable IMMEDIATELY. (2) Resolver triangulation uses FUNCTION INJECTION — resolvers receive client callable as parameter. Our CrossrefClient.verify_doi can be passed directly. Only OpenAlex and Arxiv clients needed for full 4-resolver triangulation. Preprint venues: arXiv, bioRxiv, medRxiv, SSRN, Research Square, Preprints.org, ChemRxiv, EarthArXiv, OSF Preprints, TechRxiv.","timestamp":1780657658357,"segment":161,"confidence":6,"asi":{"best_skill":"codebase-explorer (trace client consumption in contamination_signals)","discovery":"CRITICAL: compute_preprint_signal is PURE LOGIC with zero API dependencies. It only checks year >= 2024 AND venue in PREPRINT_VENUES (10-item closed list) with source_pointer URL fallback. This means contamination detection can be ported IMMEDIATELY without waiting for arXiv/OpenAlex clients","architecture":"contamination_signals uses FUNCTION INJECTION — resolvers receive a client callable as parameter, not a Protocol object. This means our CrossrefClient.verify_doi can be passed directly as the lookup function. No Protocol implementation needed","two_components":{"preprint_signal":"PURE LOGIC — venue + year check, zero API calls, portable NOW","resolver_triangulation":"Needs API clients — CrossrefClient (HAVE) + OpenAlex (NEED) + Arxiv (NEED)"},"resolver_signatures":"resolve_*_unmatched(entry, client, *, cache=None) — takes entry dict + client object with .doi_lookup / .title_search methods","preprint_venues":"arXiv, bioRxiv, medRxiv, SSRN, Research Square, Preprints.org, ChemRxiv, EarthArXiv, OSF Preprints, TechRxiv","dependency_chain_revised":"compute_preprint_signal (port NOW) → contamination_signals (port with stubs) → full triangulation (port after arXiv + OpenAlex clients)"}}
{"type":"config","name":"Preprint venue detection: data availability and porting feasibility","metricName":"missing_data_fields","metricUnit":"fields","bestDirection":"lower"}
{"run":312,"commit":"957ced5","metric":2,"metrics":{},"status":"keep","description":"Baseline: data availability for preprint venue detection. search.py already extracts venue from S2 API (line 344) and writes it to BibTeX as journal/booktitle. quality_appraisal.py uses venue for tier scoring. BUT citation_verify.py does NOT consume venue data. Only 2 fields missing from citation_verify: 'venue' (exists in BibTeX as journal/booktitle but not read) and 'source_pointer' (not tracked anywhere). The venue data gap is in CONSUMPTION, not capture.","timestamp":1780657916852,"segment":162,"confidence":null,"asi":{"best_skill":"cli-explorer (field availability scan across pipeline)","hypothesis":"Our pipeline does not capture venue data needed for preprint detection","result":"PARTIALLY WRONG. search.py DOES extract venue (line 344: venue = paper.get('venue')), writes it to BibTeX as journal/booktitle (lines 373-399). chaining.py also has venue. quality_appraisal.py uses venue for tier scoring. The data EXISTS in the pipeline but citation_verify.py does NOT consume it. Only 2 fields truly missing from citation_verify: 'venue' and 'source_pointer'","data_availability":{"year":"Available in search.py, chaining.py, quality_appraisal.py, bibliography.py, citation_format.py","venue":"Available in search.py (as journal/booktitle in BibTeX), chaining.py, quality_appraisal.py","source_pointer":"NOT available anywhere — no URL source tracking in any file"},"gap_location":"citation_verify.py ignores venue data that exists in BibTeX entries. The venue is stored as journal/booktitle in BibTeX and could be read during citation verification","porting_estimate":"compute_preprint_signal needs ~30 loc. Reading venue from BibTeX entries in citation_verify needs ~10 loc. Total: ~40 loc for basic preprint detection with zero new dependencies"}}
{"run":313,"commit":"ff95959","metric":0,"metrics":{},"status":"keep","description":"citation_verify reads citations from RENDERED MANUSCRIPT text (regex-parsed numbered references in the references section), not from BibTeX entries directly. It extracts doi and title from the text. To add preprint detection: venue data exists in manuscript reference text (e.g. 'arXiv preprint', 'bioRxiv') but is NOT extracted. Two approaches: (A) Extract venue from reference text via regex (~55 loc), or (B) Read BibTeX entries directly for structured venue data (cleaner but different data path). Both require zero new dependencies.","timestamp":1780658039323,"segment":162,"confidence":null,"asi":{"best_skill":"codebase-explorer (trace citation_verify data flow)","discovery":"citation_verify extracts citations from RENDERED MANUSCRIPT text (section 'references'), not from BibTeX entries. It parses numbered references using regex (r'^\\s*\\d+[\\.\\)]\\s') and extracts doi + title from the text. To add preprint detection, we need to ALSO extract venue/journal from the reference text. The venue data exists in the manuscript as 'Journal of X' or 'arXiv preprint' text within each reference","porting_plan_revised":"Instead of reading BibTeX fields, preprint detection should: (1) Parse venue from reference text (regex for 'arXiv', 'bioRxiv' etc in the reference string), (2) Parse year from reference text (4-digit number), (3) Apply the same PREPRINT_VENUES check","data_flow":"search.py writes venue to BibTeX as journal/booktitle → PandocRenderer renders it in manuscript references section → citation_verify reads the rendered text → but does NOT extract venue from it","effort":"~30 loc for venue extraction regex + ~15 loc for preprint check + ~10 test cases = ~55 loc total","alternative_approach":"Could also read BibTeX entries directly (bypass rendered text) for structured venue data. This would be cleaner but requires a different data path"}}
{"run":314,"commit":"d2113d6","metric":0,"metrics":{},"status":"keep","description":"Best approach identified: extend bibliography.py with preprint venue detection. bibliography.py already parses all BibTeX entries and reads journal/booktitle fields (line 33: article requires journal, line 35: inproceedings requires booktitle). Adding PREPRINT_VENUES frozenset check on already-parsed structured data is ~15 loc. No new files, no new ToolWrapper, no new data fields. Findings flow through existing BibliographyNormalizer. Zero new dependencies.","timestamp":1780658111449,"segment":162,"confidence":null,"asi":{"best_approach":"Approach C — extend bibliography.py with preprint venue check","rationale":"bibliography.py ALREADY parses all BibTeX entries and reads journal/booktitle fields (line 33-35). Adding a PREPRINT_VENUES frozenset check is ~15 loc. No new files, no new ToolWrapper, no new data fields. Findings flow through existing BibliographyNormalizer ToolWrapper which is already wired in the Orchestrator","bibliography_required_fields":"article requires {author, title, journal, year}. inproceedings requires {author, title, booktitle, year}. Both contain venue data (journal/booktitle) and year","implementation_plan":"1. Add PREPRINT_VENUES frozenset to bibliography.py (10 items from ARS). 2. In validate_entry_type or a new _check_preprint_venue function: if entry.journal/booktitle in PREPRINT_VENUES and entry.year >= 2024 → add finding code 'preprint_citation' severity 'warning'. 3. ~15 loc new code. 4. ~8-10 test cases","zero_dependencies":"No new imports, no API clients, no new files. Pure logic check on already-parsed structured data"}}
{"type":"config","name":"Add preprint venue detection to bibliography.py","metricName":"preprint_venues_checked","metricUnit":"count","bestDirection":"higher"}
{"run":315,"commit":"5f942cc","metric":0,"metrics":{},"status":"keep","description":"Baseline: 0 preprint venue checks in bibliography.py. No PREPRINT_VENUES constant, no venue-based quality assessment. The file validates entry types, required fields, DOI format, and year range but never checks journal/booktitle against known preprint servers.","timestamp":1780658225545,"segment":163,"confidence":null,"asi":{"hypothesis":"bibliography.py has zero preprint venue detection","metric":"preprint_venues_checked = number of preprint-related checks in the file"}}
{"run":348,"commit":"0d01abb","metric":0,"metrics":{"preprint_venues":12,"new_tests":18},"status":"keep","description":"Preprint venue detection in citation_verify: _detect_preprint() uses venue+year from Crossref/S2 API results. 12 known preprint venues (arXiv, bioRxiv, medRxiv, SSRN, ChemRxiv, EarthArXiv, etc.). Flagged as P2 informational findings. Also wired PaperSearchProvider into adapter for real search. 1189 tests pass, 14 new preprint tests + 4 MCP smoke tests.","timestamp":1780658547968,"segment":180,"confidence":null,"asi":{"hypothesis":"citation_verify can detect preprints using venue+year already returned by Crossref/S2 APIs","key_insight":"source_pointer (BibTeX URL) was a red herring — API results provide venue directly","fields_consumed":["doi","venue","year"],"fields_eliminated":["source_pointer"],"preprint_venues_count":12,"new_tests":18}}
{"type":"config","name":"Uncited assertion detection in prose rules","metricName":"uncited_assertion_rules","metricUnit":"count","bestDirection":"higher"}
{"run":349,"commit":"e709683","metric":0,"metrics":{},"status":"keep","description":"Baseline: 0/29 prose rules check citation presence. Rules detect empirical verbs, quantifiers, and causal language but never verify the sentence has a citation marker. From run #306: our prose rules satisfy only condition 1 of ARS 3-condition rule (quantifier/empirical verb), missing conditions 2 (no citation marker) and 3 (not definitional).","timestamp":1780658815034,"segment":181,"confidence":null,"asi":{"hypothesis":"Zero prose rules check citation presence when detecting empirical claims"}}
{"run":316,"commit":"76c2592","metric":10,"metrics":{},"status":"keep","description":"Add preprint venue detection to bibliography.py. PREPRINT_VENUES constant (10 servers: arXiv, bioRxiv, medRxiv, SSRN, Research Square, Preprints.org, ChemRxiv, EarthArXiv, OSF Preprints, TechRxiv). detect_preprint_venues() checks journal/booktitle fields with exact + substring matching. Year >= 2024 → severity warning (recent preprint), otherwise info. Wired into validate_bibliography() loop. 14 new tests (10 integration scenarios + 4 unit tests). 1217 total tests pass, 0 regressions. Zero new dependencies.","timestamp":1780658823626,"segment":163,"confidence":null,"asi":{"best_skill":"codebase-explorer (data flow analysis led to correct insertion point)","hypothesis":"Adding PREPRINT_VENUES check to bibliography.py is ~15 loc with zero new dependencies","result":"CONFIRMED. Added detect_preprint_venues() function (67 loc) + PREPRINT_VENUES constant (10 venues) + wired into validate_bibliography loop. 14 new tests (10 integration + 4 unit). All 1217 tests pass. The implementation handles: exact match, case-insensitive match, substring match for compound venue names, journal and booktitle fields, year-based severity (warning for >=2024, info for older)","implementation_details":{"new_constant":"PREPRINT_VENUES frozenset with 10 venues (arXiv, bioRxiv, medRxiv, SSRN, Research Square, Preprints.org, ChemRxiv, EarthArXiv, OSF Preprints, TechRxiv)","new_function":"detect_preprint_venues(fields, entry_key) — checks journal/booktitle against venues","severity_logic":"year >= 2024 → warning (recent preprint, may lack peer review). year < 2024 or no year → info","matching":"Exact case-insensitive match first, then substring match for compound names","insertion_point":"validate_bibliography() loop, after validate_year_range"},"tests_added":14,"regressions":0,"total_tests":1217}}
{"type":"config","name":"Add uncited assertion detection to prose validator","metricName":"uncited_assertion_rules","metricUnit":"count","bestDirection":"higher"}
{"run":317,"commit":"9cd3d73","metric":3,"metrics":{},"status":"keep","description":"Baseline: 3/7 prose rules reference citations in YAML (weasel, causal_language, unsupported_certainty) but prose.py never enforces citation presence. evidence_required field exists in _build_finding output but is purely informational. Pandoc citation syntax [@key] is detectable with regex in sentence text. parsers/manuscript.py extracts sentences with position info. Implementation path: check each sentence matching a prose rule for citation marker presence before flagging.","timestamp":1780659048926,"segment":164,"confidence":null,"asi":{"best_skill":"cli-explorer (citation pattern detection in draft outputs)","hypothesis":"Zero prose rules check citation presence despite 3/7 having evidence_required: [citation] in YAML","result":"CONFIRMED. weasel.yml, causal_language.yml, unsupported_certainty.yml all have citation references in their YAML but prose.py never checks. The _build_finding method includes evidence_required field but it is purely informational — no enforcement. Pandoc citation syntax is [@key] — detectable with regex r'\\[@[^]]+\\]'. parsers/manuscript.py extracts sentences. The implementation path is clear: check each sentence that matches a prose rule for citation presence","citation_syntax":"[@key] — Pandoc-style citations in our rendered drafts. Also (Author, Year) narrative form","evidence_required_field":"causal_language.yml has evidence_required: [citation] on 4 patterns. weasel.yml mentions citation in message/recommendation. unsupported_certainty.yml mentions cite in recommendation. All decorative — prose.py reads but never enforces","sentence_data_available":"manuscript.sentences has text, line, col, char_start, char_end. Can apply citation regex to each sentence text"}}
{"run":350,"commit":"b0fdab3","metric":9,"metrics":{},"status":"keep","description":"Add citation-presence checking to 9 empirical prose rules. Rules with evidence_required: [citation] now check if the matching sentence contains a citation marker (\\\\cite{}, [n], (Author, Year)). Uncited empirical claims get rule_id prefixed with 'uncited_' and message clarifies the issue. Covers: causal verbs (4 rules), overclaim (4 rules), quantifiers (1 rule). 1189 tests pass.","timestamp":1780659096563,"segment":181,"confidence":null,"asi":{"hypothesis":"Adding evidence_required: [citation] to empirical prose rules + checking citation markers in sentences enables uncited assertion detection","citation_rules":["prose.causal.strong_verb","prose.causal.mediating","prose.causal.driven_by","prose.causal.directional","prose.overclaim.definitive_causal","prose.overclaim.absolute","prose.overclaim.first_superlative","prose.overclaim.significance_drift","prose.quantifier.overwhelming"],"implementation":"CITATION_MARKER_RE matches \\cite{}, [n], (Author, Year) patterns. When rule has evidence_required: [citation] and sentence has no marker, finding rule_id is prefixed with 'uncited_' and message clarifies uncited nature."}}
{"run":318,"commit":"237cb21","metric":5,"metrics":{},"status":"keep","description":"Bug: CITATION_MARKER_RE covers 5/10 citation patterns but misses Pandoc [@key] syntax — the format our pipeline actually generates. Current regex matches LaTeX \\\\cite{}, numeric [1], ranges [1-3, 5], Author-Year, and Author et al. But Pandoc [@key], [@key, @key2], [@key, p. 15], and bare @key are all missed. This causes FALSE POSITIVES: prose rules with evidence_required: [citation] flag sentences containing our own Pandoc citations as uncited.","timestamp":1780659164007,"segment":164,"confidence":null,"asi":{"best_skill":"cli-explorer (test CITATION_MARKER_RE against real draft output)","hypothesis":"CITATION_MARKER_RE already handles citation detection","result":"PARTIAL — covers LaTeX \\cite{}, numeric [1], numeric ranges [1-3, 5], Author-Year, Author et al. But MISSING Pandoc [@key] syntax which is what our pipeline actually generates! Coverage is 5/10 patterns. The uncited assertion detection exists but will produce FALSE POSITIVES on our own drafts because Pandoc [@key] is not recognized as a citation. This is a real bug","coverage":{"matches":["\\cite{key}","[1]","[1-3, 5]","(Author, Year)","(Author et al., Year)"],"missing":["[@key] (Pandoc)","[@key, @key2] (Pandoc multi)","[@key, p. 15] (Pandoc with locator)","@key (bare Pandoc)"]},"impact":"Any prose rule with evidence_required: [citation] will flag sentences with Pandoc [@key] citations as UNCITED, generating false positive warnings","fix":"Add |\\[@[^]]+\\] and |@\\w+[\\w:-]* to CITATION_MARKER_RE"}}
{"run":319,"commit":"7285c96","metric":7,"metrics":{},"status":"keep","description":"Fix CITATION_MARKER_RE to recognize Pandoc [@key] citations — the format our pipeline generates. Added 2 patterns: \\\\[@[^]]+\\\\] (bracketed Pandoc) and @\\\\w+[\\\\w:-]* (bare Pandoc). Coverage: 14/14 citation patterns now detected (was 5/10). Fixed test_pandoc_at_key which was documenting the bug (assert not match → assert match). This eliminates false positives where prose rules with evidence_required: [citation] flagged sentences containing our own Pandoc citations as uncited. 1231 tests pass, 0 regressions.","timestamp":1780659338137,"segment":164,"confidence":2,"asi":{"best_skill":"cli-explorer (pattern coverage testing)","hypothesis":"Adding Pandoc [@key] to CITATION_MARKER_RE fixes false positives on our own drafts","result":"CONFIRMED. Added 2 Pandoc patterns: |\\[@[^]]+\\] (bracketed) and |@\\w+[\\w:-]* (bare). Coverage went from 5/10 to 14/14 test cases. Fixed test_pandoc_at_key which was documenting the bug (expected no match). Now correctly recognizes Pandoc citations. 1231 tests pass, 0 regressions","patterns_added":["\\[@[^]]+\\] — Pandoc bracketed [@key], [@key, p. 15], [-@key]","@\\w+[\\w:-]* — Bare Pandoc @key for narrative citations"],"false_positive_fix":"Before: sentences with 'causes X [@smith2024]' were flagged as uncited. After: Pandoc citation detected, no false positive","test_update":"test_pandoc_at_key was asserting NO match (documenting bug). Changed to assert match (verifying fix)","total_tests":1231,"regressions":0}}
{"type":"config","name":"Contamination signal components","metricName":"contamination_components_missing","metricUnit":"count","bestDirection":"lower"}
{"type":"config","name":"Validate uncited assertion detection reduces false positives on real drafts","metricName":"false_positive_uncited","metricUnit":"count","bestDirection":"lower"}
{"run":351,"commit":"959e1f9","metric":2,"metrics":{},"status":"keep","description":"Baseline: 2 contamination components missing. Preprint detection DONE (_detect_preprint with 12 venues). Year extraction DONE (from API results). Missing: (1) multi-resolver triangulation (needs OpenAlex + arXiv clients), (2) quality-tier cross-reference (venue_tier exists in quality_appraisal but not used for contamination signals).","timestamp":1780659425266,"segment":182,"confidence":null,"asi":{"hypothesis":"2 contamination components missing: multi-resolver triangulation and quality-tier cross-reference"}}
{"run":320,"commit":"83c564e","metric":0,"metrics":{},"status":"keep","description":"Validation: Pandoc citation fix eliminates all false positives. On 10 real sentences: OLD regex had 2 FPs (missed Pandoc [@key]), NEW regex has 0. 4 empirical claims without citations correctly identified as flaggable. 1 definitional sentence ('RAG refers to...') should be excluded per ARS condition 3 but isn't filtered yet. This is the remaining gap: ARS uncited_assertion_detector excludes sentences matching 'refers to'/'is defined as'/'we define' but our prose rules don't have this exclusion.","timestamp":1780659504662,"segment":165,"confidence":null,"asi":{"best_skill":"cli-explorer (false positive analysis on real draft sentences)","hypothesis":"Pandoc citation fix eliminates false positives in uncited assertion detection","result":"CONFIRMED. 0 false positives with new regex (was 2 with old). On 10 real sentences: 3 have citations (all correctly detected), 7 without citations. Of the 7: 4 are empirical claims that SHOULD be flagged, 2 are general claims (no strong empirical verb + quantifier), 1 is definitional (should be excluded). The definitional exclusion is NOT implemented — ARS uncited_assertion_detector has condition 3 (not definitional) but our prose rules don't filter these","false_positives_eliminated":2,"correctly_flagged_uncited":4,"definitional_gap":"RAG refers to the technique of augmenting language model generation with retrieved documents — should be excluded from uncited flags. ARS excludes sentences matching 'refers to'/'is defined as'/'we define'. Our prose rules don't have this filter","next":"Add definitional sentence exclusion to prose validator — the 3rd condition from ARS uncited_assertion_detector"}}
{"type":"config","name":"Add definitional sentence exclusion to prose validator","metricName":"definitional_exclusion_patterns","metricUnit":"count","bestDirection":"higher"}
{"run":321,"commit":"e10b0d0","metric":0,"metrics":{},"status":"keep","description":"Baseline: 0 definitional exclusion patterns in prose.py. ARS uncited_assertion_detector has condition 3 that excludes sentences matching 'refers to', 'is defined as', 'we define', 'for the purposes of'. Our prose validator does not filter these, causing potential false positives on definitional sentences like 'RAG refers to the technique of augmenting language model generation with retrieved documents.'","timestamp":1780659543417,"segment":166,"confidence":null,"asi":{"hypothesis":"prose.py has zero definitional sentence exclusion"}}
